Bus Hound 6.01 capture on Windows Vista Service Pack 1 (x64). Complements of www.perisoft.net

USB摄像头usb调试信息

  Device - Device ID (followed by the endpoint for USB devices)
            (26) USB 视频设备
  Length - Total transfer length
  Phase  - Phase Type
            CTL   USB control transfer       
            IN    Data in transfer           
            ISOC  Isochronous transfer       
            OUT   Data out transfer          
            RESET bus reset                  
  Data   - Hex dump of the data transferred
  Descr  - Description of the phase
  Cmd... - Position in the captured data


Device  Length    Phase  Data                                                Description       Cmd.Phase.Ofs(rep)
------  --------  -----  --------------------------------------------------  ----------------  ------------------
  26.0            CTL    a1 81 00 01  01 00 1a 00                            GET CUR                  1.1.0        
  26.0        26  IN     00 00 01 01  15 16 05 00  00 00 00 00  00 00 00 00  ................         1.2.0        
                         00 00 00 60  09 00 b8 0b  00 00                     ...`......               1.2.16       
  26.0            CTL    a1 83 00 01  01 00 1a 00                            GET MAX                  2.1.0        
  26.0        26  IN     00 00 01 01  15 16 05 00  00 00 00 00  00 00 00 00  ................         2.2.0        
                         00 00 00 60  09 00 b8 0b  00 00                     ...`......               2.2.16       
  26.0            CTL    a1 82 00 01  01 00 1a 00                            GET MIN                  3.1.0        
  26.0        26  IN     00 00 01 01  15 16 05 00  00 00 00 00  00 00 00 00  ................         3.2.0        
                         00 00 00 60  09 00 b8 0b  00 00                     ...`......               3.2.16       
  26.0            CTL    21 01 00 01  01 00 1a 00                            SET CUR                  4.1.0        
  26.0        26  OUT    00 00 01 04  15 16 05 00  00 00 00 00  00 00 00 00  ................         4.2.0        
                         00 00 00 60  09 00 00 00  00 00                     ...`......               4.2.16       
  26.0            CTL    a1 81 00 01  01 00 1a 00                            GET CUR                  5.1.0        
  26.0        26  IN     00 00 01 04  15 16 05 00  00 00 00 00  00 00 00 00  ................         5.2.0        
                         00 00 00 58  02 00 b8 0b  00 00                     ...X......               5.2.16       
  26.0            CTL    a1 83 00 01  01 00 1a 00                            GET MAX                  6.1.0        
  26.0        26  IN     00 00 01 04  15 16 05 00  00 00 00 00  00 00 00 00  ................         6.2.0        
                         00 00 00 58  02 00 b8 0b  00 00                     ...X......               6.2.16       
  26.0            CTL    a1 82 00 01  01 00 1a 00                            GET MIN                  7.1.0        
  26.0        26  IN     00 00 01 04  15 16 05 00  00 00 00 00  00 00 00 00  ................         7.2.0        
                         00 00 00 58  02 00 b8 0b  00 00                     ...X......               7.2.16       
  26.0            CTL    21 01 00 01  01 00 1a 00                            SET CUR                  8.1.0        
  26.0        26  OUT    00 00 01 04  15 16 05 00  00 00 00 00  00 00 00 00  ................         8.2.0        
                         00 00 00 58  02 00 00 00  00 00                     ...X......               8.2.16       
  26.0            CTL    a1 81 00 01  01 00 1a 00                            GET CUR                  9.1.0        
  26.0        26  IN     00 00 01 04  15 16 05 00  00 00 00 00  00 00 00 00  ................         9.2.0        
                         00 00 00 58  02 00 b8 0b  00 00                     ...X......               9.2.16       
  26.0            CTL    21 01 00 02  01 00 1a 00                            SET CUR                 10.1.0        
  26.0        26  OUT    00 00 01 04  15 16 05 00  00 00 00 00  00 00 00 00  ................        10.2.0        
                         00 00 00 58  02 00 b8 0b  00 00                     ...X......              10.2.16       
  26.0            CTL    01 0b 0b 00  01 00 00 00                            SET INTERFACE           11.1.0        
  26.3     42848  ISOC   00 00 00 00  00 00 00 00  00 00 00 00  00 00 00 00  ................        12.1.0        
                         00 00 00 00  00 00 00 00  00 00 00 00  00 00 00 00  ................        12.1.16       
                         00 00 00 00  00 00 00 00  00 00 00 00  00 00 00 00  ................        12.1.32       
                         00 00 00 00  00 00 00 00  00 00 00 00  00 00 00 00  ................        12.1.48       
                         00 00 00 00  00 00 00 00  00 00 00                  ...........             12.1.64       
  26.3     36108  ISOC   0c 8c 00 00  00 00 dc 74  f6 b6 b9 07  10 80 10 80  .......t........        13.1.0        
                         10 80 10 80  10 80 10 80  10 80 10 80  10 80 10 80  ................        13.1.16       
                         10 80 10 80  10 80 10 80  10 80 10 80  10 80 10 80  ................        13.1.32       
                         10 80 10 80  00 00 00 00  00 00 00 00  00 00 00 00  ................        13.1.48       
                         00 00 00 00  00 00 00 00  00 00 00                  ...........             13.1.64       
  26.3     36108  ISOC   0c 8c 00 00  00 00 37 a4  03 b7 39 00  10 80 10 80  ......7...9.....        14.1.0        
                         10 80 10 80  10 80 10 80  10 80 10 80  10 80 10 80  ................        14.1.16       
                         10 80 10 80  10 80 10 80  00 00 00 00  00 00 00 00  ................        14.1.32       
                         00 00 00 00  00 00 00 00  00 00 00 00  00 00 00 00  ................        14.1.48       
                         00 00 00 00  00 00 00 00  00 00 00                  ...........             14.1.64       
  26.3     36108  ISOC   0c 8c 00 00  00 00 96 d3  10 b7 b9 00  10 80 10 80  ................        15.1.0        
                         10 80 10 80  10 80 10 80  10 80 10 80  00 00 00 00  ................        15.1.16       
                         00 00 00 00  00 00 00 00  00 00 00 00  00 00 00 00  ................        15.1.32       
                         00 00 00 00  00 00 00 00  00 00 00 00  00 00 00 00  ................        15.1.48       
                         00 00 00 00  00 00 00 00  00 00 00                  ...........             15.1.64       
  26.3      2020  ISOC   0c 8c 00 00  00 00 f1 02  1e b7 39 01  10 80 10 80  ..........9.....        16.1.0        
                         00 00 00 00  00 00 00 00  00 00 00 00  00 00 00 00  ................        16.1.16       
                         00 00 00 00  00 00 00 00  00 00 00 00  00 00 00 00  ................        16.1.32       
                         00 00 00 00  00 00 00 00  00 00 00 00  00 00 00 00  ................        16.1.48       
                         00 00 00 00  00 00 00 00  00 00 00                  ...........             16.1.64       
  26           0  ISOC                                                                               17.1.0(4)     
  26.3      1440  ISOC   0c 8c 00 00  00 00 dc 74  f6 b6 b9 07  10 80 10 80  .......t........        21.1.0        
                         10 80 10 80  10 80 10 80  10 80 10 80  10 80 10 80  ................        21.1.16       
                         10 80 10 80  10 80 10 80  10 80 10 80  10 80 10 80  ................        21.1.32       
                         10 80 10 80  00 00 00 00  00 00 00 00  00 00 00 00  ................        21.1.48       
                         00 00 00 00  00 00 00 00  00 00 00                  ...........             21.1.64       
  26.3      1536  ISOC   0c 8d de f1  60 b7 18 1f  6d b7 39 04  10 80 10 80  ....`...m.9.....        22.1.0        
                         10 80 10 80  10 80 10 80  10 80 10 80  10 80 10 80  ................        22.1.16       
                         10 80 10 80  10 80 10 80  00 00 00 00  00 00 00 00  ................        22.1.32       
                         00 00 00 00  00 00 00 00  00 00 00 00  00 00 00 00  ................        22.1.48       
                         00 00 00 00  00 00 00 00  00 00 00                  ...........             22.1.64       
  26.3      1536  ISOC   0c 8d de f1  60 b7 74 4e  7a b7 b9 04  10 80 10 80  ....`.tNz.......        23.1.0        
                         10 80 10 80  10 80 10 80  10 80 10 80  00 00 00 00  ................        23.1.16       
                         00 00 00 00  00 00 00 00  00 00 00 00  00 00 00 00  ................        23.1.32       
                         00 00 00 00  00 00 00 00  00 00 00 00  00 00 00 00  ................        23.1.48       
                         00 00 00 00  00 00 00 00  00 00 00                  ...........             23.1.64       
  26.3      1536  ISOC   0c 8d de f1  60 b7 d4 7d  87 b7 39 05  10 80 10 80  ....`.....9.....        24.1.0        
                         00 00 00 00  00 00 00 00  00 00 00 00  00 00 00 00  ................        24.1.16       
                         00 00 00 00  00 00 00 00  00 00 00 00  00 00 00 00  ................        24.1.32       
                         00 00 00 00  00 00 00 00  00 00 00 00  00 00 00 00  ................        24.1.48       
                         00 00 00 00  00 00 00 00  00 00 00                  ...........             24.1.64       
  26.3      1536  ISOC   0c 8d de f1  60 b7 30 ad  94 b7 b9 05  00 00 00 00  ....`.0.........        25.1.0        
                         00 00 00 00  00 00 00 00  00 00 00 00  00 00 00 00  ................        25.1.16       
                         00 00 00 00  00 00 00 00  00 00 00 00  00 00 00 00  ................        25.1.32       
                         00 00 00 00  00 00 00 00  00 00 00 00  00 00 00 00  ................        25.1.48       
                         00 00 00 00  00 00 00 00  00 00 00                  ...........             25.1.64       
  26.3      1536  ISOC   0c 8d de f1  60 b7 8c dc  a1 b7 39 06  00 00 00 00  ....`.....9.....        26.1.0        
                         00 00 00 00  00 00 00 00  00 00 00 00  00 00 00 00  ................        26.1.16       
                         00 00 00 00  00 00 00 00  00 00 00 00  00 00 00 00  ................        26.1.32       
                         00 00 00 00  00 00 00 00  00 00 00 00  00 00 00 00  ................        26.1.48       
                         00 00 00 00  00 00 00 00  00 00 00                  ...........             26.1.64       
  26.3      1536  ISOC   0c 8d de f1  60 b7 e4 0b  af b7 b9 06  00 00 00 00  ....`...........        27.1.0        
                         00 00 00 00  00 00 00 00  00 00 00 00  00 00 00 00  ................        27.1.16       
                         00 00 00 00  00 00 00 00  00 00 00 00  00 00 00 00  ................        27.1.32       
                         00 00 00 00  00 00 00 00  00 00 00 00  00 00 00 00  ................        27.1.48       
                         00 00 00 00  00 00 00 00  00 00 00                  ...........             27.1.64       
  26.3      1536  ISOC   0c 8d de f1  60 b7 44 3b  bc b7 39 07  00 00 00 00  ....`.D;..9.....        28.1.0        
                         00 00 00 00  00 00 00 00  00 00 00 00  00 00 00 00  ................        28.1.16       
                         00 00 00 00  00 00 00 00  00 00 00 00  00 00 00 00  ................        28.1.32       
                         00 00 00 00  00 00 00 00  00 00 00 00  00 00 00 00  ................        28.1.48       
                         00 00 00 00  00 00 00 00  00 00 00                  ...........             28.1.64       
  26.3      1536  ISOC   0c 8d de f1  60 b7 a0 6a  c9 b7 b9 07  10 80 10 80  ....`..j........        29.1.0        
                         10 80 10 80  10 80 10 80  10 80 10 80  10 80 10 80  ................        29.1.16       
                         10 80 10 80  10 80 10 80  10 80 10 80  10 80 10 80  ................        29.1.32       
                         10 80 10 80  00 00 00 00  00 00 00 00  00 00 00 00  ................        29.1.48       
                         00 00 00 00  00 00 00 00  00 00 00                  ...........             29.1.64       
  26.3      1536  ISOC   0c 8d de f1  60 b7 fc 99  d6 b7 39 00  10 80 10 80  ....`.....9.....        30.1.0        
                         10 80 10 80  10 80 10 80  10 80 10 80  10 80 10 80  ................        30.1.16       
                         10 80 10 80  10 80 10 80  00 00 00 00  00 00 00 00  ................        30.1.32       
                         00 00 00 00  00 00 00 00  00 00 00 00  00 00 00 00  ................        30.1.48       
                         00 00 00 00  00 00 00 00  00 00 00                  ...........             30.1.64       
  26.3      1536  ISOC   0c 8d de f1  60 b7 54 c9  e3 b7 b9 00  10 80 10 80  ....`.T.........        31.1.0        
                         10 80 10 80  10 80 10 80  10 80 10 80  00 00 00 00  ................        31.1.16       
                         00 00 00 00  00 00 00 00  00 00 00 00  00 00 00 00  ................        31.1.32       
                         00 00 00 00  00 00 00 00  00 00 00 00  00 00 00 00  ................        31.1.48       
                         00 00 00 00  00 00 00 00  00 00 00                  ...........             31.1.64       
  26.3      1536  ISOC   0c 8d de f1  60 b7 b4 f8  f0 b7 39 01  10 80 10 80  ....`.....9.....        32.1.0        
                         00 00 00 00  00 00 00 00  00 00 00 00  00 00 00 00  ................        32.1.16       
                         00 00 00 00  00 00 00 00  00 00 00 00  00 00 00 00  ................        32.1.32       
                         00 00 00 00  00 00 00 00  00 00 00 00  00 00 00 00  ................        32.1.48       
                         00 00 00 00  00 00 00 00  00 00 00                  ...........             32.1.64       
  26.3      1536  ISOC   0c 8d de f1  60 b7 10 28  fe b7 b9 01  00 00 00 00  ....`..(........        33.1.0        
                         00 00 00 00  00 00 00 00  00 00 00 00  00 00 00 00  ................        33.1.16       
                         00 00 00 00  00 00 00 00  00 00 00 00  00 00 00 00  ................        33.1.32       
                         00 00 00 00  00 00 00 00  00 00 00 00  00 00 00 00  ................        33.1.48       
                         00 00 00 00  00 00 00 00  00 00 00                  ...........             33.1.64       
  26.3      1536  ISOC   0c 8d de f1  60 b7 6c 57  0b b8 39 02  00 00 00 00  ....`.lW..9.....        34.1.0        
                         00 00 00 00  00 00 00 00  00 00 00 00  00 00 00 00  ................        34.1.16       
                         00 00 00 00  00 00 00 00  00 00 00 00  00 00 00 00  ................        34.1.32       
                         00 00 00 00  00 00 00 00  00 00 00 00  00 00 00 00  ................        34.1.48       
                         00 00 00 00  00 00 00 00  00 00 00                  ...........             34.1.64       
  26.3      1536  ISOC   0c 8d de f1  60 b7 c8 86  18 b8 b9 02  00 00 00 00  ....`...........        35.1.0        
                         00 00 00 00  00 00 00 00  00 00 00 00  00 00 00 00  ................        35.1.16       
                         00 00 00 00  00 00 00 00  00 00 00 00  00 00 00 00  ................        35.1.32       
                         00 00 00 00  00 00 00 00  00 00 00 00  00 00 00 00  ................        35.1.48       
                         00 00 00 00  00 00 00 00  00 00 00                  ...........             35.1.64       
  26.3      1536  ISOC   0c 8d de f1  60 b7 24 b6  25 b8 39 03  00 00 00 00  ....`.$.%.9.....        36.1.0        
                         00 00 00 00  00 00 00 00  00 00 00 00  00 00 00 00  ................        36.1.16       
                         00 00 00 00  00 00 00 00  00 00 00 00  00 00 00 00  ................        36.1.32       
                         00 00 00 00  00 00 00 00  00 00 00 00  00 00 00 00  ................        36.1.48       
                         00 00 00 00  00 00 00 00  00 00 00                  ...........             36.1.64       
  26.3      1536  ISOC   0c 8d de f1  60 b7 80 e5  32 b8 b9 03  10 80 10 80  ....`...2.......        37.1.0        
                         10 80 10 80  10 80 10 80  10 80 10 80  10 80 10 80  ................        37.1.16       
                         10 80 10 80  10 80 10 80  10 80 10 80  10 80 10 80  ................        37.1.32       
                         10 80 10 80  00 00 00 00  00 00 00 00  00 00 00 00  ................        37.1.48       
                         00 00 00 00  00 00 00 00  00 00 00                  ...........             37.1.64       
  26.3      1536  ISOC   0c 8d de f1  60 b7 dc 14  40 b8 39 04  10 80 10 80  ....`...@.9.....        38.1.0        
                         10 80 10 80  10 80 10 80  10 80 10 80  10 80 10 80  ................        38.1.16       
                         10 80 10 80  10 80 10 80  00 00 00 00  00 00 00 00  ................        38.1.32       
                         00 00 00 00  00 00 00 00  00 00 00 00  00 00 00 00  ................        38.1.48       
                         00 00 00 00  00 00 00 00  00 00 00                  ...........             38.1.64       
  26.3      1536  ISOC   0c 8d de f1  60 b7 38 44  4d b8 b9 04  10 80 10 80  ....`.8DM.......        39.1.0        
                         10 80 10 80  10 80 10 80  10 80 10 80  00 00 00 00  ................        39.1.16       
                         00 00 00 00  00 00 00 00  00 00 00 00  00 00 00 00  ................        39.1.32       
                         00 00 00 00  00 00 00 00  00 00 00 00  00 00 00 00  ................        39.1.48       
                         00 00 00 00  00 00 00 00  00 00 00                  ...........             39.1.64       
  26.3      1536  ISOC   0c 8d de f1  60 b7 94 73  5a b8 39 05  10 80 10 80  ....`..sZ.9.....        40.1.0        
                         00 00 00 00  00 00 00 00  00 00 00 00  00 00 00 00  ................        40.1.16       
                         00 00 00 00  00 00 00 00  00 00 00 00  00 00 00 00  ................        40.1.32       
                         00 00 00 00  00 00 00 00  00 00 00 00  00 00 00 00  ................        40.1.48       
                         00 00 00 00  00 00 00 00  00 00 00                  ...........             40.1.64       
  26.3      1536  ISOC   0c 8d de f1  60 b7 f4 a2  67 b8 b9 05  00 00 00 00  ....`...g.......        41.1.0        
                         00 00 00 00  00 00 00 00  00 00 00 00  00 00 00 00  ................        41.1.16       
                         00 00 00 00  00 00 00 00  00 00 00 00  00 00 00 00  ................        41.1.32       
                         00 00 00 00  00 00 00 00  00 00 00 00  00 00 00 00  ................        41.1.48       
                         00 00 00 00  00 00 00 00  00 00 00                  ...........             41.1.64       
  26.3      1536  ISOC   0c 8d de f1  60 b7 50 d2  74 b8 39 06  00 00 00 00  ....`.P.t.9.....        42.1.0        
                         00 00 00 00  00 00 00 00  00 00 00 00  00 00 00 00  ................        42.1.16       
                         00 00 00 00  00 00 00 00  00 00 00 00  00 00 00 00  ................        42.1.32       
                         00 00 00 00  00 00 00 00  00 00 00 00  00 00 00 00  ................        42.1.48       
                         00 00 00 00  00 00 00 00  00 00 00                  ...........             42.1.64       
  26.3      1536  ISOC   0c 8d de f1  60 b7 a8 01  82 b8 b9 06  00 00 00 00  ....`...........        43.1.0        
                         00 00 00 00  00 00 00 00  00 00 00 00  00 00 00 00  ................        43.1.16       
                         00 00 00 00  00 00 00 00  00 00 00 00  00 00 00 00  ................        43.1.32       
                         00 00 00 00  00 00 00 00  00 00 00 00  00 00 00 00  ................        43.1.48       
                         00 00 00 00  00 00 00 00  00 00 00                  ...........             43.1.64       
  26.3      1536  ISOC   0c 8d de f1  60 b7 04 31  8f b8 39 07  00 00 00 00  ....`..1..9.....        44.1.0        
                         00 00 00 00  00 00 00 00  00 00 00 00  00 00 00 00  ................        44.1.16       
                         00 00 00 00  00 00 00 00  00 00 00 00  00 00 00 00  ................        44.1.32       
                         00 00 00 00  00 00 00 00  00 00 00 00  00 00 00 00  ................        44.1.48       
                         00 00 00 00  00 00 00 00  00 00 00                  ...........             44.1.64       
  26.3      1536  ISOC   0c 8d de f1  60 b7 60 60  9c b8 b9 07  10 80 10 80  ....`.``........        45.1.0        
                         10 80 10 80  10 80 10 80  10 80 10 80  10 80 10 80  ................        45.1.16       
                         10 80 10 80  10 80 10 80  10 80 10 80  10 80 10 80  ................        45.1.32       
                         10 80 10 80  00 00 00 00  00 00 00 00  00 00 00 00  ................        45.1.48       
                         00 00 00 00  00 00 00 00  00 00 00                  ...........             45.1.64       
  26.3      1536  ISOC   0c 8d de f1  60 b7 c0 8f  a9 b8 39 00  10 80 10 80  ....`.....9.....        46.1.0        
                         10 80 10 80  10 80 10 80  10 80 10 80  10 80 10 80  ................        46.1.16       
                         10 80 10 80  10 80 10 80  00 00 00 00  00 00 00 00  ................        46.1.32       
                         00 00 00 00  00 00 00 00  00 00 00 00  00 00 00 00  ................        46.1.48       
                         00 00 00 00  00 00 00 00  00 00 00                  ...........             46.1.64       
  26.3     42094  ISOC   0c 8d de f1  60 b7 18 bf  b6 b8 b9 00  10 80 10 80  ....`...........        47.1.0        
                         10 80 10 80  10 80 10 80  10 80 10 80  00 00 00 00  ................        47.1.16       
                         00 00 00 00  00 00 00 00  00 00 00 00  00 00 00 00  ................        47.1.32       
                         00 00 00 00  00 00 00 00  00 00 00 00  00 00 00 00  ................        47.1.48       
                         00 00 00 00  00 00 00 00  00 00 00                  ...........             47.1.64       
  26.3     79960  ISOC   0c 8d de f1  60 b7 6f f0  c3 b8 39 01  10 80 10 80  ....`.o...9.....        48.1.0        
                         10 80 10 80  10 80 10 80  10 80 10 80  10 80 10 80  ................        48.1.16       
                         10 80 10 80  10 80 10 80  10 80 10 80  10 80 10 80  ................        48.1.32       
                         10 80 10 80  10 80 10 80  10 80 10 80  10 80 10 80  ................        48.1.48       
                         10 80 10 80  10 80 10 80  10 80 10                  ...........             48.1.64       
  26.3     72002  ISOC   0c 8d de f1  60 b7 11 20  d1 b8 b9 01  10 80 10 80  ....`.. ........        49.1.0        
                         10 80 10 80  10 80 10 80  10 80 10 80  10 80 10 80  ................        49.1.16       
                         10 80 10 80  10 80 10 80  10 80 10 80  10 80 10 80  ................        49.1.32       
                         10 80 10 80  10 80 10 80  10 80 10 80  10 80 10 80  ................        49.1.48       
                         10 80 10 80  10 80 10 80  10 80 10                  ...........             49.1.64       
  26.3     79942  ISOC   0c 8c 84 19  d7 b8 29 4f  de b8 39 02  38 7e 37 7e  ......)O..9.8.7.        50.1.0        
                         37 7e 36 7f  37 7f 37 7f  36 7e 35 7e  36 7e 35 7f  7.6.7.7.6.5.6.5.        50.1.16       
                         36 80 35 7f  35 80 34 7f  35 7e 36 80  36 80 35 7f  6.5.5.4.5.6.6.5.        50.1.32       
                         35 80 36 7f  35 7f 35 81  35 80 35 80  34 81 35 81  5.6.5.5.5.5.4.5.        50.1.48       
                         35 80 34 7d  35 80 35 7e  35 80 35                  5.4.5.5.5.5             50.1.64       
  26.3     66584  ISOC   0c 8c 84 19  d7 b8 7f 7e  eb b8 b9 02  65 7f 64 80  ............e.d.        51.1.0        
                         62 7f 5c 80  5b 7e 55 7e  52 80 51 7f  56 82 44 81  b.\.[.U.R.Q.V.D.        51.1.16       
                         1e 7f 25 7f  25 80 25 80  26 7f 26 80  26 7f 27 81  ..%.%.%.&.&.&.'.        51.1.32       
                         27 7f 27 82  27 7f 28 81  29 82 25 80  17 7b 75 80  '.'.'.(.).%...u.        51.1.48       
                         c9 7f 77 80  19 7e 2c 80  29 80 29                  ..w...,.).)             51.1.64       
  26.3     79724  ISOC   0c 8d d0 f1  f4 b8 2b ae  f8 b8 39 03  14 7f 12 7e  ......+...9.....        52.1.0        
                         11 80 12 7e  13 80 14 7f  13 81 12 7d  23 81 2c 7c  ............#.,.        52.1.16       
                         18 7f 14 7e  16 81 14 7f  13 81 12 7f  12 81 13 7f  ................        52.1.32       
                         13 80 12 7f  12 80 10 7f  11 7f 13 7f  16 80 16 7f  ................        52.1.48       
                         18 7f 1a 7f  1b 80 1d 7f  26 7e 26                  ........&.&             52.1.64       
  26.3     72468  ISOC   0c 8d d0 f1  f4 b8 4b dd  05 b9 b9 03  19 84 18 7a  ......K........z        53.1.0        
                         18 86 1a 7e  19 86 19 7d  18 84 19 7d  19 83 18 7d  ................        53.1.16       
                         18 85 19 7d  19 84 18 7d  18 82 18 7c  18 84 18 7d  ................        53.1.32       
                         18 85 18 7d  18 84 19 7d  18 84 18 7d  18 85 18 7d  ................        53.1.48       
                         18 82 19 7d  18 84 18 7e  18 84 18                  ...........             53.1.64       
  26.3     79616  ISOC   0c 8c 87 62  0d b9 e6 0c  13 b9 39 04  16 7e 16 7f  ...b......9.....        54.1.0        
                         15 7f 14 7e  14 80 16 7e  17 83 16 7e  17 84 18 7f  ................        54.1.16       
                         18 84 17 7d  16 85 16 7e  16 84 17 7d  17 82 19 7b  ................        54.1.32       
                         1b 83 1c 7c  1c 82 1c 7c  1c 81 1c 7c  1c 81 1c 7d  ................        54.1.48       
                         1c 82 1d 7d  1c 81 1d 7d  1d 80 1d                  ...........             54.1.64       
  26.3     50176  ISOC   0c 8c 87 62  0d b9 25 3c  20 b9 b9 04  1e 88 1c 7b  ...b..%< .......        55.1.0        
                         1c 87 1d 79  1c 86 1c 7c  1b 87 1b 7a  1b 86 1a 7b  ...y.......z....        55.1.16       
                         1a 85 1a 7a  19 85 19 7b  1a 84 1a 7b  1a 84 1a 7c  ...z............        55.1.32       
                         1a 83 1a 7c  1a 85 19 7a  19 85 1a 7b  19 84 19 7e  .......z........        55.1.48       
                         1a 85 1a 7c  1a 82 19 7a  19 82 17                  .......z...             55.1.64       
  26.3     10398  ISOC   0c 8d c8 79  28 b9 55 69  2d b9 39 05  10 80 10 80  ...y(.Ui-.9.....        56.1.0        
                         10 80 10 80  10 80 10 80  10 80 10 80  10 80 10 80  ................        56.1.16       
                         10 80 10 80  10 80 10 80  10 80 10 80  10 80 10 80  ................        56.1.32       
                         10 80 10 80  10 80 10 80  10 80 10 80  10 80 10 80  ................        56.1.48       
                         10 80 10 80  10 80 10 80  10 80 10                  ...........             56.1.64       
  26.3     79714  ISOC   0c 8d c8 79  28 b9 e6 9a  3a b9 b9 05  f4 80 f4 80  ...y(...:.......        57.1.0        
                         f4 80 f4 80  f4 80 f4 80  f4 80 f4 80  f4 80 f4 80  ................        57.1.16       
                         f4 80 f4 80  f4 80 f4 80  f4 80 f4 80  f4 80 f4 80  ................        57.1.32       
                         f4 80 f4 80  f4 80 f4 80  f4 80 f2 80  f2 80 f3 80  ................        57.1.48       
                         f2 80 f1 7f  f1 80 f1 7f  f1 80 f1                  ...........             57.1.64       
  26.3     72234  ISOC   0c 8d c8 79  28 b9 56 ca  47 b9 39 06  54 a3 53 72  ...y(.V.G.9.T.Sr        58.1.0        
                         52 a2 52 71  52 a2 50 73  4f a3 4d 73  4c a3 4b 72  R.RqR.PsO.MsL.Kr        58.1.16       
                         4b a3 4b 73  4b a1 4a 71  4a a0 4a 73  4a a3 4a 72  K.KsK.JqJ.JsJ.Jr        58.1.32       
                         4a a1 4b 70  4a 9f 49 6f  48 9e 4a 73  4a 9f 49 72  J.KpJ.IoH.JsJ.Ir        58.1.48       
                         49 a0 48 71  46 a1 46 70  47 a2 47                  I.HqF.FpG.G             58.1.64       
  26.3     79958  ISOC   0c 8c 08 1f  53 b9 61 f9  54 b9 b9 06  71 4f 71 96  ....S.a.T...qOq.        59.1.0        
                         71 51 73 96  73 50 73 98  73 4d 75 96  76 52 76 97  qQs.sPs.sMu.vRv.        59.1.16       
                         76 53 77 94  7a 54 3b 8f  be 76 d8 7c  d2 7c e1 80  vSw.zT;..v......        59.1.32       
                         a9 6f 21 87  67 69 e4 83  c3 70 cb 83  e4 6e 61 82  .o!.gi...p...na.        59.1.48       
                         48 66 97 84  d9 74 bc 81  d3 79 a6                  Hf...t...y.             59.1.64       
  26.3     72576  ISOC   0c 8c 08 1f  53 b9 0e 29  62 b9 39 07  54 a3 51 6f  ....S..)b.9.T.Qo        60.1.0        
                         4f a2 4e 6d  4e a2 4d 6f  4c a3 4b 71  4a a2 49 70  O.NmN.MoL.KqJ.Ip        60.1.16       
                         49 a3 49 6f  48 a2 46 6a  46 a0 47 6c  48 a0 48 70  I.IoH.FjF.GlH.Hp        60.1.32       
                         48 a3 46 6e  46 a1 48 6f  48 a1 48 71  48 a0 48 6f  H.FnF.HoH.HqH.Ho        60.1.48       
                         47 a2 45 6d  45 a2 47 6f  46 a1 46                  G.EmE.GoF.F             60.1.64       
  26.3     79368  ISOC   0c 8d 0a 36  6e b9 21 56  6f b9 b9 07  19 84 18 7a  ...6n.!Vo......z        61.1.0        
                         18 86 1a 7e  19 86 19 7d  18 84 19 7d  19 83 18 7d  ................        61.1.16       
                         18 85 19 7d  19 84 18 7d  18 82 18 7c  18 84 18 7d  ................        61.1.32       
                         18 85 18 7d  18 84 19 7d  18 84 18 7d  18 85 18 7d  ................        61.1.48       
                         18 82 19 7d  18 84 18 7e  18 84 18                  ...........             61.1.64       
  26.3     77304  ISOC   0c 8d 0a 36  6e b9 6b 87  7c b9 39 00  9d 8d a6 7c  ...6n.k...9.....        62.1.0        
                         ae 86 af 82  b2 85 b2 83  ac 80 a0 7e  9b 82 94 7c  ................        62.1.16       
                         86 82 6e 75  4a 83 44 7c  3f 80 31 7f  21 80 1c 7e  ..nuJ.D.?.1.!...        62.1.32       
                         17 7f 1e 7a  17 80 1b 7b  24 82 2d 7a  31 80 38 7b  ...z....$.-z1.8.        62.1.48       
                         40 85 4e 7a  4d 81 43 7c  4a 84 4b                  @.NzM.C.J.K             62.1.64       
  26.3     74662  ISOC   0c 8c 03 68  89 b9 dd b4  89 b9 b9 00  1e 88 1c 7b  ...h............        63.1.0        
                         1c 87 1d 79  1c 86 1c 7c  1b 87 1b 7a  1b 86 1a 7b  ...y.......z....        63.1.16       
                         1a 85 1a 7a  19 85 19 7b  1a 84 1a 7b  1a 84 1a 7c  ...z............        63.1.32       
                         1a 83 1a 7c  1a 85 19 7a  19 85 1a 7b  19 84 19 7e  .......z........        63.1.48       
                         1a 85 1a 7c  1a 82 19 7a  19 82 17                  .......z...             63.1.64       
  26.3     79952  ISOC   0c 8c 03 68  89 b9 36 e6  96 b9 39 01  3c 6f 3c a0  ...h..6...9.<o<.        64.1.0        
                         3b 6f 3b 9e  3c 6e 3b 9e  3b 6e 3b 9e  3a 6f 3a 9f  ;o;.<n;.;n;.:o:.        64.1.16       
                         39 6f 39 9d  39 70 39 9c  3a 71 3a 9b  39 70 38 9e  9o9.9p9.:q:.9p8.        64.1.32       
                         37 6f 36 9e  36 74 36 9e  37 70 37 9d  34 75 31 9d  7o6.6t6.7p7.4u1.        64.1.48       
                         33 74 34 9b  33 74 36 98  13 7c 14                  3t4.3t6....             64.1.64       
  26.3     72074  ISOC   0c 8c 03 68  89 b9 b0 15  a4 b9 b9 01  93 8d 99 6c  ...h...........l        65.1.0        
                         99 8b 9a 6d  9a 8a 98 6d  97 8a 95 6a  94 8b 95 6c  ...m...m...j...l        65.1.16       
                         95 8b 95 6d  98 8e 98 6e  9b 89 61 75  3e 7c a6 80  ...m...n..au>...        65.1.32       
                         f9 7e ff 80  b0 81 77 76  9f 89 9f 6e  9e 8a 9c 6d  ......wv...n...m        65.1.48       
                         9d 8a 9e 6d  9f 8c a0 6d  a1 8a 9d                  ...m...m...             65.1.64       
  26.3     79880  ISOC   0c 8d 0a 7f  a4 b9 e9 44  b1 b9 39 02  4e a1 4d 6c  .......D..9.N.Ml        66.1.0        
                         4b a1 4a 6d  49 a3 49 6d  48 a3 49 71  47 a0 47 6f  K.JmI.ImH.IqG.Go        66.1.16       
                         45 a0 44 6e  44 a0 44 6f  45 a1 47 6d  47 9f 47 6c  E.DnD.DoE.GmG.Gl        66.1.32       
                         46 a1 44 6e  44 a2 43 6e  42 a0 43 70  44 a0 45 6f  F.DnD.CnB.CpD.Eo        66.1.48       
                         44 a2 44 6f  43 9f 44 6b  43 a1 42                  D.DoC.DkC.B             66.1.64       
  26.3     72312  ISOC   0c 8d 0a 7f  a4 b9 4a 74  be b9 b9 02  2a 80 72 79  ......Jt....*.ry        67.1.0        
                         93 81 bc 83  6c 80 0e 79  33 81 37 7c  33 83 30 7d  ....l..y3.7.3.0.        67.1.16       
                         2d 82 28 7b  16 80 52 7b  2a 81 25 7e  24 82 25 7d  -.(...R.*.%.$.%.        67.1.32       
                         27 80 21 7e  14 80 15 7c  15 80 10 7b  28 80 34 7e  '.!.........(.4.        67.1.48       
                         34 80 36 7f  35 7f 2d 7d  29 81 2a                  4.6.5.-.).*             67.1.64       
  26.3     79650  ISOC   0c 8c 01 b1  bf b9 ec a3  cb b9 39 03  4f a1 4d 70  ..........9.O.Mp        68.1.0        
                         4c a2 4a 72  4a 9f 49 74  49 9e 47 73  45 9d 45 71  L.JrJ.ItI.GsE.Eq        68.1.16       
                         46 9e 46 70  48 a1 47 6e  46 a1 47 70  47 a2 47 6f  F.FpH.GnF.GpG.Go        68.1.32       
                         47 9d 45 6d  46 9b 46 6a  44 9c 43 6b  43 9e 44 70  G.EmF.FjD.CkC.Dp        68.1.48       
                         46 9e 46 6e  45 9f 43 70  44 9d 46                  F.FnE.CpD.F             68.1.64       
  26.3     72542  ISOC   0c 8c 01 b1  bf b9 05 d3  d8 b9 b9 03  1d 7d 1d 81  ................        69.1.0        
                         1b 7c 19 81  17 7d 11 80  0e 7f 0e 7f  17 7a 12 7c  .............z..        69.1.16       
                         18 79 19 7f  15 7a 0f 7e  10 7e 09 7d  26 77 40 77  .y...z......&w@w        69.1.32       
                         0f 78 14 7f  18 7d 1d 80  19 7d 1d 81  1e 7e 1e 81  .x..............        69.1.48       
                         1f 7d 20 7f  24 7b 27 83  2a 7b 2f                  .. .$.'.*./             69.1.64       
  26.3     79616  ISOC   0c 8d 05 c8  da b9 a5 02  e6 b9 39 04  4c 9f 4b 6e  ..........9.L.Kn        70.1.0        
                         4b 9f 4a 6c  4a a3 47 6c  46 9f 47 6c  49 9d 49 72  K.JlJ.GlF.GlI.Ir        70.1.16       
                         48 9f 48 6a  47 9c 49 6d  48 9c 48 6e  48 9f 49 72  H.HjG.ImH.HnH.Ir        70.1.32       
                         47 9f 45 71  45 a0 44 6b  44 9e 44 6b  44 9e 44 70  G.EqE.DkD.DkD.Dp        70.1.48       
                         44 9e 45 6e  45 9c 45 6c  46 9c 44                  D.EnE.ElF.D             70.1.64       
  26.3     72576  ISOC   0c 8d 05 c8  da b9 05 32  f3 b9 b9 04  7a 88 73 78  .......2....z.sx        71.1.0        
                         7c 86 7c 77  7a 87 7b 78  7c 86 7d 78  7f 84 69 78  ...wz..x...x..ix        71.1.16       
                         59 80 89 7e  c5 81 f0 7f  f5 7f eb 7e  d1 7f bb 79  Y..............y        71.1.32       
                         82 6f 2e 82  0a 7c 60 7c  94 76 4a 71  3d 7f 36 73  .o....`..vJq=.6s        71.1.48       
                         3e 82 3e 78  37 7f 4c 78  65 82 7d                  >.>x7.Lxe..             71.1.64       
  26.3     79616  ISOC   0c 8c ff f9  f5 b9 5f 61  00 ba 39 05  4a a1 48 6a  ......_a..9.J.Hj        72.1.0        
                         48 a1 47 6c  46 a0 45 6a  44 9f 45 6c  47 9f 47 6e  H.GlF.EjD.ElG.Gn        72.1.16       
                         46 a2 47 6c  47 a1 47 69  47 a3 45 6c  45 a2 45 6e  F.GlG.GiG.ElE.En        72.1.32       
                         44 a2 44 6d  44 a2 44 6f  42 9e 44 6e  44 a1 44 6c  D.DmD.DoB.DnD.Dl        72.1.48       
                         44 9f 43 6d  43 9c 43 70  43 a1 44                  D.CmC.CpC.D             72.1.64       
  26.3     72576  ISOC   0c 8c ff f9  f5 b9 c0 90  0d ba b9 05  91 80 ab 7e  ................        73.1.0        
                         c9 81 e4 7f  ef 80 f0 7f  da 80 b2 79  89 7d 50 75  ...........y..Pu        73.1.16       
                         1a 7b 10 7a  06 7d 08 7d  40 7f 80 7a  a5 81 a6 7f  ...z....@..z....        73.1.32       
                         a1 82 9e 79  9d 84 af 7d  bc 83 2c 7a  04 7f 1a 7c  ...y......,z....        73.1.48       
                         19 80 1a 7d  1b 81 1e 7a  22 80 2c                  .......z".,             73.1.64       
  26.3     79616  ISOC   0c 8d f4 10  11 ba 18 c0  1a ba 39 06  4b 9f 4a 70  ..........9.K.Jp        74.1.0        
                         49 9f 48 6f  46 9e 45 67  45 9e 44 6b  46 9f 46 6b  I.HoF.EgE.DkF.Fk        74.1.16       
                         47 9e 46 6d  46 9f 46 6d  45 a0 44 6d  45 9f 45 6e  G.FmF.FmE.DmE.En        74.1.32       
                         45 a1 45 6e  46 a0 44 6d  44 9f 45 70  45 a0 45 6e  E.EnF.DmD.EpE.En        74.1.48       
                         44 9e 43 6f  43 9e 43 73  45 9e 45                  D.CoC.CsE.E             74.1.64       
  26.3     72508  ISOC   0c 8d f4 10  11 ba 74 ef  27 ba b9 06  65 80 64 75  ......t.'...e.du        75.1.0        
                         57 85 46 77  3c 86 45 77  50 84 64 7c  7d 83 8d 7b  W.Fw<.EwP.d.....        75.1.16       
                         90 82 95 7d  9a 81 9d 7d  9b 81 98 80  92 82 97 7f  ................        75.1.32       
                         9a 81 94 81  74 81 3b 7b  12 7f 10 7b  19 7f 19 7d  ....t.;.........        75.1.48       
                         1c 81 1e 7d  1f 80 23 7e  2a 81 37                  ......#.*.7             75.1.64       
  26.3     79684  ISOC   0c 8c fb 42  2c ba cc 1e  35 ba 39 07  f4 80 f4 80  ...B,...5.9.....        76.1.0        
                         f4 80 f4 80  f4 80 f4 80  f4 80 f4 80  f4 80 f4 80  ................        76.1.16       
                         f4 80 f4 80  f4 80 f4 80  f3 80 f3 7f  f2 7e f0 7f  ................        76.1.32       
                         ef 7e ee 7f  ed 7f ec 7f  eb 7d e9 7f  e5 7d e5 7f  ................        76.1.48       
                         e6 7d e5 7f  e4 7d e4 7e  e5 7d e6                  ...........             76.1.64       
  26.3     72258  ISOC   0c 8c fb 42  2c ba 32 4e  42 ba b9 07  9d 86 9c 7c  ...B,.2NB.......        77.1.0        
                         9b 86 9b 78  99 84 9a 79  99 87 97 7f  95 83 92 7b  ...x...y........        77.1.16       
                         90 82 90 7d  8e 85 8b 79  8a 82 89 7a  8a 81 89 7c  .......y...z....        77.1.32       
                         86 84 8a 7e  8d 81 8e 7d  7c 82 26 76  0f 7e 19 7f  ..........&v....        77.1.48       
                         17 81 19 7e  1a 7f 1c 7e  1e 81 1f                  ...........             77.1.64       
  26.3     79934  ISOC   0c 8d 15 5a  47 ba 34 7d  4f ba 39 00  89 44 89 99  ...ZG.4.O.9..D..        78.1.0        
                         89 46 89 9b  89 47 81 95  68 67 6c 82  7f 74 63 80  .F...G..hgl..tc.        78.1.16       
                         7a 63 8f 8c  79 5f 58 86  6d 72 b0 82  aa 5e 7c 8f  zc..y_X.mr...^..        78.1.32       
                         83 54 64 8c  d9 6a cf 7f  dc 7a 7f 85  6d 5a 6a 89  .Td..j...z..mZj.        78.1.48       
                         cb 77 de 84  d7 6b e5 84  6b 64 84                  .w...k..kd.             78.1.64       
  26.3     72032  ISOC   0c 8d 15 5a  47 ba e6 ac  5c ba b9 00  8b 82 8a 78  ...ZG...\......x        79.1.0        
                         85 83 8c 77  8f 81 90 79  90 83 91 7c  96 83 97 7c  ...w...y........        79.1.16       
                         99 81 94 7c  97 82 95 7c  91 81 93 7b  93 81 8d 7b  ................        79.1.32       
                         8a 7f 8b 7e  84 7f 81 7a  7f 80 7c 7c  7b 7e 96 79  .......z.......y        79.1.48       
                         23 7f 00 7c  15 7e 16 7e  02 7f 4a                  #.........J             79.1.64       
  26.3     79940  ISOC   0c 8c f5 8b  62 ba f8 db  69 ba 39 01  54 7f 53 7b  ....b...i.9.T.S.        80.1.0        
                         53 80 52 7c  51 7d 50 7e  4f 7d 4f 7d  4f 7f 4f 7c  S.R.Q.P.O.O.O.O.        80.1.16       
                         50 80 51 7f  50 7f 51 7c  51 7e 52 78  50 7f 4f 7d  P.Q.P.Q.Q.RxP.O.        80.1.32       
                         4f 7f 4f 79  51 7e 51 7b  50 7d 50 7f  4f 7e 4f 7b  O.OyQ.Q.P.P.O.O.        80.1.48       
                         4e 7d 4f 79  50 7e 4e 7e  4e 7f 4d                  N.OyP.N.N.M             80.1.64       
  26.3     72156  ISOC   0c 8c f5 8b  62 ba 48 0b  77 ba b9 01  21 81 4e 7a  ....b.H.w...!.Nz        81.1.0        
                         5b 85 5e 7c  67 82 6a 7e  6a 82 6c 80  60 83 56 81  [.^.g.j.j.l.`.V.        81.1.16       
                         54 83 45 7e  43 81 48 7f  49 81 4f 7e  52 83 56 7c  T.E.C.H.I.O.R.V.        81.1.32       
                         5d 82 69 7d  64 83 5f 7f  5d 84 5d 7c  5e 88 5d 7c  ].i.d._.].].^.].        81.1.48       
                         5f 84 64 7c  65 82 67 7c  69 81 69                  _.d.e.g.i.i             81.1.64       
  26.3     79808  ISOC   0c 8d 4a a3  7d ba df 3a  84 ba 39 02  12 83 0e 7e  ..J....:..9.....        82.1.0        
                         0b 82 0c 7d  0d 82 0a 7c  0c 84 64 7f  9b 82 94 84  ..........d.....        82.1.16       
                         75 7c 34 82  33 80 3c 80  45 80 4c 80  53 7e 5d 7e  u.4.3.<.E.L.S.].        82.1.32       
                         73 7f 79 7e  84 7c 8d 83  95 7c 99 84  9d 7c a0 85  s.y.............        82.1.48       
                         a5 7e a6 85  a2 7c a2 82  9e 7e 97                  ...........             82.1.64       
  26.3     72384  ISOC   0c 8d 4a a3  7d ba 0c 6a  91 ba b9 02  38 92 3d 75  ..J....j....8.=u        83.1.0        
                         34 91 38 70  3a 8f 2f 78  28 89 1c 7b  16 82 11 7c  4.8p:./x(.......        83.1.16       
                         11 81 14 7b  13 81 13 7d  12 7f 12 7d  12 7f 12 7e  ................        83.1.32       
                         11 7f 0e 7d  0d 80 0d 7f  08 80 0c 7d  15 82 1b 76  ...............v        83.1.48       
                         21 85 21 75  21 89 26 76  2d 8a 2f                  !.!u!.&v-./             83.1.64       
  26.3     79616  ISOC   0c 8c 97 ba  98 ba b0 99  9e ba 39 03  21 7f 1e 7e  ..........9.!...        84.1.0        
                         1c 83 1c 7d  21 8d 27 78  29 93 2b 72  2d 94 2e 72  ....!.'x).+r-..r        84.1.16       
                         2e 92 27 75  24 8f 24 76  25 8d 23 78  21 91 33 74  ..'u$.$v%.#x!.3t        84.1.32       
                         32 99 3d 71  40 95 4a 72  4a 96 46 75  3d 92 37 72  2.=q@.JrJ.Fu=.7r        84.1.48       
                         41 90 4e 79  51 89 54 78  54 85 53                  A.NyQ.TxT.S             84.1.64       
  26.3     72576  ISOC   0c 8c 97 ba  98 ba c2 c8  ab ba b9 03  50 a0 4d 72  ............P.Mr        85.1.0        
                         4c 9e 4c 70  4a 9f 49 6f  49 a1 46 6d  42 9f 41 70  L.LpJ.IoI.FmB.Ap        85.1.16       
                         41 9e 40 71  3f 9d 3f 70  3e 9e 3d 73  3e 9d 3d 73  A.@q?.?p>.=s>.=s        85.1.32       
                         3e 9d 3e 72  3f 9c 3f 6f  3e 9a 3e 6d  3d 9a 3d 74  >.>r?.?o>.>m=.=t        85.1.48       
                         3d 9c 3d 70  3c 9c 3b 70  38 9b 2f                  =.=p<.;p8./             85.1.64       
  26.3     79616  ISOC   0c 8d 45 ec  b3 ba 67 f8  b8 ba 39 04  2c 7c 2e 89  ..E...g...9.,...        86.1.0        
                         32 7e 44 82  4c 7e 4a 7b  49 81 49 7c  49 85 49 79  2.D.L.J.I.I.I.Iy        86.1.16       
                         49 82 48 76  48 82 49 79  49 82 49 75  49 82 4b 78  I.HvH.IyI.IuI.Kx        86.1.32       
                         4b 86 4b 79  4b 83 4b 7b  4b 86 4b 7b  4b 83 4c 7a  K.KyK.K.K.K.K.Lz        86.1.48       
                         4c 86 4c 78  4b 81 4b 79  4d 82 4c                  L.LxK.KyM.L             86.1.64       
  26.3     72576  ISOC   0c 8d 45 ec  b3 ba c7 27  c6 ba b9 04  4e 9e 4c 6f  ..E....'....N.Lo        87.1.0        
                         4c 9f 4b 71  4b 9e 48 6f  46 9e 45 6f  44 9e 43 70  L.KqK.HoF.EoD.Cp        87.1.16       
                         42 9e 41 74  40 9c 3f 75  40 99 3f 73  3f 9b 3f 71  B.At@.?u@.?s?.?q        87.1.32       
                         3f 9a 3f 6e  3e 99 3e 6f  3e 9b 3f 71  3e 9c 3d 6d  ?.?n>.>o>.?q>.=m        87.1.48       
                         3e 9c 3e 6d  3c 98 3c 73  3c 9c 3c                  >.>m<.<s<.<             87.1.64       
  26.3     79616  ISOC   0c 8c f0 03  cf ba 21 57  d3 ba 39 05  2d 7d 39 82  ......!W..9.-.9.        88.1.0        
                         50 7c 68 86  2a 7a 1f 80  3f 81 42 7b  47 87 46 7c  P.h.*z..?.B.G.F.        88.1.16       
                         48 88 48 76  47 84 46 76  47 83 47 7a  45 85 44 7b  H.HvG.FvG.GzE.D.        88.1.32       
                         44 86 44 7c  44 86 44 78  44 86 43 7c  43 88 43 7a  D.D.D.DxD.C.C.Cz        88.1.48       
                         41 84 41 7a  42 84 43 7a  43 84 40                  A.AzB.CzC.@             88.1.64       
  26.3     72576  ISOC   0c 8c f0 03  cf ba 7d 86  e0 ba b9 05  4d 9e 4c 6f  ............M.Lo        89.1.0        
                         4b 9f 4a 6f  49 9f 49 6f  49 9f 47 71  45 9c 43 6e  K.JoI.IoI.GqE.Cn        89.1.16       
                         42 9b 42 74  43 9e 41 72  41 9f 41 73  43 9d 43 70  B.BtC.ArA.AsC.Cp        89.1.32       
                         41 9e 40 6e  40 99 40 6e  3f 9a 3e 70  3f 9b 3f 6f  A.@n@.@n?.>p?.?o        89.1.48       
                         3f 9b 3e 6f  3d 9a 3d 73  3d 9b 3d                  ?.>o=.=s=.=             89.1.64       
  26.3     79616  ISOC   0c 8d 45 35  ea ba d7 b5  ed ba 39 06  2f 81 1b 7c  ..E5......9./...        90.1.0        
                         37 80 e9 7a  fe 7f c0 7c  c7 7f f8 7f  f4 80 fc 80  7..z............        90.1.16       
                         f0 80 38 89  1b 87 67 79  60 86 60 75  5f 86 5f 76  ..8...gy`.`u_._v        90.1.32       
                         5f 85 5f 76  61 86 5e 77  5e 86 5f 79  5e 87 5f 76  _._va.^w^._y^._v        90.1.48       
                         60 86 60 75  5f 86 5f 74  61 84 63                  `.`u_._ta.c             90.1.64       
  26.3     72424  ISOC   0c 8d 45 35  ea ba 38 e5  fa ba b9 06  4c 9e 4d 70  ..E5..8.....L.Mp        91.1.0        
                         4c 9f 4b 72  4a 9e 48 73  46 9e 45 70  44 9c 43 6d  L.KrJ.HsF.EpD.Cm        91.1.16       
                         42 9b 41 6e  41 9d 42 73  41 9d 42 70  42 9a 41 6f  B.AnA.BsA.BpB.Ao        91.1.32       
                         41 9d 41 72  40 9c 40 71  40 99 3f 6f  3e 9a 3f 6f  A.Ar@.@q@.?o>.?o        91.1.48       
                         40 9b 3f 6e  3f 9b 3d 6f  3e 9a 3f                  @.?n?.=o>.?             91.1.64       
  26.3     79768  ISOC   0c 8c 48 4c  05 bb 59 14  08 bb 39 07  f4 80 f4 80  ..HL..Y...9.....        92.1.0        
                         f4 80 f4 80  f4 80 f4 80  f4 80 f4 80  f4 80 f4 80  ................        92.1.16       
                         f4 80 f4 80  f4 80 f4 80  f4 80 f4 80  f4 80 f4 80  ................        92.1.32       
                         f4 80 f4 80  f4 80 f4 80  f4 80 f4 80  f4 80 f4 80  ................        92.1.48       
                         f4 80 f4 80  f4 80 f4 80  f4 80 f4                  ...........             92.1.64       
  26.3     72188  ISOC   0c 8c 48 4c  05 bb ee 43  15 bb b9 07  4f 9e 4c 70  ..HL...C....O.Lp        93.1.0        
                         4d 9c 4a 6d  48 9f 46 6f  46 a1 45 6f  46 a0 44 6f  M.JmH.FoF.EoF.Do        93.1.16       
                         43 9c 43 71  42 9c 42 73  42 9f 41 74  41 9f 42 6d  C.CqB.BsB.AtA.Bm        93.1.32       
                         42 9e 42 6a  41 9f 42 6f  42 9d 42 6e  42 9b 41 74  B.BjA.BoB.BnB.At        93.1.48       
                         40 9a 3f 74  3f 9d 3f 74  3f 9d 3f                  @.?t?.?t?.?             93.1.64       
  26.3     79964  ISOC   0c 8d 3f 7e  20 bb fc 72  22 bb 39 00  95 81 00 79  ..?. ..r".9....y        94.1.0        
                         7e 83 66 52  62 92 63 48  63 92 64 49  64 92 65 4e  ..fRb.cHc.dId.eN        94.1.16       
                         67 93 67 4e  67 93 67 4e  67 93 67 4e  69 90 6a 4e  g.gNg.gNg.gNi.jN        94.1.32       
                         69 92 69 4e  69 92 6a 4b  6c 92 6c 4e  6c 92 6e 4e  i.iNi.jKl.lNl.nN        94.1.48       
                         6f 92 70 51  70 92 6f 4d  70 92 70                  o.pQp.oMp.p             94.1.64       
  26.3     71976  ISOC   0c 8d 3f 7e  20 bb a7 a2  2f bb b9 00  81 82 81 83  ..?. .../.......        95.1.0        
                         7b 80 6d 7c  5a 82 4b 7e  3f 81 33 7f  2c 83 1a 7c  ..m.Z.K.?.3.,...        95.1.16       
                         0c 83 1b 7d  2f 84 40 82  48 7f 4f 80  51 80 53 7c  ..../.@.H.O.Q.S.        95.1.32       
                         3d 80 81 7d  4f 9e 4e 6f  4b 9f 4b 6e  4b 9e 49 6f  =...O.NoK.KnK.Io        95.1.48       
                         47 9e 46 6f  44 9e 43 6d  43 9e 42                  G.FoD.CmC.B             95.1.64       
  26.3     79962  ISOC   0c 8c 44 95  3b bb bb cf  3c bb 39 01  68 85 6c 7b  ..D.;...<.9.h.l.        96.1.0        
                         6b 87 6b 79  6c 82 6c 79  6c 81 6a 76  6b 83 6a 76  k.kyl.lyl.jvk.jv        96.1.16       
                         69 82 69 7d  6a 82 69 79  6a 82 6a 7d  6a 85 69 7b  i.i.j.iyj.j.j.i.        96.1.32       
                         6a 83 69 79  6a 82 6b 7a  6a 85 6c 79  6c 85 6a 7b  j.iyj.kzj.lyl.j.        96.1.48       
                         6b 87 6b 79  6b 82 69 7b  6b 83 6c                  k.kyk.i.k.l             96.1.64       
  26.3     76710  ISOC   0c 8c 44 95  3b bb 05 01  4a bb b9 01  87 74 7c 8c  ..D.;...J....t..        97.1.0        
                         90 71 85 9b  8a 72 84 94  74 7d 8f 82  85 7b 95 83  .q...r..t.......        97.1.16       
                         af 79 ad 85  a8 7c b1 81  a1 7b 84 87  95 84 9e 85  .y..............        97.1.32       
                         a7 85 a8 7e  a7 84 a5 7f  98 81 88 81  75 7c 5d 83  ............u.].        97.1.48       
                         50 80 44 7f  38 83 28 83  1e 7c 16                  P.D.8.(....             97.1.64       
  26.3     75256  ISOC   0c 8d 3c c7  56 bb 72 2e  57 bb 39 02  2f 81 1b 7c  ..<.V.r.W.9./...        98.1.0        
                         37 80 e9 7a  fe 7f c0 7c  c7 7f f8 7f  f4 80 fc 80  7..z............        98.1.16       
                         f0 80 38 89  1b 87 67 79  60 86 60 75  5f 86 5f 76  ..8...gy`.`u_._v        98.1.32       
                         5f 85 5f 76  61 86 5e 77  5e 86 5f 79  5e 87 5f 76  _._va.^w^._y^._v        98.1.48       
                         60 86 60 75  5f 86 5f 74  61 84 63                  `.`u_._ta.c             98.1.64       
  26.3     79944  ISOC   0c 8d 3c c7  56 bb cb 5f  64 bb b9 02  3b 98 3b 72  ..<.V.._d...;.;r        99.1.0        
                         3c 98 3b 70  3b 95 3a 72  39 96 3a 72  38 99 39 74  <.;p;.:r9.:r8.9t        99.1.16       
                         39 9b 38 73  38 98 39 70  38 96 3a 71  3a 96 38 71  9.8s8.9p8.:q:.8q        99.1.32       
                         38 96 39 73  39 95 39 72  39 96 3a 75  39 98 38 75  8.9s9.9r9.:u9.8u        99.1.48       
                         38 97 38 72  38 98 38 73  37 99 37                  8.8r8.8s7.7             99.1.64       
  26.3     72128  ISOC   0c 8d 3c c7  56 bb 27 8f  71 bb 39 03  0f 7d 0c 7f  ..<.V.'.q.9.....       100.1.0        
                         0c 80 0c 80  0e 7f 0f 80  11 7d 13 81  17 7d 19 85  ................       100.1.16       
                         1c 7b 20 85  22 79 26 88  2a 77 2e 8d  31 73 35 8e  .. ."y&.*w..1s5.       100.1.32       
                         39 71 3f 91  38 70 0a 82  1c 77 99 8a  f1 57 ee 8b  9q?.8p...w...W..       100.1.48       
                         84 63 56 8a  91 5e 9c 93  9d 63 9c                  .cV..^...c.            100.1.64       
  26.3     79834  ISOC   0c 8c 42 de  71 bb 9d be  7e bb b9 03  4d 9e 4c 70  ..B.q.......M.Lp       101.1.0        
                         4a 9e 49 71  47 9e 46 6f  44 9a 43 73  42 9c 43 74  J.IqG.FoD.CsB.Ct       101.1.16       
                         43 9d 42 73  42 9e 42 75  42 9d 43 6f  44 99 43 71  C.BsB.BuB.CoD.Cq       101.1.32       
                         42 9a 42 74  42 9c 42 75  41 9e 42 76  42 9d 42 71  B.BtB.BuA.BvB.Bq       101.1.48       
                         42 9b 43 71  43 9b 42 74  41 9e 41                  B.CqC.BtA.A            101.1.64       
  26.3     72358  ISOC   0c 8c 42 de  71 bb e2 ed  8b bb 39 04  92 7e 8d 81  ..B.q.....9.....       102.1.0        
                         8b 80 8a 81  84 7f 7f 86  76 7c 49 81  3a 7c c1 7c  ........v.I.:...       102.1.16       
                         f1 7f f1 7b  f6 7f fd 7f  c8 7e 2c 7f  2c 7d 63 80  ..........,.,.c.       102.1.32       
                         60 81 54 7f  4e 81 4a 81  45 7e 31 7f  3b 7d 7b 7f  `.T.N.J.E.1.;...       102.1.48       
                         9c 85 ba 7d  65 81 06 7d  27 7b 31                  ....e...'.1            102.1.64       
  26.3     79616  ISOC   0c 8d 39 10  8d bb 86 1d  99 bb b9 04  4b 9e 49 74  ..9.........K.It       103.1.0        
                         45 9e 45 74  44 9e 43 70  42 9b 41 71  41 9e 42 76  E.EtD.CpB.AqA.Bv       103.1.16       
                         43 9e 44 70  43 9c 43 73  43 9d 44 73  43 9e 44 72  C.DpC.CsC.DsC.Dr       103.1.32       
                         41 9d 40 6f  41 9b 40 6e  40 9a 41 72  43 9a 43 74  A.@oA.@n@.ArC.Ct       103.1.48       
                         42 9d 41 73  40 9b 41 70  40 98 40                  B.As@.Ap@.@            103.1.64       
  26.3     72576  ISOC   0c 8d 39 10  8d bb 99 4c  a6 bb 39 05  5b 83 37 7a  ..9....L..9.[.7z       104.1.0        
                         15 80 12 7b  16 80 1a 7e  1a 80 1a 80  1a 81 1a 7f  ................       104.1.16       
                         1a 81 1a 7f  19 81 19 7f  18 81 18 7f  13 81 11 7e  ................       104.1.32       
                         0f 80 0e 7c  0e 7e 07 7e  0b 7e 45 7c  89 7d 86 76  ..........E....v       104.1.48       
                         1e 77 09 7a  29 7b 2f 78  1d 7b 1e                  .w.z)./x...            104.1.64       
  26.3     79616  ISOC   0c 8c 39 27  a8 bb 3c 7c  b3 bb b9 05  4b 9e 49 71  ..9'..<.....K.Iq       105.1.0        
                         45 9e 45 70  45 9c 44 72  43 9e 44 6e  43 9d 43 71  E.EpE.DrC.DnC.Cq       105.1.16       
                         43 9d 44 72  44 9d 44 73  43 9e 43 74  43 9e 43 71  C.DrD.DsC.CtC.Cq       105.1.32       
                         43 9d 43 73  42 9a 43 73  43 9c 42 71  41 98 41 73  C.CsB.CsC.BqA.As       105.1.48       
                         41 9a 42 71  43 98 43 70  43 9c 40                  A.BqC.CpC.@            105.1.64       
  26.3     72576  ISOC   0c 8c 39 27  a8 bb a0 ab  c0 bb 39 06  78 87 74 7e  ..9'......9.x.t.       106.1.0        
                         74 85 76 7e  75 82 73 7f  73 84 74 7b  74 83 74 7a  t.v.u.s.s.t.t.tz       106.1.16       
                         6a 81 49 7b  85 7d c5 81  ee 80 f6 80  ef 7f cf 7d  j.I.............       106.1.32       
                         93 7a 81 81  be 7d ff 76  7d 7a 29 76  81 81 8d 81  .z.....v.z)v....       106.1.48       
                         76 81 6a 83  69 7f 66 82  5e 79 42                  v.j.i.f.^yB            106.1.64       
  26.3     79616  ISOC   0c 8d 35 59  c3 bb f3 da  cd bb b9 06  49 9b 47 6e  ..5Y........I.Gn       107.1.0        
                         44 99 45 6f  43 9d 43 73  44 9c 44 75  44 9e 43 73  D.EoC.CsD.DuD.Cs       107.1.16       
                         42 9e 43 72  43 9c 43 72  43 9c 43 74  43 9f 42 71  B.CrC.CrC.CtC.Bq       107.1.32       
                         42 98 42 6f  42 97 42 70  42 9b 42 75  41 9e 41 75  B.BoB.BpB.BuA.Au       107.1.48       
                         41 9d 42 76  42 9d 41 73  42 9b 42                  A.BvB.AsB.B            107.1.64       
  26.3     72576  ISOC   0c 8d 35 59  c3 bb 59 0a  db bb 39 07  92 80 93 7e  ..5Y..Y...9.....       108.1.0        
                         9e 7d b5 7e  d4 7e e9 81  f1 80 e7 80  c4 7d a0 7e  ................       108.1.16       
                         74 7a 2f 7d  58 7a 9b 7f  ab 7d a6 7f  9d 7e 9c 7d  tz/.Xz..........       108.1.32       
                         9f 7f 9f 7e  b0 81 d3 81  50 80 00 7a  16 81 1b 7c  ........P..z....       108.1.48       
                         1b 82 1b 7d  1d 82 23 7b  2b 84 38                  ......#.+.8            108.1.64       
  26.3     79616  ISOC   0c 8c 32 70  de bb af 39  e8 bb b9 07  47 9e 44 74  ..2p...9....G.Dt       109.1.0        
                         43 9d 43 70  43 99 42 71  42 9b 42 71  42 9d 43 70  C.CpC.BqB.BqB.Cp       109.1.16       
                         43 9b 44 72  44 9c 44 6f  43 9c 43 70  43 9a 43 73  C.DrD.DoC.CpC.Cs       109.1.32       
                         42 9b 42 72  42 98 43 71  43 99 42 72  41 9c 43 6f  B.BrB.CqC.BrA.Co       109.1.48       
                         42 9d 41 76  41 9d 42 73  41 9b 41                  B.AvA.BsA.A            109.1.64       
  26.3     72454  ISOC   0c 8c 32 70  de bb 11 69  f5 bb 39 00  56 80 36 7b  ..2p...i..9.V.6.       110.1.0        
                         47 7f 6f 7e  92 7e 9f 82  a5 7e a1 82  9e 80 9b 7f  G.o.............       110.1.16       
                         98 80 93 7b  8e 7e 8b 7b  8d 7f 91 7f  95 7e 7f 81  ................       110.1.32       
                         47 7f 1e 7a  05 7f 0a 7e  10 80 14 7e  15 81 15 7f  G..z............       110.1.48       
                         17 81 18 7f  1c 81 22 7c  27 80 36                  ......".'.6            110.1.64       
  26.3     79738  ISOC   0c 8d 33 a2  f9 bb 45 98  02 bc b9 00  f1 7f f2 7c  ..3...E.........       111.1.0        
                         f1 7f f1 7c  f0 7f ef 7c  f2 7f f2 7e  f3 7f f4 80  ................       111.1.16       
                         f4 80 f4 80  f4 80 f4 80  f4 80 f4 80  f4 80 f4 80  ................       111.1.32       
                         f4 80 f4 80  f4 80 f4 80  f4 80 f4 80  f4 80 f4 80  ................       111.1.48       
                         f4 80 f4 80  f3 80 f3 7f  f3 7f f1                  ...........            111.1.64       
  26.3     72214  ISOC   0c 8d 33 a2  f9 bb c8 c7  0f bc 39 01  9d 81 9b 7f  ..3.......9.....       112.1.0        
                         9a 81 97 7f  97 80 96 7f  93 7f 94 7f  92 7f 92 7e  ................       112.1.16       
                         93 80 93 7c  8b 7f 8e 7e  8c 7e 8e 82  8a 7e 81 80  ................       112.1.32       
                         7c 80 74 7e  62 82 61 79  3e 80 04 7a  13 7f 18 7f  ..t.b.ay>..z....       112.1.48       
                         15 81 14 7e  14 81 17 7f  18 81 19                  ...........            112.1.64       
  26.3     79962  ISOC   0c 8c 6a b9  14 bc d3 f6  1c bc b9 01  7f 3d 7c 98  ..j..........=..       113.1.0        
                         82 47 7d 96  7e 43 81 95  80 3e 81 97  82 43 82 98  .G...C...>...C..       113.1.16       
                         81 40 82 95  83 41 84 96  85 47 83 94  84 41 84 95  .@...A...G...A..       113.1.32       
                         85 43 86 96  86 48 87 96  86 4b 86 96  87 46 87 95  .C...H...K...F..       113.1.48       
                         88 46 5b 90  97 70 f5 7f  a3 73 e1                  .F[..p...s.            113.1.64       
  26.3     72000  ISOC   0c 8c 6a b9  14 bc 7d 26  2a bc 39 02  36 80 36 7d  ..j....&*.9.6.6.       114.1.0        
                         3a 83 40 7f  42 82 44 7b  43 83 3f 7d  a6 7f a5 81  :.@.B.D.C.?.....       114.1.16       
                         a4 80 a0 7f  9e 7e 9c 7f  9d 80 9e 7e  95 7d 8f 7f  ................       114.1.32       
                         8f 7f 8e 7e  8d 7d 8c 7f  8a 7e 88 7d  86 7c 87 7f  ................       114.1.48       
                         82 7d 80 7f  7f 7f 7e 7e  7a 7c 78                  ........z.x            114.1.64       
  26.3     79940  ISOC   0c 8d 31 eb  2f bc 8d 55  37 bc b9 02  51 79 51 7e  ..1./..U7...QyQ.       115.1.0        
                         53 78 53 7f  54 79 53 7b  52 79 52 7c  51 7b 53 85  SxS.TyS.RyR.Q.S.       115.1.16       
                         53 7a 53 7c  52 78 52 79  54 7a 54 81  54 7b 54 7e  SzS.RxRyTzT.T.T.       115.1.32       
                         53 79 55 7d  55 78 54 7f  53 77 53 7c  51 79 51 7a  SyU.UxT.SwS.QyQz       115.1.48       
                         51 79 51 7e  51 7c 52 7e  51 77 51                  QyQ.Q.R.QwQ            115.1.64       
  26.3     72204  ISOC   0c 8d 31 eb  2f bc db 84  44 bc 39 03  28 80 28 7f  ..1./...D.9.(.(.       116.1.0        
                         27 82 18 80  00 7e 95 7e  ff 7e ff 81  9a 7c 05 88  '...............       116.1.16       
                         27 80 30 83  2b 82 28 80  26 83 25 7e  27 83 28 80  '.0.+.(.&.%.'.(.       116.1.32       
                         28 81 2b 7f  2c 81 2c 81  28 82 20 7e  17 82 28 7a  (.+.,.,.(. ...(z       116.1.48       
                         51 81 5d 7d  60 7f 63 7f  65 7d 66                  Q.].`.c.e.f            116.1.64       
  26.3     79762  ISOC   0c 8c 82 02  4b bc 91 b4  51 bc b9 03  48 80 48 80  ....K...Q...H.H.       117.1.0        
                         4f 7f 63 80  6b 7b 71 83  7a 7b 79 85  7b 7f 86 82  O.c.k.q.z.y.....       117.1.16       
                         87 7b 82 82  8e 7b 90 83  8f 7d 8e 81  8c 7d 88 82  ................       117.1.32       
                         85 7c 87 84  84 7d 81 80  81 7f 7d 7e  77 7c 79 7e  ............w.y.       117.1.48       
                         75 7b 6f 7e  6b 7a 6c 7a  64 7a 62                  u.o.kzlzdzb            117.1.64       
  26.3     72430  ISOC   0c 8c 82 02  4b bc a5 e3  5e bc 39 04  38 73 38 92  ....K...^.9.8s8.       118.1.0        
                         38 73 3a 95  39 70 39 93  38 74 39 94  38 72 38 94  8s:.9p9.8t9.8r8.       118.1.16       
                         38 75 38 94  37 73 38 94  35 70 36 94  37 70 35 92  8u8.7s8.5p6.7p5.       118.1.32       
                         35 71 34 92  35 71 33 8f  32 78 30 8e  29 7c 1f 8a  5q4.5q3.2x0.)...       118.1.48       
                         1a 7d 12 84  12 7e 13 81  13 7e 13                  ...........            118.1.64       
  26.3     79616  ISOC   0c 8d d0 19  66 bc 48 13  6c bc b9 04  15 81 19 7d  ....f.H.l.......       119.1.0        
                         18 82 19 7d  1e 89 25 7b  28 92 2a 79  29 94 27 76  ......%.(.*y).'v       119.1.16       
                         24 94 1f 78  1d 8b 1d 79  1e 8c 21 7a  23 90 27 78  $..x...y..!z#.'x       119.1.32       
                         2c 96 2a 75  3a 9a 41 75  42 9e 3e 75  39 9a 34 77  ,.*u:.AuB.>u9.4w       119.1.48       
                         32 96 39 75  4d 8d 53 7a  53 86 54                  2.9uM.SzS.T            119.1.64       
  26.3     72576  ISOC   0c 8d d0 19  66 bc 5a 42  79 bc 39 05  4f 9e 4d 72  ....f.ZBy.9.O.Mr       120.1.0        
                         4c 9f 4a 73  49 a0 48 74  44 9e 44 6f  44 9c 42 72  L.JsI.HtD.DoD.Br       120.1.16       
                         3f 9d 40 70  3f 9c 3e 72  3f 9b 3e 74  3e 9b 3d 70  ?.@p?.>r?.>t>.=p       120.1.32       
                         3d 9a 3d 6f  3d 99 3d 72  3d 99 3e 73  3d 9b 3d 73  =.=o=.=r=.>s=.=s       120.1.48       
                         3c 99 3c 72  3c 97 39 70  37 92 1d                  <.<r<.9p7..            120.1.64       
  26.3     79616  ISOC   0c 8c 7f 4b  81 bc ff 71  86 bc b9 05  23 7e 26 88  ...K...q....#.&.       121.1.0        
                         2b 7e 30 83  3a 80 43 80  47 84 48 79  48 82 46 7c  +.0.:.C.G.HyH.F.       121.1.16       
                         47 83 48 7b  47 83 48 79  49 82 4a 7b  4b 83 4b 7c  G.H.G.HyI.J.K.K.       121.1.32       
                         4b 85 4b 7c  4c 81 4b 7e  4c 84 4c 7c  4b 84 4a 7b  K.K.L.K.L.L.K.J.       121.1.48       
                         4b 80 4c 7c  4c 83 4c 7b  4b 83 4c                  K.L.L.L.K.L            121.1.64       
  26.3     72576  ISOC   0c 8c 7f 4b  81 bc 5b a1  93 bc 39 06  4d a3 4c 75  ...K..[...9.M.Lu       122.1.0        
                         4a a0 4a 71  49 9f 48 6e  48 9c 47 6d  44 9c 42 6f  J.JqI.HnH.GmD.Bo       122.1.16       
                         3f 9d 3f 6f  40 9c 40 73  3f 9c 3f 75  40 9c 3f 74  ?.?o@.@s?.?u@.?t       122.1.32       
                         3e 9d 3e 71  3e 9b 3e 70  3e 9c 3d 74  3d 9b 3d 72  >.>q>.>p>.=t=.=r       122.1.48       
                         3e 9b 3d 71  3d 9b 3c 73  3c 9a 3c                  >.=q=.<s<.<            122.1.64       
  26.3     79616  ISOC   0c 8d 73 63  9c bc ba d0  a0 bc b9 06  26 81 24 81  ..sc........&.$.       123.1.0        
                         27 7e 2b 81  45 7c 45 86  41 7e 40 83  42 83 40 7b  '.+.E.E.A.@.B.@.       123.1.16       
                         41 81 41 79  41 80 42 7a  42 81 41 77  41 81 42 7c  A.AyA.BzB.AwA.B.       123.1.32       
                         43 82 42 7d  41 81 3f 7b  3e 82 3f 75  41 82 42 7c  C.B.A.?.>.?uA.B.       123.1.48       
                         42 85 40 7f  3f 84 41 7d  41 82 41                  B.@.?.A.A.A            123.1.64       
  26.3     72576  ISOC   0c 8d 73 63  9c bc 0f 00  ae bc 39 07  4d 9e 4b 74  ..sc......9.M.Kt       124.1.0        
                         4a 9e 49 71  49 9e 46 70  44 9d 44 71  43 9b 43 76  J.IqI.FpD.DqC.Cv       124.1.16       
                         42 9c 41 75  41 9c 41 76  40 9d 40 76  40 9b 41 74  B.AuA.Av@.@v@.At       124.1.32       
                         40 9c 40 73  41 98 40 73  3f 9b 3f 73  3f 9c 3e 75  @.@sA.@s?.?s?.>u       124.1.48       
                         3e 9c 3f 77  3f 9d 3e 77  3c 9c 3c                  >.?w?.>w<.<            124.1.64       
  26.3     79616  ISOC   0c 8c 7b 94  b7 bc 6f 2f  bb bc b9 07  9f 7d 7a 85  ......o/......z.       125.1.0        
                         30 7a 00 7d  33 7f c6 7f  77 87 ba 7d  fc 80 f7 80  0z..3...w.......       125.1.16       
                         fe 7f c0 7e  11 7f 4b 7b  5c 86 5d 79  5e 86 5c 78  ......K.\.]y^.\x       125.1.32       
                         59 85 59 7c  59 86 5b 7e  5c 86 5d 7e  5d 81 5c 79  Y.Y.Y.[.\.].].\y       125.1.48       
                         5d 85 5c 7e  5d 86 5d 7a  5e 82 5e                  ].\.].]z^.^            125.1.64       
  26.3     72372  ISOC   0c 8c 7b 94  b7 bc cf 5e  c8 bc 39 00  4c 9f 4b 70  .......^..9.L.Kp       126.1.0        
                         4a 9e 49 6d  48 9d 45 6f  45 9e 45 70  44 9d 42 73  J.ImH.EoE.EpD.Bs       126.1.16       
                         42 9c 40 74  40 9c 3f 70  3f 9c 40 71  41 9e 41 73  B.@t@.?p?.@qA.As       126.1.32       
                         41 9b 3f 72  3f 9c 3f 71  40 9c 40 73  40 9a 3f 76  A.?r?.?q@.@s@.?v       126.1.48       
                         3e 98 3e 75  3e 97 3f 73  3f 98 3d                  >.>u>.?s?.=            126.1.64       
  26.3     79820  ISOC   0c 8d 82 ab  d2 bc da 8d  d5 bc b9 00  f4 80 f4 80  ................       127.1.0        
                         f4 80 f4 80  f4 80 f4 80  f4 80 f4 80  f4 80 f4 80  ................       127.1.16       
                         f4 80 f4 80  f4 80 f4 80  f4 80 f4 80  f4 80 f4 80  ................       127.1.32       
                         f4 80 f4 80  f4 80 f4 80  f4 80 f4 80  f4 80 f4 80  ................       127.1.48       
                         f4 80 f4 80  f4 80 f4 80  f4 80 f4                  ...........            127.1.64       
  26.3     72144  ISOC   0c 8d 82 ab  d2 bc 86 bd  e2 bc 39 01  4d a2 4c 73  ..........9.M.Ls       128.1.0        
                         4c 9e 4b 72  49 9d 49 73  49 9c 48 72  45 9d 43 75  L.KrI.IsI.HrE.Cu       128.1.16       
                         42 9c 40 72  41 99 42 70  41 99 42 74  43 9c 43 75  B.@rA.BpA.BtC.Cu       128.1.32       
                         42 9d 42 75  42 9b 42 74  42 9a 41 74  40 9b 40 72  B.BuB.BtB.At@.@r       128.1.48       
                         40 9d 41 76  40 98 3f 72  3e 98 3f                  @.Av@.?r>.?            128.1.64       
  26.3     79960  ISOC   0c 8c 78 dd  ed bc 99 ec  ef bc b9 01  01 82 1a 7e  ..x.............       129.1.0        
                         19 83 17 7d  16 82 16 7c  16 81 17 7d  17 81 17 7d  ................       129.1.16       
                         17 82 17 7c  16 82 16 7c  17 81 17 7d  17 81 17 7b  ................       129.1.32       
                         18 81 0e 7d  13 83 d5 7f  98 7e 00 79  79 83 68 54  ...........yy.hT       129.1.48       
                         64 91 65 4f  65 92 65 4b  67 91 68                  d.eOe.eKg.h            129.1.64       
  26.3     72024  ISOC   0c 8c 78 dd  ed bc 3d 1c  fd bc 39 02  4a 82 41 7d  ..x...=...9.J.A.       130.1.0        
                         38 83 30 80  27 84 1f 79  19 85 26 7b  35 82 41 82  8.0.'..y..&.5.A.       130.1.16       
                         4d 80 57 85  66 80 78 85  86 7d 87 83  89 80 81 85  M.W.f.x.........       130.1.32       
                         70 84 5c 80  50 81 42 81  36 82 25 80  17 83 15 7d  p.\.P.B.6.%.....       130.1.48       
                         28 83 37 81  44 7f 50 82  5e 7f 6e                  (.7.D.P.^.n            130.1.64       
  26.3     79918  ISOC   0c 8d 82 f4  08 bd 53 49  0a bd b9 02  6a 81 6a 7a  ......SI....j.jz       131.1.0        
                         69 81 69 7a  69 82 6b 7d  6a 81 69 7a  69 83 6a 7d  i.izi.k.j.izi.j.       131.1.16       
                         6a 86 6a 7f  69 82 69 7b  68 82 69 7a  69 82 69 7b  j.j.i.i.h.izi.i.       131.1.32       
                         69 82 6a 7d  6a 83 69 7b  69 82 69 7b  68 82 6a 79  i.j.j.i.i.i.h.jy       131.1.48       
                         6b 81 6b 79  6b 82 6a 7c  6a 82 6b                  k.kyk.j.j.k            131.1.64       
  26.3     76114  ISOC   0c 8d 82 f4  08 bd a4 7a  17 bd 39 03  5a 6d 55 a0  .......z..9.ZmU.       132.1.0        
                         4d 75 4b 9e  4a 74 22 9d  6f 79 83 8f  64 6e 6d 9c  MuK.Jt".oy..dnm.       132.1.16       
                         6d 72 57 90  5f 78 7d 86  7d 74 89 88  99 77 ae 8e  mrW._x...t...w..       132.1.32       
                         b6 7f ba 87  c6 7f b8 85  58 75 5a 8c  83 73 95 8e  ........XuZ..s..       132.1.48       
                         9e 84 a8 86  a1 8b a4 7e  a8 89 a9                  ...........            132.1.64       
  26.3     75850  ISOC   0c 8c 75 26  24 bd 0d a8  24 bd b9 03  9f 7d 7a 85  ..u&$...$.....z.       133.1.0        
                         30 7a 00 7d  33 7f c6 7f  77 87 ba 7d  fc 80 f7 80  0z..3...w.......       133.1.16       
                         fe 7f c0 7e  11 7f 4b 7b  5c 86 5d 79  5e 86 5c 78  ......K.\.]y^.\x       133.1.32       
                         59 85 59 7c  59 86 5b 7e  5c 86 5d 7e  5d 81 5c 79  Y.Y.Y.[.\.].].\y       133.1.48       
                         5d 85 5c 7e  5d 86 5d 7a  5e 82 5e                  ].\.].]z^.^            133.1.64       
  26.3     79942  ISOC   0c 8c 75 26  24 bd 62 d9  31 bd 39 04  41 74 41 9c  ..u&$.b.1.9.AtA.       134.1.0        
                         41 74 40 9c  42 74 42 9d  42 75 41 9d  40 74 3f 98  At@.BtB.BuA.@t?.       134.1.16       
                         3e 75 3e 9b  3e 75 3d 98  3e 6f 3e 97  3e 70 3e 97  >u>.>u=.>o>.>p>.       134.1.32       
                         3e 6e 3e 97  3e 72 3e 9c  3d 74 3d 98  3c 72 3d 98  >n>.>r>.=t=.<r=.       134.1.48       
                         3d 76 3e 9b  3c 77 3b 98  3c 74 3b                  =v>.<w;.<t;            134.1.64       
  26.3     72176  ISOC   0c 8c 75 26  24 bd b8 08  3f bd b9 04  64 77 73 84  ..u&$...?...dws.       135.1.0        
                         81 77 82 87  80 76 79 84  65 79 4a 81  32 7d 17 81  .w...vy.eyJ.2...       135.1.16       
                         11 7f 10 7d  16 7d 25 81  3e 7c 4e 83  4e 79 4e 81  ......%.>.N.NyN.       135.1.32       
                         4d 78 51 81  21 78 2b 83  29 7a 2d 81  11 7d 10 7f  MxQ.!x+.)z-.....       135.1.48       
                         0f 81 0f 7f  10 7f 12 7f  14 7d 16                  ...........            135.1.64       
  26.3     79788  ISOC   0c 8d 7c 3d  3f bd 5f 38  4c bd 39 05  4c 9e 4b 6f  ...=?._8L.9.L.Ko       136.1.0        
                         4b 9f 4b 71  4a a0 46 71  44 9e 44 6f  44 9d 44 6f  K.KqJ.FqD.DoD.Do       136.1.16       
                         45 9c 45 6e  45 9b 45 75  45 9b 46 73  47 9b 45 76  E.EnE.EuE.FsG.Ev       136.1.32       
                         42 9b 42 75  43 9d 44 73  43 99 43 70  42 9a 44 6f  B.BuC.DsC.CpB.Do       136.1.48       
                         44 99 44 73  44 9b 43 73  42 9a 42                  D.DsD.CsB.B            136.1.64       
  26.3     72404  ISOC   0c 8d 7c 3d  3f bd 7b 67  59 bd b9 05  a9 83 aa 7f  ...=?..gY.......       137.1.0        
                         aa 82 ab 80  a6 85 ad 80  b0 82 ab 81  af 83 68 7b  ..............h.       137.1.16       
                         23 84 02 7c  83 81 ec 80  0a 7f 87 80  93 81 a6 7d  #...............       137.1.32       
                         81 82 ab 80  99 84 94 80  95 82 91 7f  8e 82 87 7f  ................       137.1.48       
                         86 82 84 81  7a 83 43 7c  50 7f d5                  ....z.C.P..            137.1.64       
  26.3     79616  ISOC   0c 8c 73 6f  5a bd 1a 97  66 bd 39 06  4c 9e 4b 71  ..soZ...f.9.L.Kq       138.1.0        
                         48 9d 45 70  46 9e 47 70  45 9e 45 71  45 9d 45 72  H.EpF.GpE.EqE.Er       138.1.16       
                         45 9b 44 73  43 9e 45 72  45 9f 44 75  44 9e 44 74  E.DsC.ErE.DuD.Dt       138.1.32       
                         44 9d 44 6f  45 9a 43 73  42 9c 44 74  43 9c 44 70  D.DoE.CsB.DtC.Dp       138.1.48       
                         44 9c 44 74  44 9b 43 73  43 98 43                  D.DtD.CsC.C            138.1.64       
  26.3     72576  ISOC   0c 8c 73 6f  5a bd 31 c6  73 bd b9 06  0f 80 17 7c  ..soZ.1.s.......       139.1.0        
                         1c 80 1d 7f  1c 81 1c 7e  1b 81 1b 7f  1b 82 1b 7f  ................       139.1.16       
                         1b 81 17 7e  13 81 10 7c  12 80 12 7b  16 80 20 78  .............. x       139.1.32       
                         2f 7f 45 79  49 7a 5d 78  bc 78 f8 80  e8 7c b6 7c  /.EyIz]x.x......       139.1.48       
                         77 73 39 78  59 76 78 80  7d 7d ae                  ws9xYvx....            139.1.64       
  26.3     79616  ISOC   0c 8d 6c 86  75 bd d7 f5  80 bd 39 07  4c 9a 4b 72  ..l.u.....9.L.Kr       140.1.0        
                         49 9a 48 71  47 9e 45 71  45 9e 45 71  44 9e 44 71  I.HqG.EqE.EqD.Dq       140.1.16       
                         44 9b 44 70  45 9a 45 70  44 9c 45 73  45 9e 45 70  D.DpE.EpD.EsE.Ep       140.1.32       
                         45 9e 44 72  43 99 44 71  46 9d 45 70  44 98 44 71  E.DrC.DqF.EpD.Dq       140.1.48       
                         43 98 43 73  43 99 43 71  43 9a 43                  C.CsC.CqC.C            140.1.64       
  26.3     72576  ISOC   0c 8d 6c 86  75 bd 33 25  8e bd b9 07  75 87 74 7d  ..l.u.3%....u.t.       141.1.0        
                         73 86 70 7d  73 83 72 79  72 82 72 7a  72 82 74 7c  s.p.s.ryr.rzr.t.       141.1.16       
                         77 82 6e 7d  5c 80 84 80  c4 7e f0 81  f2 80 ec 81  w.n.\...........       141.1.32       
                         ed 7e ed 7e  f8 7e 5e 7c  00 7d 58 7d  76 82 63 7e  ......^...X.v.c.       141.1.48       
                         45 83 41 7d  43 80 2d 7d  22 7f 06                  E.A.C.-."..            141.1.64       
  26.3     79616  ISOC   0c 8c 70 b8  90 bd 8d 54  9b bd 39 00  4a 9b 49 70  ..p....T..9.J.Ip       142.1.0        
                         48 9c 46 74  46 9c 44 6f  44 9c 45 70  44 9e 44 6c  H.FtF.DoD.EpD.Dl       142.1.16       
                         43 9a 43 6c  45 98 45 6f  45 9b 44 72  45 9b 46 74  C.ClE.EoE.DrE.Ft       142.1.32       
                         44 9c 44 73  44 9b 44 70  43 98 44 70  42 96 43 73  D.DsD.DpC.DpB.Cs       142.1.48       
                         43 98 43 73  44 98 43 74  43 9d 43                  C.CsD.CtC.C            142.1.64       
  26.3     72576  ISOC   0c 8c 70 b8  90 bd f2 83  a8 bd b9 00  d5 80 bb 7e  ..p.............       143.1.0        
                         92 7b 93 80  97 7b b6 81  e0 7d f1 81  ec 7f d7 7f  ................       143.1.16       
                         c8 7d c1 7c  b0 7c a7 7c  9e 7e 9d 7d  a0 82 a2 80  ................       143.1.32       
                         a4 82 b3 81  d5 81 5f 80  00 7e 16 7d  1f 81 20 7e  ......_....... .       143.1.48       
                         22 82 23 7e  26 82 2b 7e  32 82 3a                  ".#.&.+.2.:            143.1.64       
  26.3     79616  ISOC   0c 8d 72 cf  ab bd 46 b3  b5 bd 39 01  49 9e 47 72  ..r...F...9.I.Gr       144.1.0        
                         47 9e 47 6d  47 9a 45 6f  43 9b 44 71  45 9c 45 70  G.GmG.EoC.DqE.Ep       144.1.16       
                         45 9b 44 71  44 9b 44 71  45 9a 45 70  46 9e 45 6f  E.DqD.DqE.EpF.Eo       144.1.32       
                         43 98 43 6f  45 98 46 6f  45 98 44 6f  43 9a 42 75  C.CoE.FoE.DoC.Bu       144.1.48       
                         42 9c 42 74  43 9c 43 73  44 9c 43                  B.BtC.CsD.C            144.1.64       
  26.3     72400  ISOC   0c 8d 72 cf  ab bd a6 e2  c2 bd b9 01  b1 7d b1 7b  ..r.............       145.1.0        
                         a4 7b a0 7e  9b 7f 99 7f  99 81 9a 7d  99 81 95 7e  ................       145.1.16       
                         94 80 8f 7c  91 80 9a 83  99 7f 6d 82  34 7f 12 7c  ..........m.4...       145.1.32       
                         0a 7f 0e 7d  12 80 15 7f  15 81 13 7e  13 80 18 7f  ................       145.1.48       
                         1a 81 1a 7d  1b 7f 1d 7c  26 80 2d                  ........&.-            145.1.64       
  26.3     79792  ISOC   0c 8c 6e 01  c7 bd b8 11  d0 bd 39 02  f2 7f f3 80  ..n.......9.....       146.1.0        
                         f4 80 f4 80  f3 7f f3 7f  f3 7f f3 7f  f2 7e f2 7f  ................       146.1.16       
                         f4 7f f4 80  f4 80 f1 7f  ec 7d ef 7f  f2 7d f2 7f  ................       146.1.32       
                         f1 7c f0 7f  f0 7d f1 7f  ef 7c f2 7f  f2 7d f1 7f  ................       146.1.48       
                         ee 7a ef 7f  f2 7e f1 7f  f2 7d f0                  .z.........            146.1.64       
  26.3     72170  ISOC   0c 8c 6e 01  c7 bd 60 41  dd bd b9 02  9c 82 9b 7e  ..n...`A........       147.1.0        
                         99 81 98 80  98 81 98 7f  98 80 99 7f  9d 7d 95 81  ................       147.1.16       
                         85 80 7d 7f  6c 84 62 7d  54 83 4c 78  40 84 34 7b  ....l.b.T.Lx@.4.       147.1.32       
                         26 81 1c 7d  1d 81 23 7c  1c 81 1a 7c  1d 7f 26 7e  &.....#.......&.       147.1.48       
                         26 80 23 7d  1a 7f 18 7d  19 7f 21                  &.#.......!            147.1.64       
  26.3     79962  ISOC   0c 8d be 18  e2 bd 73 70  ea bd 39 03  12 7d 11 81  ......sp..9.....       148.1.0        
                         11 7f 12 82  12 7e 12 82  12 7c 12 81  13 7d 14 81  ................       148.1.16       
                         15 7e 07 81  1a 7f f7 7f  6e 7f 2a 83  a4 52 7f 91  ........n.*..R..       148.1.32       
                         81 3f 82 99  83 40 81 99  81 3d 81 98  83 45 66 94  .?...@...=...Ef.       148.1.48       
                         80 47 81 95  80 3e 82 98  83 45 86                  .G...>...E.            148.1.64       
  26.3     71998  ISOC   0c 8d be 18  e2 bd 18 a0  f7 bd b9 03  35 7e 39 82  ............5.9.       149.1.0        
                         3c 82 3d 80  40 80 43 80  43 7f 43 7f  44 80 42 7f  <.=.@.C.C.C.D.B.       149.1.16       
                         3e 81 3d 81  3d 80 3f 7e  40 80 3f 7e  3f 80 3d 7e  >.=.=.?.@.?.?.=.       149.1.32       
                         3a 81 38 81  37 81 35 7f  38 83 3a 7f  3c 84 3e 7f  :.8.7.5.8.:.<.>.       149.1.48       
                         40 83 42 7b  43 83 43 7d  9b 80 99                  @.B.C.C....            149.1.64       
  26.3     79942  ISOC   0c 8c 0d 30  fd bd 26 cf  04 be 39 04  52 7f 53 7d  ...0..&...9.R.S.       150.1.0        
                         53 7e 53 7b  54 7a 53 7c  54 7f 54 7e  53 7e 54 7d  S.S.TzS.T.T.S.T.       150.1.16       
                         54 7e 55 78  53 7b 54 79  53 7d 53 7c  53 83 54 7f  T.UxS.TyS.S.S.T.       150.1.32       
                         54 80 54 7c  53 7c 53 7f  52 7f 52 7b  54 7b 55 7a  T.T.S.S.R.R.T.Uz       150.1.48       
                         54 7f 53 7b  54 80 54 79  55 7a 55                  T.S.T.TyUzU            150.1.64       
  26.3     72248  ISOC   0c 8c 0d 30  fd bd 7a fe  11 be b9 04  bb 7a bd 82  ...0..z......z..       151.1.0        
                         ba 7b b9 81  b8 7a b3 80  b0 77 ab 82  9b 7a a7 83  .....z...w...z..       151.1.16       
                         a0 78 9c 81  97 77 bd 86  68 79 01 7e  1a 7f 1e 7f  .x...w..hy......       151.1.32       
                         21 80 24 80  28 7f 2c 81  2c 81 2b 81  24 81 00 7d  !.$.(.,.,.+.$...       151.1.48       
                         3b 7d f2 80  ff 7e f6 86  33 83 07                  ;.......3..            151.1.64       
  26.3     79716  ISOC   0c 8d ba 61  18 be 26 2e  1f be 39 05  86 7b 87 81  ...a..&...9.....       152.1.0        
                         86 7c 84 81  7f 7b 7a 7e  78 7d 74 7f  73 7b 73 7d  ......z.x.t.s.s.       152.1.16       
                         70 7b 72 7e  73 7c 73 7f  6e 7a 69 7e  69 7c 69 7f  p.r.s.s.nzi.i.i.       152.1.32       
                         63 77 5b 7d  57 7b 57 7b  59 7b 58 7f  5a 7c 5e 7d  cw[.W.W.Y.X.Z.^.       152.1.48       
                         5a 77 56 7d  57 79 5d 7d  57 7a 4d                  ZwV.Wy].WzM            152.1.64       
  26.3     72476  ISOC   0c 8d ba 61  18 be 3a 5d  2c be b9 05  3c 97 3e 76  ...a..:],...<.>v       153.1.0        
                         3c 97 3b 73  3c 99 3c 72  3b 9a 3b 75  3b 98 3c 6f  <.;s<.<r;.;u;.<o       153.1.16       
                         3c 98 3c 70  3d 99 3d 75  3d 9a 3c 73  3b 96 3b 75  <.<p=.=u=.<s;.;u       153.1.32       
                         3b 96 3b 74  3b 95 3b 74  3a 96 3a 75  3a 95 39 72  ;.;t;.;t:.:u:.9r       153.1.48       
                         39 94 38 72  38 96 37 71  38 94 39                  9.8r8.7q8.9            153.1.64       
  26.3     79616  ISOC   0c 8c f3 79  33 be e2 8c  39 be 39 06  36 86 1b 7d  ...y3...9.9.6...       154.1.0        
                         17 84 18 7d  1c 88 22 7a  26 91 29 77  27 94 26 75  ......"z&.)w'.&u       154.1.16       
                         22 91 1e 7b  1c 8c 19 7b  1b 8b 23 78  28 8f 26 78  ".........#x(.&x       154.1.32       
                         2c 95 3b 79  45 94 4b 75  4c 96 3c 73  38 99 36 74  ,.;yE.KuL.<s8.6t       154.1.48       
                         32 99 32 75  36 95 51 7a  5d 85 55                  2.2u6.Qz].U            154.1.64       
  26.3     72576  ISOC   0c 8c f3 79  33 be 20 bc  46 be b9 06  4e 9e 4c 71  ...y3. .F...N.Lq       155.1.0        
                         4a 9f 48 6e  46 9c 46 73  44 9d 44 73  43 9e 41 70  J.HnF.FsD.DsC.Ap       155.1.16       
                         41 9d 40 72  40 9a 3f 74  3e 9c 3e 73  3f 9b 3f 70  A.@r@.?t>.>s?.?p       155.1.32       
                         3e 9a 3f 70  3f 9a 3e 75  3d 9b 3f 78  40 9c 3f 76  >.?p?.>u=.?x@.?v       155.1.48       
                         3d 9b 3c 71  3b 98 3c 76  31 92 1a                  =.<q;.<v1..            155.1.64       
  26.3     79616  ISOC   0c 8d ba aa  4e be 99 eb  53 be 39 07  25 7e 26 88  ....N...S.9.%.&.       156.1.0        
                         27 7d 28 82  27 80 36 7e  4c 84 49 7b  49 85 49 7b  '.(.'.6.L.I.I.I.       156.1.16       
                         4a 86 4b 7a  4a 86 4a 7a  4a 82 4b 7a  4b 80 4b 7d  J.KzJ.JzJ.KzK.K.       156.1.32       
                         4c 85 4c 7b  4c 83 4d 7c  4d 85 4e 7f  4f 86 4e 80  L.L.L.M.M.N.O.N.       156.1.48       
                         4f 82 4d 7f  4d 80 4c 7b  4b 81 4b                  O.M.M.L.K.K            156.1.64       
  26.3     72576  ISOC   0c 8d ba aa  4e be f5 1a  61 be b9 07  4d 9e 4d 72  ....N...a...M.Mr       157.1.0        
                         4d 9e 4c 70  4b 9e 4a 71  48 9f 46 71  44 9d 44 74  M.LpK.JqH.FqD.Dt       157.1.16       
                         41 9e 3f 73  40 9c 41 72  40 9c 40 71  40 9a 3f 73  A.?s@.Ar@.@q@.?s       157.1.32       
                         40 9b 40 72  40 97 40 74  3f 99 3f 74  3e 9d 3f 75  @.@r@.@t?.?t>.?u       157.1.48       
                         3e 9b 3d 73  3e 98 3e 72  3d 99 3d                  >.=s>.>r=.=            157.1.64       
  26.3     79616  ISOC   0c 8c bc c1  69 be 56 4a  6e be 39 00  27 7c 26 81  ....i.VJn.9.'.&.       158.1.0        
                         26 7d 28 80  26 7d 40 83  3d 7e 41 86  41 82 41 7b  &.(.&.@.=.A.A.A.       158.1.16       
                         41 82 43 7d  42 84 41 7f  43 82 44 7d  43 82 42 7a  A.C.B.A.C.D.C.Bz       158.1.32       
                         41 80 43 7c  44 7f 44 7c  43 82 43 7a  43 82 44 7c  A.C.D.D.C.CzC.D.       158.1.48       
                         44 85 45 7d  46 82 48 7f  46 82 46                  D.E.F.H.F.F            158.1.64       
  26.3     72576  ISOC   0c 8c bc c1  69 be ac 79  7b be b9 00  4e 9e 4d 71  ....i..y....N.Mq       159.1.0        
                         4a 9f 49 6f  49 9e 48 72  45 9b 45 75  45 a1 44 75  J.IoI.HrE.EuE.Du       159.1.16       
                         42 9e 41 72  41 99 40 6f  40 9a 42 73  41 9b 41 75  B.ArA.@o@.BsA.Au       159.1.32       
                         41 9a 40 77  3f 9b 3f 72  3f 98 40 71  3f 96 3f 75  A.@w?.?r?.@q?.?u       159.1.48       
                         40 98 40 78  40 99 3f 78  3f 9b 3f                  @.@x@.?x?.?            159.1.64       
  26.3     79616  ISOC   0c 8d b8 f3  84 be 09 a9  88 be 39 01  95 74 96 8b  ..........9..t..       160.1.0        
                         a2 72 88 89  1d 75 02 7c  18 7e 23 7d  5c 85 95 8a  .r...u....#.\...       160.1.16       
                         bd 80 aa 66  34 7f 44 7b  5b 86 57 76  56 83 56 79  ...f4.D.[.WvV.Vy       160.1.32       
                         57 86 57 7b  56 85 56 7c  57 83 58 7a  58 82 56 7b  W.W.V.V.W.XzX.V.       160.1.48       
                         57 81 57 76  57 82 58 7a  58 86 58                  W.WvW.XzX.X            160.1.64       
  26.3     72322  ISOC   0c 8d b8 f3  84 be 65 d8  95 be b9 01  4e 9d 4c 70  ......e.....N.Lp       161.1.0        
                         4a 9e 4a 6e  49 9e 48 70  47 9e 45 72  44 9d 43 75  J.JnI.HpG.ErD.Cu       161.1.16       
                         41 9c 41 73  40 9e 40 6f  42 9c 43 70  43 9b 41 73  A.As@.@oB.CpC.As       161.1.32       
                         41 9b 40 74  41 9e 42 75  41 9b 42 73  41 9a 41 75  A.@tA.BuA.BsA.Au       161.1.48       
                         3f 98 3f 6f  3f 97 3f 70  3e 9a 3f                  ?.?o?.?p>.?            161.1.64       
  26.3     79870  ISOC   0c 8c bb 0a  a0 be 64 07  a3 be 39 02  da 73 d6 7f  ......d...9..s..       162.1.0        
                         d9 76 b6 84  69 62 5a 85  cf 76 e0 7d  d1 7c dd 7a  .v..ibZ..v.....z       162.1.16       
                         85 6f 5f 85  87 6c e0 7c  e2 7c d9 7d  ac 6f 6b 81  .o_..l.......ok.       162.1.32       
                         81 69 c4 81  8f 6b b9 7e  c0 78 e9 7d  f5 7f f4 80  .i...k...x......       162.1.48       
                         f4 80 f4 80  f4 80 f4 80  f4 80 f4                  ...........            162.1.64       
  26.3     72098  ISOC   0c 8c bb 0a  a0 be 1f 37  b0 be b9 02  4e 9e 4d 73  .......7....N.Ms       163.1.0        
                         4c 9e 4b 78  49 9e 47 74  46 9b 46 72  44 9d 43 72  L.KxI.GtF.FrD.Cr       163.1.16       
                         43 9b 42 74  43 9e 43 75  44 9d 44 72  43 9c 41 74  C.BtC.CuD.DrC.At       163.1.32       
                         41 9b 41 74  42 9c 41 75  41 9d 42 75  42 9d 41 73  A.AtB.AuA.BuB.As       163.1.48       
                         40 9c 3f 76  3f 9c 3f 73  3f 9b 3e                  @.?v?.?s?.>            163.1.64       
  26.3     79948  ISOC   0c 8d af 3c  bb be 31 66  bd be 39 03  7c 7e 7a 87  ...<..1f..9...z.       164.1.0        
                         7a 7d 7b 85  7b 7d 7b 84  7a 7e 7a 85  7a 7e 7b 87  z.......z.z.z...       164.1.16       
                         79 7d 78 84  76 7c 75 81  74 7c 74 81  73 7d 72 81  y.x.v.u.t.t.s.r.       164.1.32       
                         70 7b 70 80  71 7d 89 83  55 7d 00 82  1c 7e 1b 82  p.p.q...U.......       164.1.48       
                         19 7d 19 82  18 7d 17 82  18 7c 19                  ...........            164.1.64       
  26.3     72082  ISOC   0c 8d af 3c  bb be a6 95  ca be b9 03  12 7f 11 81  ...<............       165.1.0        
                         0d 7d 0d 80  0c 7e 0f 80  15 7c 1a 81  24 7e 2e 7f  ............$...       165.1.16       
                         37 83 3f 80  49 83 4f 81  5d 87 61 7f  64 85 5a 7e  7.?.I.O.].a.d.Z.       165.1.32       
                         53 81 47 84  40 7e 35 83  2c 7d 2b 82  28 78 27 84  S.G.@.5.,.+.(x'.       165.1.48       
                         28 79 35 82  47 7f 50 82  5f 86 6d                  (y5.G.P._.m            165.1.64       
  26.3     79876  ISOC   0c 8c bb 53  d6 be 2f c5  d7 be 39 04  6b 86 6a 7b  ...S../...9.k.j.       166.1.0        
                         6a 83 6a 79  6b 81 6b 7b  6c 82 6b 7d  69 82 69 7c  j.jyk.k.l.k.i.i.       166.1.16       
                         69 82 6a 7c  6a 82 6a 7c  6b 81 6b 7b  6a 82 6a 7a  i.j.j.j.k.k.j.jz       166.1.32       
                         6b 82 6a 7a  6a 81 6a 7e  6a 85 6a 7c  6b 84 6b 7d  k.jzj.j.j.j.k.k.       166.1.48       
                         6c 82 6a 7b  6b 85 6b 7a  6b 81 6c                  l.j.k.kzk.l            166.1.64       
  26.3     75516  ISOC   0c 8c bb 53  d6 be 49 f4  e4 be b9 04  12 81 13 7f  ...S..I.........       167.1.0        
                         14 81 0f 7d  19 80 4c 7d  33 87 38 77  44 9c 4c 72  ......L.3.8wD.Lr       167.1.16       
                         4f 9e 54 6c  58 9e 5b 6f  5c 9d 5c 6a  5e 9d 5f 6c  O.TlX.[o\.\j^._l       167.1.32       
                         60 a0 60 6b  5f 9d 5d 6d  5c 9e 51 76  4d 9e 43 73  `.`k_.]m\.QvM.Cs       167.1.48       
                         22 9a 5f 7b  8a 8b 7f 7d  88 91 91                  "._........            167.1.64       
  26.3     76444  ISOC   0c 8d ae 85  f1 be a4 21  f2 be 39 05  95 74 96 8b  .......!..9..t..       168.1.0        
                         a2 72 88 89  1d 75 02 7c  18 7e 23 7d  5c 85 95 8a  .r...u....#.\...       168.1.16       
                         bd 80 aa 66  34 7f 44 7b  5b 86 57 76  56 83 56 79  ...f4.D.[.WvV.Vy       168.1.32       
                         57 86 57 7b  56 85 56 7c  57 83 58 7a  58 82 56 7b  W.W.V.V.W.XzX.V.       168.1.48       
                         57 81 57 76  57 82 58 7a  58 86 58                  W.WvW.XzX.X            168.1.64       
  26.3     79940  ISOC   0c 8d ae 85  f1 be fc 52  ff be b9 05  46 9d 46 71  .......R....F.Fq       169.1.0        
                         46 9c 45 6e  45 9a 46 72  45 9c 45 74  46 9e 43 76  F.EnE.FrE.EtF.Cv       169.1.16       
                         43 9c 43 71  43 9b 44 74  44 9c 44 71  43 98 42 72  C.CqC.DtD.DqC.Br       169.1.32       
                         43 9b 43 74  43 9b 43 73  42 9a 41 70  41 9a 41 6d  C.CtC.CsB.ApA.Am       169.1.48       
                         41 9a 41 73  41 9b 41 79  41 9a 41                  A.AsA.AyA.A            169.1.64       
  26.3     72224  ISOC   0c 8f ae 85  f1 be 4e 82  0c bf 39 06  dd 7a b7 85  ......N...9..z..       170.1.0        
                         95 7a b2 80  c4 77 cb 81  cf 79 d1 86  cb 7c c2 85  .z...w...y......       170.1.16       
                         b0 79 94 85  75 7e 58 81  32 7e 37 7d  3c 7c 3b 87  .y..u.X.2.7.<.;.       170.1.32       
                         97 80 b5 85  9d 7b 92 85  84 7d 80 85  79 7c 6e 88  ............y.n.       170.1.48       
                         53 7b 39 82  2b 7c 14 7f  11 7f 19                  S.9.+......            170.1.64       
  26.3     79742  ISOC   0c 8c b0 9c  0c bf f9 b1  19 bf b9 06  4f 9e 4d 72  ............O.Mr       171.1.0        
                         4c 9e 4a 6f  4a 9e 49 72  47 9f 46 73  48 9d 48 72  L.JoJ.IrG.FsH.Hr       171.1.16       
                         47 9a 45 73  47 9b 46 72  44 9c 46 74  45 9c 45 71  G.EsG.FrD.FtE.Eq       171.1.32       
                         45 99 45 73  44 99 44 75  45 9d 45 71  44 9b 44 75  E.EsD.DuE.EqD.Du       171.1.48       
                         43 9e 44 74  44 9d 44 74  43 9c 44                  C.DtD.DtC.D            171.1.64       
  26.3     72450  ISOC   0c 8c b0 9c  0c bf 13 e1  26 bf 39 07  10 7c 28 80  ........&.9...(.       172.1.0        
                         3e 7b 48 85  3c 78 1b 80  88 7e f1 82  ed 80 eb 80  >.H.<x..........       172.1.16       
                         ea 7f fa 81  b6 7f 24 81  4e 7e 6c 7e  69 7f 68 7d  ......$.N.l.i.h.       172.1.32       
                         62 7f 31 7e  b8 7d b3 81  a8 7e a5 82  a6 7e a5 85  b.1.............       172.1.48       
                         ab 7f a3 82  a5 7f a1 81  94 7e 6f                  ..........o            172.1.64       
  26.3     79616  ISOC   0c 8d ae ce  27 bf b3 10  34 bf b9 07  4d 9f 4b 73  ....'...4...M.Ks       173.1.0        
                         4b 9e 4c 75  4a 9e 47 73  45 9d 47 70  47 9c 46 72  K.LuJ.GsE.GpG.Fr       173.1.16       
                         47 9e 47 75  47 a2 48 74  47 9d 46 73  47 9b 47 6e  G.GuG.HtG.FsG.Gn       173.1.32       
                         48 9b 47 6f  47 9c 45 75  44 9e 44 78  44 9e 44 75  H.GoG.EuD.DxD.Du       173.1.48       
                         44 9c 44 71  44 9a 43 74  44 9c 44                  D.DqD.CtD.D            173.1.64       
  26.3     72576  ISOC   0c 8d ae ce  27 bf e1 3f  41 bf 39 00  1f 80 1d 7f  ....'..?A.9.....       174.1.0        
                         1d 81 1c 7f  1c 81 1c 7e  1c 80 1a 7e  18 7f 15 7a  ...............z       174.1.16       
                         10 7f 14 7b  24 80 33 7b  3f 80 4c 78  53 7c 69 7c  ....$.3.?.LxS.i.       174.1.32       
                         78 7b 7f 82  57 7c 75 7d  d1 7d f8 80  f9 7e dd 7d  x...W.u.........       174.1.48       
                         aa 79 64 7a  24 78 47 7d  5b 72 63                  .ydz$xG.[rc            174.1.64       
  26.3     79616  ISOC   0c 8c a1 e5  42 bf 70 6f  4e bf b9 00  4d 9e 4c 75  ....B.poN...M.Lu       175.1.0        
                         49 9e 48 6f  47 99 47 71  48 9b 48 72  46 9d 46 71  I.HoG.GqH.HrF.Fq       175.1.16       
                         47 9d 48 6f  47 9b 48 70  47 9e 48 70  47 9e 45 71  G.HoG.HpG.HpG.Eq       175.1.32       
                         45 9b 45 72  46 9d 45 72  44 99 45 72  45 9d 46 73  E.ErF.ErD.ErE.Fs       175.1.48       
                         47 9c 45 74  45 9b 43 72  44 9a 45                  G.EtE.CrD.E            175.1.64       
  26.3     72576  ISOC   0c 8c a1 e5  42 bf cc 9e  5b bf 39 01  72 82 6f 7d  ....B...[.9.r.o.       176.1.0        
                         69 82 6e 7e  72 83 73 78  76 83 74 79  73 81 73 7b  i.n.r.sxv.tys.s.       176.1.16       
                         75 82 7d 80  7e 7e 55 78  66 7d b2 81  f6 7d f8 7f  u.....Uxf.......       176.1.32       
                         c5 7d 6f 7b  26 81 06 80  18 7f 16 79  12 81 14 7a  ..o.&......y...z       176.1.48       
                         1a 80 1c 7d  1e 7f 25 7e  2b 7f 18                  ......%.+..            176.1.64       
  26.3     79616  ISOC   0c 8d aa 17  5e bf 25 ce  68 bf b9 01  4e 9d 4e 72  ....^.%.h...N.Nr       177.1.0        
                         4b 9d 4b 72  4a 9d 48 70  48 9b 47 6e  48 9b 49 6f  K.KrJ.HpH.GnH.Io       177.1.16       
                         49 9d 48 71  47 9c 48 71  48 9e 48 73  48 9c 48 73  I.HqG.HqH.HsH.Hs       177.1.32       
                         48 9d 48 70  47 9c 47 71  48 9c 47 72  46 9b 45 71  H.HpG.GqH.GrF.Eq       177.1.48       
                         45 99 45 73  47 99 48 70  47 9b 47                  E.EsG.HpG.G            177.1.64       
  26.3     72576  ISOC   0c 8d aa 17  5e bf 88 fd  75 bf 39 02  d6 81 d0 7f  ....^...u.9.....       178.1.0        
                         bd 7e 4b 7e  17 7b 6b 81  9f 7e d1 7f  ed 7e ef 80  ..K...k.........       178.1.16       
                         e9 7f d7 7f  c8 7c b6 7c  a9 7d 9e 7e  a2 81 a7 7e  ................       178.1.32       
                         af 82 d7 85  69 7f 00 7d  1a 80 26 7a  25 80 25 7a  ....i.....&z%.%z       178.1.48       
                         28 80 2a 7b  2d 81 30 7c  33 81 39                  (.*.-.0.3.9            178.1.64       
  26.3     79616  ISOC   0c 8c c5 2e  79 bf e0 2c  83 bf b9 02  4a 9e 4a 73  ....y..,....J.Js       179.1.0        
                         4a 9e 49 70  48 9e 49 71  49 9d 48 71  49 9e 48 70  J.IpH.IqI.HqI.Hp       179.1.16       
                         48 9e 49 6f  49 9d 48 71  49 9d 49 72  49 9c 48 73  H.IoI.HqI.IrI.Hs       179.1.32       
                         48 9a 48 73  48 9f 48 73  48 9c 48 73  47 9b 45 70  H.HsH.HsH.HsG.Ep       179.1.48       
                         44 99 45 71  46 9b 45 72  48 9c 48                  D.EqF.ErH.H            179.1.64       
  26.3     72352  ISOC   0c 8c c5 2e  79 bf 41 5c  90 bf 39 03  d1 7e ca 7e  ....y.A\..9.....       180.1.0        
                         bd 7d a7 7d  9d 7f 92 7b  96 7f 94 7d  93 7f 94 7e  ................       180.1.16       
                         99 81 a2 83  8b 81 58 80  22 80 0b 7c  13 80 17 7e  ......X.".......       180.1.32       
                         1a 7f 19 7e  15 80 12 7e  0e 7f 16 7c  1d 7e 20 7e  .............. .       180.1.48       
                         21 80 23 7c  21 80 21 7e  26 81 2d                  !.#.!.!.&.-            180.1.64       
  26.3     79840  ISOC   0c 8d a8 60  94 bf 47 8b  9d bf b9 03  f1 80 ee 7f  ...`..G.........       181.1.0        
                         eb 80 e7 7e  e4 80 e5 7e  f1 7f f4 80  f4 80 f4 80  ................       181.1.16       
                         f4 80 f4 80  f4 80 f4 80  f4 7f f1 82  c5 78 7d 89  .............x..       181.1.32       
                         8c 79 dc 87  f9 7a f4 7f  f4 80 f2 7f  f3 7e f4 80  .y...z..........       181.1.48       
                         f4 80 f4 80  f1 7f f1 7f  f2 7e f1                  ...........            181.1.64       
  26.3     72122  ISOC   0c 8d a8 60  94 bf fa ba  aa bf 39 04  9e 81 9d 80  ...`......9.....       182.1.0        
                         a0 7f a2 81  9b 7e 92 7f  82 82 74 78  6a 81 63 76  ..........txj.cv       182.1.16       
                         55 85 61 79  61 83 5f 7b  67 84 5a 7f  52 83 47 7c  U.aya._.g.Z.R.G.       182.1.32       
                         3d 82 34 7a  2c 82 27 7c  22 80 1d 7e  1c 81 1c 7d  =.4z,.'.".......       182.1.48       
                         1f 81 1e 7d  1d 81 25 7d  35 7f 3c                  ......%.5.<            182.1.64       
  26.3     79958  ISOC   0c 8c f7 77  af bf 06 ea  b7 bf b9 04  3f 72 3e 96  ...w........?r>.       183.1.0        
                         3f 72 3f 96  3f 75 3e 98  3d 75 3d 98  3d 75 3c 97  ?r?.?u>.=u=.=u<.       183.1.16       
                         3c 74 3b 97  3b 74 39 99  41 77 30 91  18 7c 17 80  <t;.;t9.Aw0.....       183.1.32       
                         16 7d 17 80  16 7e 16 81  16 7d 16 81  16 7f 16 81  ................       183.1.48       
                         16 7e 15 81  15 7e 16 81  17 7c 17                  ...........            183.1.64       
  26.3     72048  ISOC   0c 8c f7 77  af bf 97 19  c5 bf 39 05  4d 82 4b 7f  ...w......9.M.K.       184.1.0        
                         49 85 4c 82  4e 87 4e 7c  4c 86 1a 62  66 87 d6 67  I.L.N.N.L..bf..g       184.1.16       
                         25 83 33 7a  44 83 44 80  44 7e 47 80  48 7f 47 7f  %.3zD.D.D.G.H.G.       184.1.32       
                         45 7f 46 7e  4c 80 4b 87  41 80 36 80  30 7f 38 80  E.F.L.K.A.6.0.8.       184.1.48       
                         3a 81 3a 7d  3c 80 41 7e  42 81 44                  :.:.<.A.B.D            184.1.64       
  26.3     79900  ISOC   0c 8d 45 8f  ca bf c1 48  d2 bf b9 05  5b 7d 58 7d  ..E....H....[.X.       185.1.0        
                         57 7d 57 7e  58 7d 58 7e  58 7c 58 7e  58 7c 58 81  W.W.X.X.X.X.X.X.       185.1.16       
                         56 7f 57 7b  57 7c 57 7f  57 7c 58 7f  57 7d 57 80  V.W.W.W.W.X.W.W.       185.1.32       
                         57 7c 57 81  56 7d 56 80  56 7a 57 80  57 7a 56 80  W.W.V.V.VzW.WzV.       185.1.48       
                         56 79 55 7d  55 78 56 7d  56 7a 56                  VyU.UxV.VzV            185.1.64       
  26.3     72292  ISOC   0c 8d 45 8f  ca bf 18 78  df bf 39 06  62 7d 50 80  ..E....x..9.b.P.       186.1.0        
                         4f 7b 5b 86  54 7b 4c 82  4a 7d 47 82  3f 80 4b 81  O.[.T.L.J.G.?.K.       186.1.16       
                         50 7a 50 80  27 7d 55 7d  f0 7c 51 8b  a7 7c d0 87  PzP.'.U...Q.....       186.1.32       
                         bd 79 bd 82  bf 7a bf 82  bd 79 ba 83  ba 78 b4 7f  .y...z...y...x..       186.1.48       
                         b0 7b b1 80  ac 7b b9 82  a0 78 aa                  .........x.            186.1.64       
  26.3     79672  ISOC   0c 8c f7 c0  e5 bf be a7  ec bf b9 06  6f 7a 6d 81  ............ozm.       187.1.0        
                         6b 7c 6d 80  63 7b 61 7d  62 78 62 7d  5f 7d 5c 7f  k.m.c.a.bxb._.\.       187.1.16       
                         5b 7d 60 7f  61 78 5a 7c  58 78 5a 7b  5e 78 60 80  [.`.axZ.XxZ.^x`.       187.1.32       
                         60 7a 5a 81  5e 7d 5d 80  57 7c 59 7e  5c 7a 5e 81  `zZ.^.].W.Y.\z^.       187.1.48       
                         5d 79 5c 81  5e 7a 5d 7c  5c 79 5b                  ]y\.^z].\y[            187.1.64       
  26.3     72520  ISOC   0c 8c f7 c0  e5 bf d9 d6  f9 bf 39 07  25 8a 1a 7d  ..........9.%...       188.1.0        
                         19 7e 1a 7f  1b 81 32 78  3f 92 42 70  42 97 40 75  ......2x?.BpB.@u       188.1.16       
                         40 96 40 74  3f 97 41 74  43 97 42 72  3f 95 3f 71  @.@t?.AtC.Br?.?q       188.1.32       
                         40 97 40 72  3f 98 3f 72  3e 9a 3f 71  3f 97 3f 72  @.@r?.?r>.?q?.?r       188.1.48       
                         3f 96 3f 72  3e 94 40 72  3f 96 3f                  ?.?r>.@r?.?            188.1.64       
  26.3     79616  ISOC   0c 8d 71 d9  00 c0 79 06  07 c0 b9 07  38 87 2b 78  ..q...y.....8.+x       189.1.0        
                         1a 84 1b 7d  1f 86 24 7b  29 90 2c 77  2b 95 2a 76  ......$.).,w+.*v       189.1.16       
                         28 8e 24 7a  25 8d 28 7b  2f 93 4b 79  47 91 36 78  (.$z%.(./.KyG.6x       189.1.32       
                         2e 94 21 79  20 8e 23 78  24 8e 2d 74  2f 8e 2f 75  ..!y .#x$.-t/./u       189.1.48       
                         2f 8d 30 77  34 90 3a 77  5f 8c 57                  /.0w4.:w_.W            189.1.64       
  26.3     72576  ISOC   0c 8d 71 d9  00 c0 d3 35  14 c0 39 00  51 9e 4f 71  ..q....5..9.Q.Oq       190.1.0        
                         4d 9e 4c 73  4b 9e 4a 71  49 9d 48 71  45 9b 45 74  M.LsK.JqI.HqE.Et       190.1.16       
                         44 9d 44 72  42 9d 40 71  41 9b 44 72  43 9b 42 71  D.DrB.@qA.DrC.Bq       190.1.32       
                         43 99 43 76  42 9a 42 73  43 97 43 73  43 9b 42 73  C.CvB.BsC.CsC.Bs       190.1.48       
                         42 9c 40 74  3f 99 3a 72  28 8e 1a                  B.@t?.:r(..            190.1.64       
  26.3     79616  ISOC   0c 8c f3 09  1c c0 34 65  21 c0 b9 00  27 7d 27 7f  ......4e!...'.'.       191.1.0        
                         27 7d 26 7f  25 81 22 7a  3f 8b 49 76  4c 8d 4b 78  '.&.%."z?.IvL.Kx       191.1.16       
                         4b 87 4d 78  4b 85 4c 77  4c 85 4e 78  4d 82 4e 7a  K.MxK.LwL.NxM.Nz       191.1.32       
                         4f 80 51 7d  50 81 51 7a  51 84 52 7b  52 85 52 7a  O.Q.P.QzQ.R.R.Rz       191.1.48       
                         51 84 51 7a  51 82 51 7b  51 82 51                  Q.QzQ.Q.Q.Q            191.1.64       
  26.3     72576  ISOC   0c 8c f3 09  1c c0 90 94  2e c0 39 01  52 9f 50 6f  ..........9.R.Po       192.1.0        
                         4f 9e 4e 72  4d 9e 4d 75  4b 9d 49 71  47 9d 45 74  O.NrM.MuK.IqG.Et       192.1.16       
                         44 9e 43 73  43 9e 41 71  42 9d 43 70  43 9a 43 73  D.CsC.AqB.CpC.Cs       192.1.32       
                         42 9b 42 73  43 9c 43 75  42 9b 41 73  41 9b 40 71  B.BsC.CuB.AsA.@q       192.1.48       
                         3f 99 3f 70  3f 9b 40 70  40 98 3f                  ?.?p?.@p@.?            192.1.64       
  26.3     79616  ISOC   0c 8d f5 20  37 c0 ea c3  3b c0 b9 01  2c 7c 29 84  ... 7...;...,.).       193.1.0        
                         2d 7e 35 85  39 7e 4a 86  48 7c 48 83  48 82 47 7b  -.5.9.J.H.H.H.G.       193.1.16       
                         46 83 47 76  47 83 47 7b  47 83 47 7a  48 83 48 75  F.GvG.G.G.GzH.Hu       193.1.32       
                         49 83 49 7b  49 81 4b 79  4a 81 49 77  49 7f 4b 7d  I.I.I.KyJ.IwI.K.       193.1.48       
                         4b 81 4b 7e  4a 81 4a 7c  4b 82 4b                  K.K.J.J.K.K            193.1.64       
  26.3     72530  ISOC   0c 8d f5 20  37 c0 43 f3  48 c0 39 02  51 9e 50 72  ... 7.C.H.9.Q.Pr       194.1.0        
                         4f 9e 4d 6f  4b 9e 4b 71  4b 9e 49 71  47 9c 46 6f  O.MoK.KqK.IqG.Fo       194.1.16       
                         46 9b 44 73  43 9c 44 73  44 9b 43 75  45 9e 45 77  F.DsC.DsD.CuE.Ew       194.1.32       
                         44 9d 44 74  43 9a 44 74  43 9b 42 70  43 9a 42 70  D.DtC.DtC.BpC.Bp       194.1.48       
                         42 9a 43 73  43 98 41 73  41 98 41                  B.CsC.AsA.A            194.1.64       
  26.3     79662  ISOC   0c 8c ed 52  52 c0 a1 22  56 c0 b9 02  f2 7f f2 7d  ...RR.."V.......       195.1.0        
                         f2 7f f2 7d  f2 7f f2 7d  f2 7f f1 7c  f1 80 f1 7b  ................       195.1.16       
                         f1 7f f1 79  f1 7f f1 7a  f1 7f f1 78  f1 80 f1 78  ...y...z...x...x       195.1.32       
                         f1 80 f1 79  f0 80 f0 77  f0 81 7f 79  81 87 84 72  ...y...w...y...r       195.1.48       
                         9b 90 83 6f  1b 80 04 7c  3f 79 58                  ...o....?yX            195.1.64       
  26.3     72278  ISOC   0c 8c ed 52  52 c0 fd 51  63 c0 39 03  52 9e 51 74  ...RR..Qc.9.R.Qt       196.1.0        
                         4f 9f 4e 72  4c 9e 4c 71  4b 9b 4a 6f  49 99 48 6e  O.NrL.LqK.JoI.Hn       196.1.16       
                         45 9a 45 74  47 99 47 70  47 9b 47 72  46 99 47 72  E.EtG.GpG.GrF.Gr       196.1.32       
                         45 98 46 74  46 9a 45 77  45 99 47 71  45 97 44 6c  E.FtF.EwE.GqE.Dl       196.1.48       
                         44 99 44 73  44 99 44 74  43 97 42                  D.DsD.DtC.B            196.1.64       
  26.3     79914  ISOC   0c 8d f2 69  6d c0 06 81  70 c0 b9 03  e8 7b be 80  ...im...p.......       197.1.0        
                         bb 78 eb 83  50 6d 3a 85  c6 76 d5 7a  7a 73 d7 7c  .x..Pm:..v.zzs..       197.1.16       
                         99 68 6a 84  67 5d 9c 81  ae 74 e9 7f  ef 75 72 81  .hj.g]...t...ur.       197.1.32       
                         75 67 88 8b  6c 67 91 82  d9 76 c4 80  e7 7d b9 80  ug..lg...v......       197.1.48       
                         5c 64 69 84  a9 69 9a 7f  b8 71 e6                  \di..i...q.            197.1.64       
  26.3     72052  ISOC   0c 8d f2 69  6d c0 b8 b0  7d c0 39 04  51 9e 50 72  ...im.....9.Q.Pr       198.1.0        
                         4f 9e 4d 71  4d 9d 4d 73  4c 9e 4b 70  4a 9d 4a 73  O.MqM.MsL.KpJ.Js       198.1.16       
                         49 9e 49 73  48 9c 46 73  47 98 47 6f  46 97 46 74  I.IsH.FsG.GoF.Ft       198.1.32       
                         46 9d 47 75  47 9e 48 77  47 9e 45 77  47 9e 46 74  F.GuG.HwG.EwG.Ft       198.1.48       
                         46 9c 45 74  44 97 44 73  44 96 44                  F.EtD.DsD.D            198.1.64       
  26.3     79942  ISOC   0c 8c e9 9b  88 c0 c8 df  8a c0 b9 04  6f 82 6f 7e  ............o.o.       199.1.0        
                         70 83 71 7e  72 82 72 79  71 81 71 7c  72 83 73 7e  p.q.r.ryq.q.r.s.       199.1.16       
                         73 84 73 7e  74 84 74 7c  75 83 76 7b  77 82 77 7c  s.s.t.t.u.v.w.w.       199.1.32       
                         79 83 7a 7e  7b 86 78 79  7b 84 7c 77  7e 85 7f 7b  y.z...xy...w....       199.1.48       
                         7e 86 7c 7c  7d 83 7d 7a  7e 82 7e                  .......z...            199.1.64       
  26.3     72134  ISOC   0c 8c e9 9b  88 c0 20 0f  98 c0 39 05  19 7f 19 81  ...... ...9.....       200.1.0        
                         19 7f 19 81  18 7f 19 81  1a 7f 1a 81  1b 7f 1c 80  ................       200.1.16       
                         1c 7f 17 81  16 7f 17 81  17 7e 16 80  16 7f 12 80  ................       200.1.32       
                         11 7f 11 80  12 7d 15 80  1d 7b 23 7f  2f 7f 3a 7e  ..........#./.:.       200.1.48       
                         43 80 4b 80  52 87 57 81  61 8a 67                  C.K.R.W.a.g            200.1.64       
  26.3     79830  ISOC   0c 8d f4 b2  a3 c0 c9 3e  a5 c0 b9 05  6b 82 6a 7d  .......>....k.j.       201.1.0        
                         6b 82 6c 7b  6b 82 6b 7c  6c 84 6d 7b  6b 83 6b 7a  k.l.k.k.l.m.k.kz       201.1.16       
                         6b 84 6c 7b  6c 81 6c 7b  6c 81 6d 7c  6d 84 6b 7a  k.l.l.l.l.m.m.kz       201.1.32       
                         6d 82 6e 7f  6c 86 6c 7e  6f 82 6d 7c  6b 81 6b 7e  m.n.l.l.o.m.k.k.       201.1.48       
                         6d 81 6e 7d  6d 84 6b 7a  6c 81 6b                  m.n.m.kzl.k            201.1.64       
  26.3     74922  ISOC   0c 8d f4 b2  a3 c0 e2 6d  b2 c0 39 06  37 73 37 95  .......m..9.7s7.       202.1.0        
                         37 74 36 95  35 71 35 94  34 7a 1d 88  1a 7f 19 81  7t6.5q5.4z......       202.1.16       
                         18 7f 19 82  1a 7e 19 81  19 7e 19 81  18 7f 17 81  ................       202.1.32       
                         16 7f 17 81  17 7f 17 81  17 7e 17 81  17 7f 18 81  ................       202.1.48       
                         18 7f 18 80  4f 7f 40 82  41 7b 4c                  ....O.@.A.L            202.1.64       
  26.3     77056  ISOC   0c 8c e8 e4  be c0 3e 9b  bf c0 b9 06  f2 7f f2 7d  ......>.........       203.1.0        
                         f2 7f f2 7d  f2 7f f2 7d  f2 7f f1 7c  f1 80 f1 7b  ................       203.1.16       
                         f1 7f f1 79  f1 7f f1 7a  f1 7f f1 78  f1 80 f1 78  ...y...z...x...x       203.1.32       
                         f1 80 f1 79  f0 80 f0 77  f0 81 7f 79  81 87 84 72  ...y...w...y...r       203.1.48       
                         9b 90 83 6f  1b 80 04 7c  3f 79 58                  ...o....?yX            203.1.64       
  26.3     79616  ISOC   0c 8c e8 e4  be c0 93 cc  cc c0 39 07  51 a0 50 71  ..........9.Q.Pq       204.1.0        
                         4f 9f 4e 70  4c a0 4c 71  4b 9c 4b 72  4a 9e 4a 72  O.NpL.LqK.KrJ.Jr       204.1.16       
                         49 9c 4a 75  4a 9d 4a 73  4a 9e 49 71  49 9b 48 6d  I.JuJ.JsJ.IqI.Hm       204.1.32       
                         49 98 49 72  49 9d 49 70  49 9c 48 6f  46 9d 47 6d  I.IrI.IpI.HoF.Gm       204.1.48       
                         46 97 46 70  48 9b 47 75  46 9d 46                  F.FpH.GuF.F            204.1.64       
  26.3     72576  ISOC   0c 8d ec fb  d9 c0 09 fc  d9 c0 b9 07  e8 7b be 80  ................       205.1.0        
                         bb 78 eb 83  50 6d 3a 85  c6 76 d5 7a  7a 73 d7 7c  .x..Pm:..v.zzs..       205.1.16       
                         99 68 6a 84  67 5d 9c 81  ae 74 e9 7f  ef 75 72 81  .hj.g]...t...ur.       205.1.32       
                         75 67 88 8b  6c 67 91 82  d9 76 c4 80  e7 7d b9 80  ug..lg...v......       205.1.48       
                         5c 64 69 84  a9 69 9a 7f  b8 71 e6                  \di..i...q.            205.1.64       
  26.3     79696  ISOC   0c 8d ec fb  d9 c0 94 2b  e7 c0 39 00  50 9d 50 6f  .......+..9.P.Po       206.1.0        
                         50 9d 4e 70  4e 9c 4c 73  4a 9a 4a 6e  4a 9b 4a 70  P.NpN.LsJ.JnJ.Jp       206.1.16       
                         4a 9e 49 6f  48 9a 47 71  49 99 49 73  49 9c 49 72  J.IoH.GqI.IsI.Ir       206.1.32       
                         49 9c 49 72  49 99 4a 74  4b 9a 4a 74  49 9b 48 71  I.IrI.JtK.JtI.Hq       206.1.48       
                         47 99 47 73  47 9a 46 72  46 9d 46                  G.GsG.FrF.F            206.1.64       
  26.3     72496  ISOC   0c 8d ec fb  d9 c0 a9 5a  f4 c0 b9 00  84 85 85 79  .......Z.......y       207.1.0        
                         84 84 84 7c  87 87 88 77  89 85 89 79  88 86 87 7c  .......w...y....       207.1.16       
                         86 86 85 7e  84 86 81 7f  80 88 80 7a  81 88 82 76  ...........z...v       207.1.32       
                         6a 83 43 78  7f 7e 9c 78  53 79 0d 7c  0d 7d 25 7b  j.Cx...xSy....%.       207.1.48       
                         40 82 4d 7f  48 84 20 79  7f 80 e9                  @.M.H. y...            207.1.64       
  26.3     79616  ISOC   0c 8c e7 2d  f5 c0 4b 8a  01 c1 39 01  51 9e 50 72  ...-..K...9.Q.Pr       208.1.0        
                         4e 9e 4d 72  4d 9d 4b 72  49 9a 48 6f  4a 9d 4a 6d  N.MrM.KrI.HoJ.Jm       208.1.16       
                         4b 9b 49 70  49 9a 4a 70  49 99 49 71  4a 9e 4a 74  K.IpI.JpI.IqJ.Jt       208.1.32       
                         49 9d 49 72  48 99 48 6c  49 97 49 6e  48 97 48 70  I.IrH.HlI.InH.Hp       208.1.48       
                         49 9a 48 72  47 9b 46 77  47 9b 49                  I.HrG.FwG.I            208.1.64       
  26.3     72576  ISOC   0c 8c e7 2d  f5 c0 a3 b9  0e c1 b9 01  22 82 22 7e  ...-........".".       209.1.0        
                         21 82 21 7f  20 81 1b 7e  16 7f 17 7a  1c 80 2e 78  !.!. ......z...x       209.1.16       
                         4f 81 6a 7b  79 82 7b 7d  7c 82 7a 7e  77 7f 76 7f  O.j.y.....z.w.v.       209.1.32       
                         79 7e 7c 7d  74 7c 5c 7c  84 7e dd 7f  fc 7f f5 7f  y...t.\.........       209.1.48       
                         cf 7d a6 7d  55 78 45 7b  72 78 8e                  ....UxE.rx.            209.1.64       
  26.3     79616  ISOC   0c 8d e2 44  10 c1 01 e9  1b c1 39 02  4f 9f 4e 6f  ...D......9.O.No       210.1.0        
                         4d 9e 4c 72  4b 9e 4a 70  49 9b 49 72  4a 9e 4a 72  M.LrK.JpI.IrJ.Jr       210.1.16       
                         49 9d 4a 75  4a 9e 4a 78  49 9e 49 71  49 9b 49 74  I.JuJ.JxI.IqI.It       210.1.32       
                         49 9e 49 74  49 9b 49 70  49 9a 49 72  4a 9d 4b 75  I.ItI.IpI.IrJ.Ku       210.1.48       
                         4a 9d 49 73  46 9c 46 71  47 9d 49                  J.IsF.FqG.I            210.1.64       
  26.3     72576  ISOC   0c 8d e2 44  10 c1 67 18  29 c1 b9 02  73 83 72 7d  ...D..g.)...s.r.       211.1.0        
                         72 83 73 7c  72 82 73 7f  72 83 70 7e  74 84 7b 7e  r.s.r.s.r.p.t...       211.1.16       
                         7b 81 78 7e  6a 83 51 7f  2a 82 39 7c  3a 7e 2b 81  ..x.j.Q.*.9.:.+.       211.1.32       
                         1c 7e 14 7e  1a 7f 23 7a  25 81 26 7b  25 81 25 7d  ......#z%.&.%.%.       211.1.48       
                         24 81 25 7d  26 83 27 7e  28 81 27                  $.%.&.'.(.'            211.1.64       
  26.3     79616  ISOC   0c 8c e2 76  2b c1 bd 47  36 c1 39 03  4f 9e 4e 70  ...v+..G6.9.O.Np       212.1.0        
                         4d 9d 4b 72  4b 9d 4a 71  4a 9c 49 71  4a 9b 4a 70  M.KrK.JqJ.IqJ.Jp       212.1.16       
                         4b 9c 4b 6f  4b 9c 4c 71  4b a0 4a 70  4b 9d 4b 72  K.KoK.LqK.JpK.Kr       212.1.32       
                         4a 9b 4a 6e  4b 9a 4a 6e  49 9a 49 74  49 9d 49 72  J.JnK.JnI.ItI.Ir       212.1.48       
                         48 9c 49 75  49 9f 49 72  49 9a 48                  H.IuI.IrI.H            212.1.64       
  26.3     72554  ISOC   0c 8c e2 76  2b c1 1d 77  43 c1 b9 03  d3 81 bf 7d  ...v+..wC.......       213.1.0        
                         48 7f 0e 7b  50 7e 8e 7f  79 7e 8d 7d  c2 7c e3 81  H...P...y.......       213.1.16       
                         ef 7f ee 80  e1 7e cf 7c  c0 7d b1 7e  ab 7f ae 80  ................       213.1.32       
                         d9 7f 7d 80  00 7e 1d 7e  29 81 26 7b  27 81 29 7f  ........).&.'.).       213.1.48       
                         2a 82 2d 7e  2f 82 32 7e  34 82 34                  *.-./.2.4.4            213.1.64       
  26.3     79638  ISOC   0c 8d 1e 8e  46 c1 76 a6  50 c1 39 04  e7 6c bb 8d  ....F.v.P.9..l..       214.1.0        
                         9c 60 83 90  8a 6f 8b 8e  65 6a 7b 8a  76 56 aa 7c  .`...o..ej..vV..       214.1.16       
                         c1 63 4f 9e  4e 74 4d 9e  4b 73 4a 9a  4b 72 4b 9e  .cO.NtM.KsJ.KrK.       214.1.32       
                         4b 74 4b 9f  4b 71 4b 9e  4b 71 4b 9d  4b 72 4b 9e  KtK.KqK.KqK.KrK.       214.1.48       
                         4b 73 4c 9c  4b 72 4a 9b  4a 72 4a                  KsL.KrJ.JrJ            214.1.64       
  26.3     72304  ISOC   0c 8d 1e 8e  46 c1 d9 d5  5d c1 b9 04  ee 80 e9 7e  ....F...].......       215.1.0        
                         d5 7d c5 79  b4 7d a0 7d  94 80 90 7f  a5 80 9f 88  ...y............       215.1.16       
                         8c 7e 43 7c  1a 7f 12 7c  1a 80 1c 7d  1d 80 1c 7d  ..C.............       215.1.32       
                         19 80 13 7f  0d 7e 31 7c  71 7e 6c 79  1d 7c 1d 7d  ......1.q.ly....       215.1.48       
                         23 80 24 7e  26 81 26 7a  2d 80 34                  #.$.&.&z-.4            215.1.64       
  26.3     79888  ISOC   0c 8c e1 bf  61 c1 d8 04  6b c1 39 05  f4 80 f4 80  ....a...k.9.....       216.1.0        
                         f4 80 f4 80  f4 80 f4 80  f4 80 f4 80  f4 80 f4 80  ................       216.1.16       
                         f4 7f f3 7f  f2 7f f0 7e  ec 80 e9 7e  e5 80 e2 7c  ................       216.1.32       
                         df 80 dc 7d  db 80 d9 7e  d8 81 d5 7c  d2 81 d1 7b  ................       216.1.48       
                         cf 81 d0 76  d2 88 d1 71  d3 8c d4                  ...v...q...            216.1.64       
  26.3     72076  ISOC   0c 8c e1 bf  61 c1 8e 34  78 c1 b9 05  9c 82 96 81  ....a..4x.......       217.1.0        
                         82 84 6f 7c  68 85 5f 79  6e 83 6f 7e  73 86 73 7d  ..o.h._yn.o.s.s.       217.1.16       
                         72 84 70 7b  73 84 73 7a  6c 83 61 7e  54 87 45 79  r.p.s.szl.a.T.Ey       217.1.32       
                         3b 83 2b 80  28 80 20 7f  23 80 23 7f  22 80 20 7e  ;.+.(. .#.#.". .       217.1.48       
                         21 81 23 7b  27 7f 3e 7a  3b 80 3e                  !.#.'.>z;.>            217.1.64       
  26.3     79946  ISOC   0c 8d 31 d7  7c c1 9a 63  85 c1 39 06  49 97 49 75  ..1....c..9.I.Iu       218.1.0        
                         48 9a 48 76  48 99 48 73  48 99 47 73  47 9a 47 76  H.HvH.HsH.GsG.Gv       218.1.16       
                         46 9a 47 77  47 9a 45 77  44 98 44 78  44 98 44 76  F.GwG.EwD.DxD.Dv       218.1.32       
                         44 96 43 71  42 99 43 73  43 98 42 73  43 97 43 70  D.CqB.CsC.BsC.Cp       218.1.48       
                         43 96 42 73  41 96 40 74  40 97 3f                  C.BsA.@t@.?            218.1.64       
  26.3     72106  ISOC   0c 8d 31 d7  7c c1 06 93  92 c1 b9 06  56 7f 55 83  ..1.........V.U.       219.1.0        
                         55 7f 56 83  58 7f 57 83  58 80 5e 86  5c 80 5c 82  U.V.X.W.X.^.\.\.       219.1.16       
                         59 7f 57 83  55 7f 55 84  53 7c 51 82  54 7d 59 83  Y.W.U.U.S.Q.T.Y.       219.1.32       
                         54 82 51 82  52 80 54 82  55 7f 55 82  55 81 51 82  T.Q.R.T.U.U.U.Q.       219.1.48       
                         4e 7e 4d 82  4e 7e 4d 82  4b 7d 4a                  N.M.N.M.K.J            219.1.64       
  26.3     79854  ISOC   0c 8c 81 ee  97 c1 5d c2  9f c1 39 07  5b 7a 5a 7b  ......]...9.[zZ.       220.1.0        
                         59 7d 59 7f  59 7b 59 7f  5a 7b 59 80  57 7d 58 7e  Y.Y.Y.Y.Z.Y.W.X.       220.1.16       
                         59 79 59 7e  5a 7d 5a 7c  59 7d 57 7b  57 7c 58 7d  YyY.Z.Z.Y.W.W.X.       220.1.32       
                         59 7d 59 7f  5b 7b 59 84  58 7b 58 80  58 7c 59 7e  Y.Y.[.Y.X.X.X.Y.       220.1.48       
                         5a 7b 5a 80  5a 7b 59 7d  58 7c 56                  Z.Z.Z.Y.X.V            220.1.64       
  26.3     72338  ISOC   0c 8c 81 ee  97 c1 b6 f1  ac c1 b9 07  29 7b 2b 80  ............).+.       221.1.0        
                         2c 7d 2b 81  2a 7f 28 81  28 7f 27 81  28 7f 28 80  ,.+.*.(.(.'.(.(.       221.1.16       
                         28 7d 29 81  24 7e 22 81  22 7d 25 7f  26 7e 2a 7f  (.).$.".".%.&.*.       221.1.32       
                         28 7f 26 81  1c 7d 33 7f  6e 82 5a 7d  4b 82 38 7f  (.&...3.n.Z.K.8.       221.1.48       
                         36 7d 4a 81  4a 7f 52 7e  4c 84 4a                  6.J.J.R.L.J            221.1.64       
  26.3     79624  ISOC   0c 8d 2d 20  b3 c1 58 21  ba c1 39 00  63 7a 61 7a  ..- ..X!..9.czaz       222.1.0        
                         60 7a 62 7e  64 7c 5f 7d  60 7c 63 7e  61 7c 60 83  `zb.d._.`.c.a.`.       222.1.16       
                         60 7c 5f 7e  5f 7a 5f 7f  5e 7d 60 7f  60 7b 5f 81  `._._z_.^.`.`._.       222.1.32       
                         60 7c 60 81  5e 79 5d 7e  5e 7b 5f 7d  5f 79 60 81  `.`.^y].^._._y`.       222.1.48       
                         5d 7b 64 7d  62 7b 5d 80  63 7a 5e                  ].d.b.].cz^            222.1.64       
  26.3     72568  ISOC   0c 8d 2d 20  b3 c1 68 50  c7 c1 b9 00  4e 9e 4e 6e  ..- ..hP....N.Nn       223.1.0        
                         4c 9d 4c 6e  4b 9d 4a 68  4a 9b 4a 70  48 99 47 76  L.LnK.JhJ.JpH.Gv       223.1.16       
                         48 9a 49 73  48 99 47 71  48 98 47 74  47 9b 49 74  H.IsH.GqH.GtG.It       223.1.32       
                         49 9b 48 75  45 9b 45 72  46 96 36 75  25 86 1e 7d  I.HuE.ErF.6u%...       223.1.48       
                         1c 81 1d 7d  1e 81 3e 76  46 96 43                  ......>vF.C            223.1.64       
  26.3     79616  ISOC   0c 8c 4e 37  ce c1 0f 80  d4 c1 39 01  2c 87 29 7c  ..N7......9.,.).       224.1.0        
                         23 83 22 7e  23 86 27 7c  2a 8d 2a 7a  27 8f 28 7a  #.".#.'.*.*z'.(z       224.1.16       
                         2f 90 31 78  32 91 2f 77  2c 8f 2f 76  37 90 38 77  /.1x2./w,./v7.8w       224.1.32       
                         2e 8d 2c 76  27 88 25 7d  22 82 21 7c  20 80 20 7b  ..,v'.%.".!. . .       224.1.48       
                         22 82 26 7c  27 85 23 7a  4d 87 5e                  ".&.'.#zM.^            224.1.64       
  26.3     72576  ISOC   0c 8c 4e 37  ce c1 6f af  e1 c1 b9 01  53 9f 51 74  ..N7..o.....S.Qt       225.1.0        
                         50 a0 4f 72  4d 9f 4c 77  4b 9d 4a 74  4a 9d 4a 73  P.OrM.LwK.JtJ.Js       225.1.16       
                         49 9c 47 76  47 9a 45 73  46 9b 47 75  48 99 47 79  I.GvG.EsF.GuH.Gy       225.1.32       
                         45 9b 45 75  47 9a 47 76  45 9c 44 74  44 9c 44 73  E.EuG.GvE.DtD.Ds       225.1.48       
                         44 99 43 71  40 94 36 72  24 89 1f                  D.Cq@.6r$..            225.1.64       
  26.3     79616  ISOC   0c 8d 29 69  e9 c1 c5 de  ee c1 39 02  2b 7d 29 80  ..)i......9.+.).       226.1.0        
                         28 7e 28 80  26 80 29 7c  35 8c 42 75  41 95 36 79  (.(.&.).5.BuA.6y       226.1.16       
                         40 94 46 7d  49 94 49 7b  47 8e 48 7a  4f 88 51 78  @.F.I.I.G.HzO.Qx       226.1.32       
                         52 85 53 78  53 86 53 7a  53 82 53 7c  54 83 55 7a  R.SxS.SzS.S.T.Uz       226.1.48       
                         55 82 55 7b  55 85 55 7f  54 81 54                  U.U.U.U.T.T            226.1.64       
  26.3     72576  ISOC   0c 8d 29 69  e9 c1 23 0e  fc c1 b9 02  54 9e 54 74  ..)i..#.....T.Tt       227.1.0        
                         53 9e 52 72  51 9f 4f 70  4e 9e 4c 70  4b 9e 4a 77  S.RrQ.OpN.LpK.Jw       227.1.16       
                         49 9c 48 72  45 9a 44 74  45 9a 44 74  44 9b 44 75  I.HrE.DtE.DtD.Du       227.1.32       
                         44 9b 46 71  47 97 46 74  44 97 44 74  44 99 44 71  D.FqG.FtD.DtD.Dq       227.1.48       
                         44 98 44 71  44 9b 44 72  44 98 43                  D.DqD.DrD.C            227.1.64       
  26.3     79616  ISOC   0c 8c 2c 80  04 c2 85 3d  09 c2 39 03  35 7a 32 85  ..,....=..9.5z2.       228.1.0        
                         33 7d 39 86  4b 79 4d 89  51 7d 50 7f  4d 81 4d 79  3.9.KyM.Q.P.M.My       228.1.16       
                         4c 82 4c 7b  4d 83 4d 7e  4d 86 4c 78  4c 82 4e 78  L.L.M.M.M.LxL.Nx       228.1.32       
                         4e 82 4e 79  4e 82 4e 79  4f 82 4e 7b  4e 82 4d 7b  N.NyN.NyO.N.N.M.       228.1.48       
                         4e 81 4e 7d  4d 81 4d 7b  4d 82 4d                  N.N.M.M.M.M            228.1.64       
  26.3     72480  ISOC   0c 8c 2c 80  04 c2 db 6c  16 c2 b9 03  53 9e 52 75  ..,....l....S.Ru       229.1.0        
                         52 9e 50 72  4f 9e 4d 71  4d 9a 4c 75  4c 9d 4b 77  R.PrO.MqM.LuL.Kw       229.1.16       
                         48 9a 48 74  48 9b 47 72  47 98 47 74  48 9c 46 74  H.HtH.GrG.GtH.Ft       229.1.32       
                         47 9a 47 76  46 99 45 73  44 99 44 75  45 99 45 77  G.GvF.EsD.DuE.Ew       229.1.48       
                         45 99 44 74  43 9b 43 74  43 9c 42                  E.DtC.CtC.B            229.1.64       
  26.3     79712  ISOC   0c 8d 27 b2  1f c2 2c 9c  23 c2 39 04  f4 80 f4 80  ..'...,.#.9.....       230.1.0        
                         f4 80 f4 80  f4 80 f4 80  f4 80 f4 80  f4 80 f4 80  ................       230.1.16       
                         f3 80 f2 80  f3 80 f4 80  f3 7f f2 80  f2 7f f1 80  ................       230.1.32       
                         f1 7f f1 80  f1 7f f1 7f  f2 7d f2 7f  f2 7d f2 7f  ................       230.1.48       
                         f2 7d f2 7f  f2 7d f2 7f  f2 7d f2                  ...........            230.1.64       
  26.3     72234  ISOC   0c 8d 27 b2  1f c2 98 cb  30 c2 b9 04  54 9e 53 71  ..'.....0...T.Sq       231.1.0        
                         51 9d 50 70  4d 9d 4b 73  4b 9c 4b 71  4a 9d 48 72  Q.PpM.KsK.KqJ.Hr       231.1.16       
                         48 9e 47 71  49 9b 49 74  49 9c 48 74  48 9b 48 6f  H.GqI.ItI.HtH.Ho       231.1.32       
                         47 98 46 75  47 99 46 73  45 99 46 6f  46 9b 44 71  G.FuG.FsE.FoF.Dq       231.1.48       
                         44 9a 44 72  44 99 44 72  44 9b 44                  D.DrD.DrD.D            231.1.64       
  26.3     79958  ISOC   0c 8c 2b c9  3a c2 a2 fa  3d c2 39 05  6f 4f 6c 8e  ..+.:...=.9.oOl.       232.1.0        
                         71 4e 72 90  75 51 6f 8f  77 4c 77 8e  77 4e 78 8e  qNr.uQo.wLw.wNx.       232.1.16       
                         78 50 7a 8e  7b 54 7c 8c  3f 65 9a 83  d8 76 b0 7e  xPz..T..?e...v..       232.1.32       
                         ff 79 7a 81  46 66 5e 82  d5 76 bf 7c  e1 77 dd 7d  .yz.Ff^..v...w..       232.1.48       
                         5b 6a 3a 86  95 74 f1 7e  b2 79 ea                  [j:..t...y.            232.1.64       
  26.3     72006  ISOC   0c 8c 2b c9  3a c2 4d 2a  4b c2 b9 05  54 9e 53 75  ..+.:.M*K...T.Su       233.1.0        
                         52 9e 51 75  50 9e 4e 74  4e 9f 4c 74  4b 9e 4b 75  R.QuP.NtN.LtK.Ku       233.1.16       
                         4a 9e 49 75  49 9c 48 70  47 9a 47 70  49 9d 48 72  J.IuI.HpG.GpI.Hr       233.1.32       
                         47 99 47 74  47 99 46 73  46 9a 48 74  48 9b 48 74  G.GtG.FsF.HtH.Ht       233.1.48       
                         48 9b 47 72  48 9d 45 71  44 9a 44                  H.GrH.EqD.D            233.1.64       
  26.3     79940  ISOC   0c 8d 21 fb  55 c2 5f 59  58 c2 39 06  6b 7c 6c 82  ..!.U._YX.9.k.l.       234.1.0        
                         6d 79 6e 82  6e 7d 6f 82  70 7b 70 85  70 7d 71 85  myn.n.o.p.p.p.q.       234.1.16       
                         70 7c 70 85  70 7d 71 85  72 7e 71 86  70 7d 70 86  p.p.p.q.r.q.p.p.       234.1.32       
                         70 7d 70 83  70 7d 70 83  70 79 70 82  70 78 70 82  p.p.p.p.pyp.pxp.       234.1.48       
                         71 7a 71 82  73 7c 71 82  73 7b 73                  qzq.s.q.s.s            234.1.64       
  26.3     72182  ISOC   0c 8d 21 fb  55 c2 b1 88  65 c2 b9 06  1b 7f 1b 81  ..!.U...e.......       235.1.0        
                         1b 7e 1b 81  1b 7d 1b 81  1a 7e 1a 81  1c 7f 1b 81  ................       235.1.16       
                         1c 7f 1d 81  1c 7e 1c 81  1c 7f 1d 81  1e 7f 1f 82  ................       235.1.32       
                         1f 7e 20 80  1f 7f 1e 81  1d 7f 1d 81  1d 7f 1d 80  .. .............       235.1.48       
                         19 7e 19 81  18 7e 18 81  19 7f 17                  ...........            235.1.64       
  26.3     79784  ISOC   0c 8c 2a 12  71 c2 56 b8  72 c2 39 07  70 82 6e 7b  ..*.q.V.r.9.p.n.       236.1.0        
                         6d 84 6c 7d  6d 82 6d 7c  6d 82 6d 7d  6c 83 6d 7d  m.l.m.m.m.m.l.m.       236.1.16       
                         6d 84 6c 7d  6e 82 6d 7c  6d 81 6b 7d  6d 82 6c 7d  m.l.n.m.m.k.m.l.       236.1.32       
                         6c 82 6b 7f  6a 83 6b 7c  6a 81 67 78  64 83 63 79  l.k.j.k.j.gxd.cy       236.1.48       
                         62 82 64 7b  5f 7f 5e 78  63 81 66                  b.d._.^xc.f            236.1.64       
  26.3     74328  ISOC   0c 8c 2a 12  71 c2 7c e7  7f c2 b9 07  3f 97 3e 75  ..*.q.......?.>u       237.1.0        
                         3e 96 3f 73  3e 98 3e 74  3d 97 3c 72  3b 97 3b 73  >.?s>.>t=.<r;.;s       237.1.16       
                         3c 94 3d 75  3d 93 3d 74  3c 96 3b 76  3a 98 3b 77  <.=u=.=t<.;v:.;w       237.1.32       
                         39 98 38 74  39 96 39 74  39 95 39 74  37 94 36 74  9.8t9.9t9.9t7.6t       237.1.48       
                         36 95 38 77  37 97 38 75  19 87 1b                  6.8w7.8u...            237.1.64       
  26.3     77696  ISOC   0c 8d 23 44  8c c2 d4 14  8d c2 39 00  f4 80 f4 80  ..#D......9.....       238.1.0        
                         f4 80 f4 80  f4 80 f4 80  f4 80 f4 80  f4 80 f4 80  ................       238.1.16       
                         f3 80 f2 80  f3 80 f4 80  f3 7f f2 80  f2 7f f1 80  ................       238.1.32       
                         f1 7f f1 80  f1 7f f1 7f  f2 7d f2 7f  f2 7d f2 7f  ................       238.1.48       
                         f2 7d f2 7f  f2 7d f2 7f  f2 7d f2                  ...........            238.1.64       
  26.3     78976  ISOC   0c 8d 23 44  8c c2 2c 46  9a c2 b9 00  53 9e 53 70  ..#D..,F....S.Sp       239.1.0        
                         52 9c 52 74  4f 9d 4e 74  4b 97 4a 72  4a 98 4c 73  R.RtO.NtK.JrJ.Ls       239.1.16       
                         4b 9a 4a 74  4b 9c 4b 6f  4a 9b 4a 6f  4b 9a 4b 6e  K.JtK.KoJ.JoK.Kn       239.1.32       
                         4a 9a 4a 71  4a 9d 49 71  4a 9d 4a 74  49 9e 48 76  J.JqJ.IqJ.JtI.Hv       239.1.48       
                         49 9d 49 75  4a 9d 4a 73  49 9b 49                  I.IuJ.JsI.I            239.1.64       
  26.3     73216  ISOC   0c 8c 1b 5b  a7 c2 4f 74  a7 c2 39 01  6f 4f 6c 8e  ...[..Ot..9.oOl.       240.1.0        
                         71 4e 72 90  75 51 6f 8f  77 4c 77 8e  77 4e 78 8e  qNr.uQo.wLw.wNx.       240.1.16       
                         78 50 7a 8e  7b 54 7c 8c  3f 65 9a 83  d8 76 b0 7e  xPz..T..?e...v..       240.1.32       
                         ff 79 7a 81  46 66 5e 82  d5 76 bf 7c  e1 77 dd 7d  .yz.Ff^..v...w..       240.1.48       
                         5b 6a 3a 86  95 74 f1 7e  b2 79 ea                  [j:..t...y.            240.1.64       
  26.3     79650  ISOC   0c 8c 1b 5b  a7 c2 2c a5  b4 c2 b9 01  53 a3 52 73  ...[..,.....S.Rs       241.1.0        
                         4f 9f 4e 72  4e 9d 4d 73  4c 9d 4c 72  4c 9b 4b 6f  O.NrN.MsL.LrL.Ko       241.1.16       
                         4c 9b 4c 71  4b 9c 4b 71  4a 9a 47 73  4b 9c 4c 71  L.LqK.KqJ.GsK.Lq       241.1.32       
                         4b 99 4b 6e  4b 98 4b 72  4a 9e 4a 73  4a 9b 49 73  K.KnK.KrJ.JsJ.Is       241.1.48       
                         4a 9a 4a 73  49 9c 49 75  46 9d 47                  J.JsI.IuF.G            241.1.64       
  26.3     72542  ISOC   0c 8c 1b 5b  a7 c2 41 d4  c1 c2 39 02  7d 7c 7d 82  ...[..A...9.....       242.1.0        
                         80 79 83 81  85 79 86 81  87 7f 86 82  86 7d 7b 82  .y...y..........       242.1.16       
                         5b 7d a1 7d  ee 80 fb 7f  ec 7e d3 7b  b3 7c 9a 7a  [..............z       242.1.32       
                         9a 7d 86 81  83 78 83 84  7f 7c 82 83  82 7b 83 85  .....x..........       242.1.48       
                         84 79 84 84  85 79 84 84  85 7c 85                  .y...y.....            242.1.64       
  26.3     79616  ISOC   0c 8d 20 8d  c2 c2 e3 03  cf c2 b9 02  52 9d 50 73  .. .........R.Ps       243.1.0        
                         4f 9e 4e 73  4d 9d 4c 72  4b 9b 4b 75  4b 9a 4a 71  O.NsM.LrK.KuK.Jq       243.1.16       
                         4b 9a 4a 6f  4a 9e 4b 72  4b 9b 4c 6f  4b 9c 4b 71  K.JoJ.KrK.LoK.Kq       243.1.32       
                         4b 9b 4a 70  4b 9b 4c 71  4b 9d 4a 76  49 9a 4a 75  K.JpK.LqK.JvI.Ju       243.1.48       
                         49 98 49 73  49 98 48 72  47 97 47                  I.IsI.HrG.G            243.1.64       
  26.3     72576  ISOC   0c 8d 20 8d  c2 c2 44 33  dc c2 39 03  23 82 23 80  .. ...D3..9.#.#.       244.1.0        
                         21 81 1d 7d  17 7f 1b 7b  2d 7e 50 79  75 80 87 81  !.......-.Pyu...       244.1.16       
                         87 82 86 7e  7e 83 80 7b  7b 82 7d 7b  80 83 82 7e  ................       244.1.32       
                         82 80 81 7a  83 7e 85 79  6d 7d 97 7e  e2 7e fb 7f  ...z...ym.......       244.1.48       
                         f0 7f ce 7e  af 79 79 79  7e 7b 92                  .....yyy...            244.1.64       
  26.3     79616  ISOC   0c 8c 22 a4  dd c2 9b 62  e9 c2 b9 03  52 9e 4f 71  .."....b....R.Oq       245.1.0        
                         4e 9e 4d 71  4c 9e 4c 6e  49 9b 4a 6c  4a 9b 4a 73  N.MqL.LnI.JlJ.Js       245.1.16       
                         4a 9d 4b 72  4b 9c 4b 71  49 9a 4a 70  4b 9b 4a 72  J.KrK.KqI.JpK.Jr       245.1.32       
                         49 9b 4a 71  4a 9b 4a 77  4a 9d 4b 72  4b 9c 4b 70  I.JqJ.JwJ.KrK.Kp       245.1.48       
                         4a 9c 49 6e  49 9c 4a 75  49 9e 49                  J.InI.JuI.I            245.1.64       
  26.3     72576  ISOC   0c 8c 22 a4  dd c2 ff 91  f6 c2 39 04  71 84 70 7a  ..".......9.q.pz       246.1.0        
                         71 82 70 79  6d 82 6b 7e  68 82 68 7c  62 84 4e 7d  q.pym.k.h.h.b.N.       246.1.16       
                         42 86 34 7d  28 81 26 7e  22 7f 1e 7e  1e 7f 20 7c  B.4.(.&."..... .       246.1.32       
                         25 7f 29 7e  27 80 28 7f  26 81 25 7e  24 81 24 7e  %.).'.(.&.%.$.$.       246.1.48       
                         24 81 25 7d  24 81 25 7d  26 80 27                  $.%.$.%.&.'            246.1.64       
  26.3     79616  ISOC   0c 8d 1a d6  f8 c2 56 c1  03 c3 b9 04  50 9e 4f 6f  ......V.....P.Oo       247.1.0        
                         4e 9c 4e 71  4d 9c 4d 71  4c 9d 4c 72  4c 9e 4b 70  N.NqM.MqL.LrL.Kp       247.1.16       
                         4b 9a 4b 70  4a 9b 4b 73  4b 9c 4b 70  4c 9a 4b 71  K.KpJ.KsK.KpL.Kq       247.1.32       
                         4b 9b 4c 70  4a 99 49 70  48 97 49 71  4a 98 4a 70  K.LpJ.IpH.IqJ.Jp       247.1.48       
                         48 98 49 73  4a 99 4b 73  4a 97 4b                  H.IsJ.KsJ.K            247.1.64       
  26.3     72508  ISOC   0c 8d 1a d6  f8 c2 b5 f0  10 c3 39 05  ad 83 84 79  ..........9....y       248.1.0        
                         77 7f a4 83  a9 7e a3 82  97 7f 77 7b  80 7d a8 81  w.........w.....       248.1.16       
                         d5 7e f0 81  f0 80 e6 7f  d8 7d c6 7b  b2 7f bf 7c  ................       248.1.32       
                         95 7d 05 7c  26 7e 31 7d  32 80 2f 7f  28 80 2b 7c  ....&.1.2./.(.+.       248.1.48       
                         2d 7f 2f 7f  31 80 34 81  37 81 38                  -./.1.4.7.8            248.1.64       
  26.3     79684  ISOC   0c 8c 6f ed  13 c3 0d 20  1e c3 b9 05  7a 94 6e 65  ..o.... ....z.ne       249.1.0        
                         82 96 da 63  be 8b d4 79  f6 80 f4 7e  e0 81 b2 6b  ...c...y.......k       249.1.16       
                         95 9a 43 6a  77 8e 82 71  8e 89 a3 6d  a7 88 aa 68  ..Cjw..q...m...h       249.1.32       
                         d2 8a e1 71  e6 81 ea 7b  e2 80 e0 72  b3 89 9a 65  ...q.......r...e       249.1.48       
                         7f 90 85 6b  88 8a 6f 69  72 8b 71                  ...k..oir.q            249.1.64       
  26.3     72260  ISOC   0c 8c 6f ed  13 c3 73 4f  2b c3 39 06  eb 81 ef 80  ..o...sO+.9.....       250.1.0        
                         ed 7f e2 7e  cc 7e bd 7c  a7 79 a3 7f  76 7a 39 7b  .........y..vz9.       250.1.16       
                         11 80 1a 7b  1d 7f 22 7e  1e 7f 1b 7e  17 7f 0f 7e  ......".........       250.1.32       
                         12 7f 4d 7b  8b 7d a0 81  b3 7e 84 7c  12 7e 15 7e  ..M.............       250.1.48       
                         23 7f 23 7f  25 80 2e 7b  40 7e 3b                  #.#.%...@.;            250.1.64       
  26.3     79932  ISOC   0c 8d bd 04  2f c3 79 7e  38 c3 b9 06  f4 80 f4 80  ..../.y.8.......       251.1.0        
                         f4 80 f4 80  f4 80 f4 80  f4 80 f4 80  f4 80 f4 80  ................       251.1.16       
                         f4 80 f4 80  f4 80 f4 80  f4 80 f4 80  f4 80 f4 80  ................       251.1.32       
                         f4 80 f4 80  f4 80 f4 7f  f2 7f f0 7f  ed 7f e8 7e  ................       251.1.48       
                         e5 80 e3 7d  e1 80 dd 7d  db 81 d9                  ...........            251.1.64       
  26.3     72030  ISOC   0c 8d bd 04  2f c3 27 ae  45 c3 39 07  67 80 62 78  ..../.'.E.9.g.bx       252.1.0        
                         6b 83 6d 79  72 84 76 7c  78 85 74 7e  74 84 73 7f  k.myr.v.x.t.t.s.       252.1.16       
                         72 84 6d 7e  64 83 5f 7b  5b 86 47 76  37 84 29 7c  r.m.d._.[.Gv7.).       252.1.32       
                         2b 84 1c 7b  16 82 16 7d  1e 7f 23 7d  23 7e 23 7e  +.........#.#.#.       252.1.48       
                         22 7e 21 7d  24 7e 2a 7f  36 7f 37                  ".!.$.*.6.7            252.1.64       
  26.3     79944  ISOC   0c 8c 67 36  4a c3 33 dd  52 c3 b9 07  49 6e 49 97  ..g6J.3.R...InI.       253.1.0        
                         48 71 48 98  48 78 48 99  48 77 47 99  48 77 48 9b  HqH.HxH.HwG.HwH.       253.1.16       
                         48 73 48 9a  46 73 46 9b  46 76 48 9a  48 75 49 98  HsH.FsF.FvH.HuI.       253.1.32       
                         48 73 48 98  48 76 47 9a  47 76 46 9a  45 74 49 9c  HsH.HvG.GvF.EtI.       253.1.48       
                         49 77 49 9c  48 76 48 9a  47 79 46                  IwI.HvH.GyF            253.1.64       
  26.3     72154  ISOC   0c 8c 67 36  4a c3 8f 0c  60 c3 39 00  da 81 da 7a  ..g6J...`.9....z       254.1.0        
                         d9 81 da 7c  dc 82 fd 79  af 7f 00 7b  0f 7f 19 7f  .......y........       254.1.16       
                         19 7e 1f 80  22 7e 23 82  23 7e 1f 82  2a 80 45 83  ....".#.#...*.E.       254.1.32       
                         47 7f 48 82  4a 7f 4f 80  4b 7e 4d 7e  54 7f 55 7f  G.H.J.O.K.M.T.U.       254.1.48       
                         56 84 56 81  57 85 59 81  5b 7f 5c                  V.V.W.Y.[.\            254.1.64       
  26.3     79810  ISOC   0c 8d 73 4f  65 c3 1b 3c  6d c3 b9 00  5d 7c 5b 7e  ..sOe..<m...].[.       255.1.0        
                         5c 7b 5b 7e  58 7a 57 7f  58 7c 58 7e  59 78 59 7e  \.[.XzW.X.X.YxY.       255.1.16       
                         5a 79 59 7c  59 7c 58 7f  58 7f 58 80  57 7d 57 7c  ZyY.Y.X.X.X.W.W.       255.1.32       
                         5c 7c 5f 7f  5e 7b 5e 82  5b 79 60 81  5f 77 62 7f  \._.^.^.[y`._wb.       255.1.48       
                         61 7b 65 7e  63 7c 69 7f  67 7e 65                  a.e.c.i.g.e            255.1.64       
  26.3     72382  ISOC   0c 8d 73 4f  65 c3 4f 6b  7a c3 39 01  6e 82 6d 7b  ..sOe.Okz.9.n.m.       256.1.0        
                         70 82 6e 7a  6a 81 5e 77  57 83 4f 7b  49 7f 41 7e  p.nzj.^wW.O.I.A.       256.1.16       
                         3a 7f 2a 7c  26 80 1e 7e  1b 7b 18 81  1f 7d 23 80  :.*.&.........#.       256.1.32       
                         24 7e 20 81  24 7c 24 80  25 7d 26 7f  26 7e 26 7f  $. .$.$.%.&.&.&.       256.1.48       
                         25 7f 24 81  24 80 25 81  25 7f 25                  %.$.$.%.%.%            256.1.64       
  26.3     79616  ISOC   0c 8c 63 7f  80 c3 f2 9a  87 c3 b9 01  62 7d 61 7f  ..c.........b.a.       257.1.0        
                         60 7d 60 7f  60 7c 5f 7f  5e 7d 5f 80  60 7b 5f 7c  `.`.`._.^._.`._.       257.1.16       
                         5e 79 5f 81  5e 78 5e 7e  61 79 5d 7f  63 7a 62 81  ^y_.^x^.ay].czb.       257.1.32       
                         64 79 5e 81  5c 74 60 7f  59 7d 57 7f  5c 78 52 7c  dy^.\t`.Y.W.\xR.       257.1.48       
                         50 7b 50 78  47 7c 45 79  46 7b 45                  P.PxG.EyF.E            257.1.64       
  26.3     72576  ISOC   0c 8c 63 7f  80 c3 06 ca  94 c3 39 02  52 99 52 72  ..c.......9.R.Rr       258.1.0        
                         52 9c 50 73  4f 9e 4f 71  4e 9e 4e 6c  4c 9a 4a 6d  R.PsO.OqN.NlL.Jm       258.1.16       
                         49 98 49 72  4a 9d 49 6f  48 97 48 70  49 94 48 6e  I.IrJ.IoH.HpI.Hn       258.1.32       
                         48 97 48 6c  46 9b 45 6f  46 99 47 6e  47 97 45 73  H.HlF.EoF.GnG.Es       258.1.48       
                         40 98 35 78  22 84 1d 7e  1d 7f 1d                  @.5x"......            258.1.64       
  26.3     79616  ISOC   0c 8d d1 96  9b c3 a6 f9  a1 c3 b9 02  2b 84 23 7e  ............+.#.       259.1.0        
                         21 83 21 7d  23 86 26 7a  27 8b 1a 7b  2f 83 3d 78  !.!.#.&z'.../.=x       259.1.16       
                         24 83 30 79  30 8c 2d 79  29 8c 25 7c  27 89 27 7d  $.0y0.-y).%.'.'.       259.1.32       
                         27 88 28 7b  27 83 20 7d  1b 80 19 7f  1a 81 1a 80  '.(.'. .........       259.1.48       
                         15 80 16 7e  18 80 1a 7e  26 82 33                  ........&.3            259.1.64       
  26.3     72576  ISOC   0c 8d d1 96  9b c3 08 29  af c3 39 03  53 9f 51 72  .......)..9.S.Qr       260.1.0        
                         4e 9e 4e 72  4f 9e 4d 74  4b 9b 4a 71  4a 9c 48 6e  N.NrO.MtK.JqJ.Hn       260.1.16       
                         48 99 47 6d  47 9b 45 70  44 9a 45 73  45 99 44 73  H.GmG.EpD.EsE.Ds       260.1.32       
                         44 9b 45 74  45 9b 44 74  44 9a 45 73  44 9a 43 72  D.EtE.DtD.EsD.Cr       260.1.48       
                         43 97 43 70  40 96 32 74  23 86 1d                  C.Cp@.2t#..            260.1.64       
  26.3     79616  ISOC   0c 8c 68 c8  b6 c3 60 58  bc c3 b9 03  29 7f 28 83  ..h...`X....).(.       261.1.0        
                         28 7d 26 7e  25 81 28 7b  34 8e 3b 73  3c 98 3c 74  (.&.%.(.4.;s<.<t       261.1.16       
                         3d 98 3f 75  41 97 35 7b  35 96 3b 7a  48 93 51 7e  =.?uA.5.5.;zH.Q.       261.1.32       
                         5a 86 55 80  55 84 54 7d  54 84 53 79  53 81 53 79  Z.U.U.T.T.SyS.Sy       261.1.48       
                         55 81 55 7b  53 82 53 7b  55 81 55                  U.U.S.S.U.U            261.1.64       
  26.3     72576  ISOC   0c 8c 68 c8  b6 c3 bc 87  c9 c3 39 04  54 9e 53 73  ..h.......9.T.Ss       262.1.0        
                         53 9e 51 71  4f 9f 4e 73  4c 9e 4b 71  4a 9d 48 75  S.QqO.NsL.KqJ.Hu       262.1.16       
                         48 9d 47 74  46 9b 45 70  45 9b 44 73  44 9b 44 73  H.GtF.EpE.DsD.Ds       262.1.32       
                         45 9b 46 79  46 9c 46 78  47 9b 47 75  45 99 43 73  E.FyF.FxG.GuE.Cs       262.1.48       
                         43 98 44 6f  44 98 43 73  43 98 40                  C.DoD.CsC.@            262.1.64       
  26.3     79616  ISOC   0c 8d 66 df  d1 c3 18 b7  d6 c3 b9 04  32 7c 31 86  ..f.........2.1.       263.1.0        
                         36 7b 3c 82  4a 77 4f 82  51 7b 4f 80  4e 81 4c 7a  6.<.JwO.Q.O.N.Lz       263.1.16       
                         4c 82 4c 7a  4c 81 4d 7d  4d 82 4d 7a  4d 82 4d 7c  L.LzL.M.M.MzM.M.       263.1.32       
                         4d 82 4e 7a  4e 81 4e 79  4e 82 4e 7c  4e 81 4e 7b  M.NzN.NyN.N.N.N.       263.1.48       
                         4e 81 4e 7b  4f 82 4f 79  4f 81 4f                  N.N.O.OyO.O            263.1.64       
  26.3     72424  ISOC   0c 8d 66 df  d1 c3 77 e6  e3 c3 39 05  52 9e 51 71  ..f...w...9.R.Qq       264.1.0        
                         50 9e 4f 71  4e 9c 4f 72  4e 9e 4e 72  4c 9d 4b 70  P.OqN.OrN.NrL.Kp       264.1.16       
                         49 9e 47 76  46 9a 45 6d  47 97 47 73  46 9e 47 74  I.GvF.EmG.GsF.Gt       264.1.32       
                         47 9a 45 76  46 99 47 72  48 9b 48 74  48 9b 45 77  G.EvF.GrH.HtH.Ew       264.1.48       
                         45 9b 45 76  45 99 44 70  44 99 44                  E.EvE.DpD.D            264.1.64       
  26.3     79768  ISOC   0c 8c 60 11  ed c3 9a 15  f1 c3 b9 05  f4 80 f4 80  ..`.............       265.1.0        
                         f4 80 f4 80  f4 80 f4 80  f4 80 f4 80  f4 80 f4 80  ................       265.1.16       
                         f4 80 f4 80  f4 80 f4 80  f4 80 f4 80  f4 80 f4 80  ................       265.1.32       
                         f4 80 f4 80  f4 80 f4 80  f4 80 f4 80  f4 80 f4 80  ................       265.1.48       
                         f4 80 f4 80  f4 80 f4 80  f4 80 f4                  ...........            265.1.64       
  26.3     72190  ISOC   0c 8c 60 11  ed c3 2d 45  fe c3 39 06  54 9c 52 75  ..`...-E..9.T.Ru       266.1.0        
                         50 9d 4e 71  4e 9b 4d 6e  4c 9b 4c 70  4b 9b 4a 72  P.NqN.MnL.LpK.Jr       266.1.16       
                         4a 9a 4a 75  48 9d 49 73  48 98 48 74  49 98 47 72  J.JuH.IsH.HtI.Gr       266.1.32       
                         46 98 48 75  48 9c 49 75  49 9d 48 73  47 98 45 77  F.HuH.IuI.HsG.Ew       266.1.48       
                         45 9b 44 72  44 98 45 72  46 99 48                  E.DrD.ErF.H            266.1.64       
  26.3     79960  ISOC   0c 8d 65 28  08 c4 41 74  0b c4 b9 06  bb 83 00 7d  ..e(..At........       267.1.0        
                         7c 65 6a 8e  6f 4a 69 93  6c 49 62 91  6c 49 71 92  .ej.oJi.lIb.lIq.       267.1.16       
                         6f 4e 73 92  73 51 72 92  71 4c 70 91  71 48 71 91  oNs.sQr.qLp.qHq.       267.1.32       
                         71 48 72 92  73 4c 73 91  75 4b 75 91  75 48 75 8f  qHr.sLs.uKu.uHu.       267.1.48       
                         76 4d 77 91  77 49 77 8f  77 49 78                  vMw.wIw.wIx            267.1.64       
  26.3     72000  ISOC   0c 8d 65 28  08 c4 e6 a3  18 c4 39 07  25 7e 25 80  ..e(......9.%.%.       268.1.0        
                         25 7e 23 82  23 7f 23 80  23 7f 23 80  22 7f 22 80  %.#.#.#.#.#.".".       268.1.16       
                         21 7f 22 81  22 7f 21 81  22 7f 21 80  21 80 20 7f  !.".".!.".!.!. .       268.1.32       
                         1e 7e 25 80  34 73 54 9d  52 71 50 9f  50 73 4e 9e  ..%.4sT.RqP.PsN.       268.1.48       
                         4e 70 4d 9d  4a 71 48 9a  49 70 49                  NpM.JqH.IpI            268.1.64       
  26.3     79942  ISOC   0c 8c 5d 5a  23 c4 f1 d2  25 c4 b9 07  67 7b 66 81  ..]Z#...%...g.f.       269.1.0        
                         66 77 66 82  66 7a 66 82  67 7f 67 82  67 7f 69 85  fwf.fzf.g.g.g.i.       269.1.16       
                         6a 7f 69 84  67 7e 68 82  69 7e 69 81  69 7c 69 81  j.i.g.h.i.i.i.i.       269.1.32       
                         69 79 69 81  69 7b 6a 81  6b 7d 6b 85  6c 7e 6e 82  iyi.i.j.k.k.l.n.       269.1.48       
                         6f 7f 6f 85  6f 7d 70 83  70 7b 71                  o.o.o.p.p.q            269.1.64       
  26.3     72228  ISOC   0c 8c 5d 5a  23 c4 4a 02  33 c4 39 00  19 80 19 7f  ..]Z#.J.3.9.....       270.1.0        
                         19 81 1a 7e  1a 80 1a 7e  1a 80 1b 7f  1c 82 1b 7e  ................       270.1.16       
                         1b 81 1a 7d  1a 81 1a 7f  1b 81 1a 7f  1a 81 1a 7d  ................       270.1.32       
                         1a 81 1a 7d  1a 80 1a 7e  1a 7f 1a 7e  1a 81 1b 7f  ................       270.1.48       
                         1b 81 1b 7e  1b 80 1b 7f  1b 81 1b                  ...........            270.1.64       
  26.3     79738  ISOC   0c 8d 62 71  3e c4 f8 31  40 c4 b9 00  70 83 6f 7a  ..bq>..1@...p.oz       271.1.0        
                         6e 84 6e 79  6e 82 6e 7b  6e 82 6c 7a  6c 82 6d 7c  n.nyn.n.n.lzl.m.       271.1.16       
                         6d 81 6d 7b  6c 82 6c 7b  6b 81 6c 7c  6d 80 6d 7d  m.m.l.l.k.l.m.m.       271.1.32       
                         6d 81 6a 7a  64 83 57 73  5b 87 59 7b  50 87 4f 7b  m.jzd.Ws[.Y.P.O.       271.1.48       
                         5b 89 5a 7b  57 83 54 76  56 82 5b                  [.Z.W.TvV.[            271.1.64       
  26.3     73734  ISOC   0c 8d 62 71  3e c4 10 61  4d c4 39 01  41 72 41 96  ..bq>..aM.9.ArA.       272.1.0        
                         42 73 41 97  42 73 41 96  40 72 41 95  41 71 40 95  BsA.BsA.@rA.Aq@.       272.1.16       
                         3f 72 40 97  3e 75 3e 97  3f 73 3f 97  3f 74 3f 95  ?r@.>u>.?s?.?t?.       272.1.32       
                         40 74 40 95  3e 73 3e 97  3e 75 3f 94  3e 76 3e 94  @t@.>s>.>u?.>v>.       272.1.48       
                         3d 72 3c 96  3b 72 3c 94  3d 74 3e                  =r<.;r<.=t>            272.1.64       
  26.3     78336  ISOC   0c 8c 59 a3  59 c4 6a 8e  5a c4 b9 01  f4 80 f4 80  ..Y.Y.j.Z.......       273.1.0        
                         f4 80 f4 80  f4 80 f4 80  f4 80 f4 80  f4 80 f4 80  ................       273.1.16       
                         f4 80 f4 80  f4 80 f4 80  f4 80 f4 80  f4 80 f4 80  ................       273.1.32       
                         f4 80 f4 80  f4 80 f4 80  f4 80 f4 80  f4 80 f4 80  ................       273.1.48       
                         f4 80 f4 80  f4 80 f4 80  f4 80 f4                  ...........            273.1.64       
  26.3     78336  ISOC   0c 8c 59 a3  59 c4 de bf  67 c4 39 02  53 9e 51 71  ..Y.Y...g.9.S.Qq       274.1.0        
                         50 9e 4e 70  4d 9c 4d 70  4d 98 4c 72  4b 97 4a 73  P.NpM.MpM.LrK.Js       274.1.16       
                         49 9a 4a 71  4a 9c 4b 75  4a 9d 4b 72  49 9c 49 73  I.JqJ.KuJ.KrI.Is       274.1.32       
                         49 9c 4a 71  4a 98 4a 75  4a 9c 4a 74  49 9a 4a 6f  I.JqJ.JuJ.JtI.Jo       274.1.48       
                         4a 99 48 71  48 9b 48 6d  49 9c 48                  J.HqH.HmI.H            274.1.64       
  26.3     73856  ISOC   0c 8d 51 ba  74 c4 23 ed  74 c4 b9 02  bb 83 00 7d  ..Q.t.#.t.......       275.1.0        
                         7c 65 6a 8e  6f 4a 69 93  6c 49 62 91  6c 49 71 92  .ej.oJi.lIb.lIq.       275.1.16       
                         6f 4e 73 92  73 51 72 92  71 4c 70 91  71 48 71 91  oNs.sQr.qLp.qHq.       275.1.32       
                         71 48 72 92  73 4c 73 91  75 4b 75 91  75 48 75 8f  qHr.sLs.uKu.uHu.       275.1.48       
                         76 4d 77 91  77 49 77 8f  77 49 78                  vMw.wIw.wIx            275.1.64       
  26.3     79616  ISOC   0c 8d 51 ba  74 c4 c3 1e  82 c4 39 03  54 9b 51 72  ..Q.t.....9.T.Qr       276.1.0        
                         51 9d 50 70  4f 9e 4e 6f  4c 9a 4c 6f  4b 9b 4b 72  Q.PpO.NoL.LoK.Kr       276.1.16       
                         4b 9b 4a 6f  4a 9a 4b 6e  4b 9a 4a 71  4a 98 4a 76  K.JoJ.KnK.JqJ.Jv       276.1.32       
                         4b 9d 4a 71  4b 9a 4b 6c  49 98 4a 72  4a 98 4b 75  K.JqK.KlI.JrJ.Ku       276.1.48       
                         49 9c 47 6e  47 9a 46 73  47 9b 47                  I.GnG.FsG.G            276.1.64       
  26.3     72576  ISOC   0c 8d 51 ba  74 c4 d6 4d  8f c4 b9 03  c8 7f bf 7c  ..Q.t..M........       277.1.0        
                         a4 7e 88 77  6c 80 75 78  78 84 78 7d  79 87 7b 7b  ...wl.uxx.x.y...       277.1.16       
                         7a 86 79 7d  7a 87 7a 7c  7a 86 79 78  79 82 79 77  z.y.z.z.z.yxy.yw       277.1.32       
                         7b 84 7c 78  7d 87 7f 77  84 84 84 7a  84 82 85 7f  ...x...w...z....       277.1.48       
                         84 82 69 7d  67 7e c5 80  fb 7f f8                  ..i.g......            277.1.64       
  26.3     79616  ISOC   0c 8c 58 ec  8f c4 7b 7d  9c c4 39 04  50 9c 4f 75  ..X.......9.P.Ou       278.1.0        
                         4f 9d 4f 72  4e 9c 4d 70  4c 99 4c 6e  4c 99 4b 6d  O.OrN.MpL.LnL.Km       278.1.16       
                         4b 97 4b 71  4b 9d 4b 70  4b 9c 4b 6d  4a 9b 4a 70  K.KqK.KpK.KmJ.Jp       278.1.32       
                         4a 9a 4b 6e  4a 9a 49 6e  48 98 49 73  4a 99 49 73  J.KnJ.InH.IsJ.Is       278.1.48       
                         4a 9c 4a 70  48 99 48 72  48 97 49                  J.JpH.HrH.I            278.1.64       
  26.3     72576  ISOC   0c 8c 58 ec  8f c4 da ac  a9 c4 b9 04  1e 81 1b 7b  ..X.............       279.1.0        
                         15 7f 2a 79  49 80 72 7f  80 82 78 7b  80 83 7e 7b  ..*yI.r...x.....       279.1.16       
                         7e 81 7c 7a  7c 83 7d 7b  7f 82 81 7a  83 82 84 79  ...z.......z...y       279.1.32       
                         86 82 85 78  95 7e a6 7a  87 7b 69 7d  ab 7d ed 81  ...x...z..i.....       279.1.48       
                         fa 7f ec 7e  d0 7a ae 7a  7c 78 7f                  .....z.z.x.            279.1.64       
  26.3     79616  ISOC   0c 8d 71 03  ab c4 32 dc  b6 c4 39 05  52 9e 51 74  ..q...2...9.R.Qt       280.1.0        
                         4f 9e 4d 72  4d 9d 4c 70  4b 9a 4b 71  4a 9c 4b 75  O.MrM.LpK.KqJ.Ku       280.1.16       
                         4a 9d 4a 74  4c 9e 4c 70  4c 9d 4d 71  4d 99 4c 73  J.JtL.LpL.MqM.Ls       280.1.32       
                         4b 9b 4c 72  4b 9c 4b 72  4b 9b 4a 72  49 9c 4a 74  K.LrK.KrK.JrI.Jt       280.1.48       
                         4a 9c 48 75  49 9b 49 75  49 9c 48                  J.HuI.IuI.H            280.1.64       
  26.3     72576  ISOC   0c 8d 71 03  ab c4 92 0b  c4 c4 b9 05  70 85 6d 7a  ..q.........p.mz       281.1.0        
                         70 84 6e 7d  63 82 55 7b  43 81 35 79  24 80 22 7d  p.n.c.U.C.5y$.".       281.1.16       
                         23 7f 27 7d  29 7e 2a 7e  29 7f 28 7c  27 7f 27 7d  #.'.).*.).(.'.'.       281.1.32       
                         27 80 25 7f  25 80 24 7f  23 7f 1f 7e  1e 80 1c 7d  '.%.%.$.#.......       281.1.48       
                         20 81 22 7e  23 7f 23 80  24 80 24                   .".#.#.$.$            281.1.64       
  26.3     79616  ISOC   0c 8c 55 35  c6 c4 e9 3a  d1 c4 39 06  52 9f 50 75  ..U5...:..9.R.Pu       282.1.0        
                         4e 9e 4e 71  4d 9b 4c 72  4c 99 4c 72  4c 9d 4c 70  N.NqM.LrL.LrL.Lp       282.1.16       
                         4c 9b 4c 6f  4c 99 4b 70  4b 9a 4c 73  4c 9e 4b 70  L.LoL.KpK.LsL.Kp       282.1.32       
                         4b 9b 4b 71  4c 9c 4b 72  49 9a 4a 73  4a 99 49 76  K.KqL.KrI.JsJ.Iv       282.1.48       
                         4b 9d 4b 70  4a 9b 4a 6e  4a 9a 4b                  K.KpJ.JnJ.K            282.1.64       
  26.3     72454  ISOC   0c 8c 55 35  c6 c4 49 6a  de c4 b9 06  84 82 89 7e  ..U5..Ij........       283.1.0        
                         94 80 8e 7d  88 83 84 7a  84 84 84 7c  6d 83 69 7b  .......z....m.i.       283.1.16       
                         90 7e d0 7f  f0 7f f1 7f  eb 7f d9 7d  ca 7c af 7d  ................       283.1.32       
                         65 79 5e 7c  3e 7a 27 77  15 7e 24 79  29 7d 29 7d  ey^.>z'w..$y).).       283.1.48       
                         2a 7e 2a 7b  2d 80 2d 78  2f 80 34                  *.*.-.-x/.4            283.1.64       
  26.3     79738  ISOC   0c 8d a7 4c  e1 c4 85 99  eb c4 39 07  d2 78 d9 83  ...L......9..x..       284.1.0        
                         da 73 db 83  e6 76 d7 84  60 6b 74 8d  83 68 82 97  .s...v..`kt..h..       284.1.16       
                         82 6a 83 95  69 6e 68 88  d4 7e fc 7d  eb 7f f0 7c  .j..inh.........       284.1.32       
                         f3 7f fd 7d  c7 86 54 73  77 71 7b 8f  7b 70 7b 96  ......Tswq...p..       284.1.48       
                         7a 71 76 98  6c 69 84 94  cf 68 d7                  zqv.li...h.            284.1.64       
  26.3     72214  ISOC   0c 8d a7 4c  e1 c4 06 c9  f8 c4 b9 07  c6 7e dc 81  ...L............       285.1.0        
                         eb 7f f0 80  ea 7f d6 7d  b3 7b 8d 7d  48 78 1c 78  ............Hx.x       285.1.16       
                         19 7d 22 7e  20 7f 1c 7e  13 7f 0a 7d  2a 7e 65 80  ..". .......*.e.       285.1.32       
                         99 7f a4 85  9e 7e 98 80  b8 7e 85 7e  09 7f 1b 7d  ................       285.1.48       
                         21 81 22 7e  23 7f 21 7e  1e 81 25                  !.".#.!...%            285.1.64       
  26.3     79962  ISOC   0c 8c f5 63  fc c4 13 f8  05 c5 39 00  f4 80 f4 80  ...c......9.....       286.1.0        
                         f4 80 f4 80  f4 80 f4 80  f4 80 f4 80  f4 80 f4 80  ................       286.1.16       
                         f4 80 f4 80  f4 80 f4 80  f4 80 f4 80  f4 80 f4 80  ................       286.1.32       
                         f4 80 f4 80  f4 80 f4 80  f4 80 f4 80  f4 80 f4 80  ................       286.1.48       
                         f3 80 f3 7f  f4 80 f4 80  f4 80 f4                  ...........            286.1.64       
  26.3     72000  ISOC   0c 8c f5 63  fc c4 be 27  13 c5 b9 00  2c 7f 2c 80  ...c...'....,.,.       287.1.0        
                         2c 80 29 7d  27 80 26 80  28 80 2a 7f  74 86 73 7d  ,.).'.&.(.*.t.s.       287.1.16       
                         72 83 75 7f  75 86 68 7d  61 86 59 7b  53 86 49 7a  r.u.u.h.a.Y.S.Iz       287.1.32       
                         45 86 49 78  44 85 4e 77  56 82 59 76  56 82 56 77  E.IxD.NwV.YvV.Vw       287.1.48       
                         56 81 61 7e  6f 7d 84 84  6d 7d 27                  V.a.o...m.'            287.1.64       
  26.3     79942  ISOC   0c 8d a2 95  17 c5 cd 56  20 c5 39 01  4a 9a 4a 72  .......V .9.J.Jr       288.1.0        
                         4b 9b 4b 72  4b 9d 4b 72  4b 9b 4a 72  4a 98 49 74  K.KrK.KrK.JrJ.It       288.1.16       
                         49 98 49 73  49 96 48 70  48 97 48 71  48 97 48 71  I.IsI.HpH.HqH.Hq       288.1.32       
                         49 97 48 6d  48 9b 49 73  48 9a 48 73  48 97 48 74  I.HmH.IsH.HsH.Ht       288.1.48       
                         48 99 48 78  48 9a 47 74  48 97 46                  H.HxH.GtH.F            288.1.64       
  26.3     72202  ISOC   0c 8d a2 95  17 c5 1f 86  2d c5 b9 01  37 7e 43 7f  ........-...7.C.       289.1.0        
                         43 80 43 81  3e 7f 42 7f  3c 80 2d 7f  26 7f 22 81  C.C.>.B.<.-.&.".       289.1.16       
                         15 7f 12 7f  0e 7d 3b 7f  72 85 8f 7b  ba 81 d9 79  ......;.r......y       289.1.32       
                         dc 81 de 7d  dc 83 dc 7b  e3 82 e6 7c  e2 82 e6 7b  ................       289.1.48       
                         e8 82 e8 7c  e3 84 f7 7d  d8 83 00                  ...........            289.1.64       
  26.3     79764  ISOC   0c 8c 4f ad  32 c5 ca b5  3a c5 39 02  5b 7c 5b 7c  ..O.2...:.9.[.[.       290.1.0        
                         5a 7b 5a 79  58 79 56 7a  57 79 56 7c  55 7d 5b 7d  Z.ZyXyVzWyV.U.[.       290.1.16       
                         60 78 63 7c  63 7b 5f 7e  5e 7b 61 80  5f 7d 5d 80  `xc.c._.^.a._.].       290.1.32       
                         5c 7c 59 7b  58 7d 52 7a  4a 7d 41 75  3c 80 36 77  \.Y.X.RzJ.Au<.6w       290.1.48       
                         33 81 34 7a  33 87 2c 7b  27 89 26                  3.4z3.,.'.&            290.1.64       
  26.3     72428  ISOC   0c 8c 4f ad  32 c5 e8 e4  47 c5 b9 02  56 7d 49 79  ..O.2...G...V.Iy       291.1.0        
                         3d 80 40 78  43 81 46 79  49 81 44 7a  41 80 3c 78  =.@xC.FyI.DzA.<x       291.1.16       
                         2f 81 24 7b  22 81 30 7b  43 7e 52 80  60 7c 66 80  /.$.".0.C.R.`.f.       291.1.32       
                         65 7a 6a 85  69 7c 64 82  60 7a 5f 81  5e 7c 5e 7c  ezj.i.d.`z_.^.^.       291.1.48       
                         5c 79 5b 81  5e 7a 5b 84  5f 7c 60                  \y[.^z[._.`            291.1.64       
  26.3     79616  ISOC   0c 8d a0 de  4d c5 87 14  55 c5 39 03  60 78 5e 7e  ....M...U.9.`x^.       292.1.0        
                         5d 78 5e 7f  5e 78 5e 7d  61 7c 64 7e  5f 7c 58 7a  ]x^.^x^.a.d._.Xz       292.1.16       
                         52 7a 55 7e  54 78 4c 7e  4a 79 4c 7d  48 7e 45 7a  RzU.TxL.JyL.H.Ez       292.1.32       
                         42 7e 46 7b  4f 7b 42 7d  46 7b 44 81  4d 7c 52 80  B.F.O.B.F.D.M.R.       292.1.48       
                         47 7b 48 79  49 77 50 7a  52 78 53                  G.HyIwPzRxS            292.1.64       
  26.3     72576  ISOC   0c 8d a0 de  4d c5 9f 43  62 c5 b9 03  53 9e 53 71  ....M..Cb...S.Sq       293.1.0        
                         52 9e 52 73  50 9a 4e 70  4e 9c 4d 72  4d 9b 4c 6f  R.RsP.NpN.MrM.Lo       293.1.16       
                         4c 9b 4b 6e  4a 97 4b 71  4a 98 49 73  4b 9a 49 6e  L.KnJ.KqJ.IsK.In       293.1.32       
                         48 96 49 73  48 9a 48 78  48 9c 49 74  48 9a 46 74  H.IsH.HxH.ItH.Ft       293.1.48       
                         44 97 30 73  1d 84 1d 7e  1d 80 1c                  D.0s.......            293.1.64       
  26.3     79616  ISOC   0c 8c a1 f5  68 c5 42 73  6f c5 39 04  25 84 22 7d  ....h.Bso.9.%.".       294.1.0        
                         21 82 21 7e  23 85 27 7b  0c 86 38 81  a3 80 92 83  !.!.#.'...8.....       294.1.16       
                         3e 7b 21 7d  22 86 1f 7c  19 85 18 7d  16 82 17 7e  >.!."...........       294.1.32       
                         14 80 14 7f  14 80 14 7f  17 80 1d 7f  23 80 30 81  ............#.0.       294.1.48       
                         3e 7d 45 83  48 7b 51 85  5d 7e 64                  >.E.H.Q.].d            294.1.64       
  26.3     72576  ISOC   0c 8c a1 f5  68 c5 9e a2  7c c5 b9 04  51 9c 4f 73  ....h.......Q.Os       295.1.0        
                         4e 9e 4d 71  4d 9e 4e 73  4c 9e 4c 71  4a 9f 49 72  N.MqM.NsL.LqJ.Ir       295.1.16       
                         49 9a 48 74  47 9b 45 75  45 99 46 74  46 99 46 74  I.HtG.EuE.FtF.Ft       295.1.32       
                         47 98 47 71  44 99 43 6f  45 98 44 72  44 9a 45 71  G.GqD.CoE.DrD.Eq       295.1.48       
                         44 9c 41 74  3c 95 2c 79  1f 84 1c                  D.At<.,y...            295.1.64       
  26.3     79616  ISOC   0c 8d 9b 27  84 c5 f9 d1  89 c5 39 05  2b 80 29 7f  ...'......9.+.).       296.1.0        
                         28 7f 26 7f  26 85 29 7a  33 92 37 76  39 96 3a 77  (.&.&.)z3.7v9.:w       296.1.16       
                         3c 96 3c 73  39 95 32 75  31 94 38 75  3d 95 42 75  <.<s9.2u1.8u=.Bu       296.1.32       
                         50 8c 57 7a  54 88 54 79  55 87 54 7a  54 85 5a 7b  P.WzT.TyU.TzT.Z.       296.1.48       
                         5d 82 55 7c  55 84 56 7b  56 82 56                  ].U.U.V.V.V            296.1.64       
  26.3     72576  ISOC   0c 8d 9b 27  84 c5 52 01  97 c5 b9 05  54 9e 53 70  ...'..R.....T.Sp       297.1.0        
                         51 9b 51 70  4f 9b 4e 72  4c 9b 4c 70  4c 9c 4a 72  Q.QpO.NrL.LpL.Jr       297.1.16       
                         48 9b 46 73  46 98 45 73  45 99 45 70  45 9a 44 73  H.FsF.EsE.EpE.Ds       297.1.32       
                         44 9b 44 6f  45 97 44 71  43 99 43 6b  44 98 44 73  D.DoE.DqC.CkD.Ds       297.1.48       
                         44 9b 44 71  43 9a 43 6f  42 98 3b                  D.DqC.CoB.;            297.1.64       
  26.3     79616  ISOC   0c 8c a0 3e  9f c5 b2 30  a4 c5 39 06  32 7e 32 89  ...>...0..9.2.2.       298.1.0        
                         37 7d 3c 8a  4d 79 52 7f  51 7d 4f 7e  4d 7f 4d 7e  7.<.MyR.Q.O.M.M.       298.1.16       
                         4d 82 4c 7d  4c 81 4c 7a  4c 7e 4e 78  4f 7e 4e 7a  M.L.L.LzL.NxO.Nz       298.1.32       
                         4f 80 4f 7c  4f 82 4f 7f  4f 82 4f 7f  50 81 50 7c  O.O.O.O.O.O.P.P.       298.1.48       
                         4f 81 4f 7c  50 81 51 7e  51 7f 51                  O.O.P.Q.Q.Q            298.1.64       
  26.3     72370  ISOC   0c 8c a0 3e  9f c5 0a 60  b1 c5 b9 06  54 9b 52 73  ...>...`....T.Rs       299.1.0        
                         51 9e 4f 6f  4e 9e 4d 73  4c 9e 4c 74  4b 9a 4a 71  Q.OoN.MsL.LtK.Jq       299.1.16       
                         49 9c 48 74  48 9b 48 73  48 9c 48 73  47 9b 46 71  I.HtH.HsH.HsG.Fq       299.1.32       
                         46 9b 46 72  47 9a 46 72  46 9d 44 73  44 9a 44 74  F.FrG.FrF.DsD.Dt       299.1.48       
                         43 9c 43 71  43 97 43 71  43 97 42                  C.CqC.CqC.B            299.1.64       
  26.3     79822  ISOC   0c 8d 97 70  ba c5 13 8f  be c5 39 07  f4 7f f4 80  ...p......9.....       300.1.0        
                         f4 80 f4 80  f4 80 f4 80  f4 80 f4 80  f4 80 f4 80  ................       300.1.16       
                         f4 80 f4 80  f4 80 f4 80  f4 80 f4 80  f4 80 f4 80  ................       300.1.32       
                         f4 80 f4 80  f4 80 f4 80  f4 80 f4 80  f4 80 f4 80  ................       300.1.48       
                         f4 80 f4 80  f4 80 f4 80  f4 80 f4                  ...........            300.1.64       
  26.3     72144  ISOC   0c 8d 97 70  ba c5 c5 be  cb c5 b9 07  52 9d 51 78  ...p........R.Qx       301.1.0        
                         50 9f 4f 73  4e 9e 4d 70  4d 9e 4b 72  4a 9e 49 6f  P.OsN.MpM.KrJ.Io       301.1.16       
                         48 9b 47 6f  47 99 48 72  47 99 46 6e  46 99 45 6e  H.GoG.HrG.FnF.En       301.1.32       
                         45 99 46 6f  47 99 46 74  45 98 44 6e  45 98 45 70  E.FoG.FtE.DnE.Ep       301.1.48       
                         44 9a 45 6f  44 9a 44 72  44 99 43                  D.EoD.DrD.C            301.1.64       
  26.3     79958  ISOC   0c 8c 9e 87  d5 c5 d9 ed  d8 c5 39 00  65 83 12 77  ..........9.e..w       302.1.0        
                         16 7f 1d 7a  1d 81 1d 7d  1d 81 1e 7b  21 81 27 78  ...z........!.'x       302.1.16       
                         21 80 1f 7d  1e 80 1c 7d  1c 80 1c 7d  1c 81 1d 7d  !...............       302.1.32       
                         1e 80 21 7d  10 82 0c 7c  ef 81 be 82  00 7f 7e 64  ..!............d       302.1.48       
                         70 8d 6f 46  6e 93 6f 46  70 92 70                  p.oFn.oFp.p            302.1.64       
  26.3     72026  ISOC   0c 8c 9e 87  d5 c5 73 1d  e6 c5 b9 00  37 7e 37 86  ......s.....7.7.       303.1.0        
                         37 7b 32 7f  2b 7a 29 7f  2a 7a 2f 80  2d 7c 2e 81  7.2.+z).*z/.-...       303.1.16       
                         2c 7e 2b 81  2b 7a 2b 80  2a 7b 29 83  26 80 25 82  ,.+.+z+.*.).&.%.       303.1.32       
                         24 7f 24 82  23 7e 22 81  22 7f 22 81  21 7f 20 80  $.$.#.".".".!. .       303.1.48       
                         1f 7e 1e 80  1e 7e 1f 80  1f 7f 1f                  ...........            303.1.64       
  26.3     79920  ISOC   0c 8d 94 b9  f0 c5 8c 4c  f3 c5 39 01  66 82 67 78  .......L..9.f.gx       304.1.0        
                         67 82 68 7a  67 81 67 79  67 82 67 76  67 81 67 78  g.hzg.gyg.gvg.gx       304.1.16       
                         67 82 67 7b  67 81 65 7a  65 83 64 79  64 82 65 76  g.g.g.eze.dyd.ev       304.1.32       
                         66 82 67 7c  64 82 67 7e  69 82 69 7f  69 83 69 7c  f.g.d.g.i.i.i.i.       304.1.48       
                         68 82 68 79  68 81 69 78  6a 81 6b                  h.hyh.ixj.k            304.1.64       
  26.3     72272  ISOC   0c 8d 94 b9  f0 c5 e8 7b  00 c6 b9 01  1a 7f 19 7e  ................       305.1.0        
                         18 81 19 7e  18 81 18 7f  19 81 1a 7e  19 80 18 7e  ................       305.1.16       
                         18 81 19 7f  19 82 1a 7f  1a 81 19 7e  19 7f 19 7d  ................       305.1.32       
                         19 80 19 7e  19 81 19 7f  18 80 18 7f  19 81 19 7e  ................       305.1.48       
                         19 81 1a 7e  1a 81 1a 7e  1b 80 1b                  ...........            305.1.64       
  26.3     79690  ISOC   0c 8c 96 d0  0b c6 8f ab  0d c6 39 02  70 82 6e 7a  ..........9.p.nz       306.1.0        
                         6e 82 6d 79  6d 82 6c 78  6b 82 6d 77  6d 82 6c 7c  n.mym.lxk.mwm.l.       306.1.16       
                         6d 83 6e 7e  6c 84 6e 7e  6c 85 6c 78  6b 83 6b 7a  m.n.l.n.l.lxk.kz       306.1.32       
                         6b 83 6a 7b  69 80 62 79  58 82 5a 7c  54 86 4d 7c  k.j.i.byX.Z.T.M.       306.1.48       
                         57 86 5d 7a  5c 86 5a 79  5e 87 59                  W.]z\.Zy^.Y            306.1.64       
  26.3     73142  ISOC   0c 8c 96 d0  0b c6 a3 da  1a c6 b9 02  45 73 45 96  ............EsE.       307.1.0        
                         44 72 44 97  44 6e 43 99  43 72 43 98  43 72 43 99  DrD.DnC.CrC.CrC.       307.1.16       
                         43 73 43 98  43 72 43 98  42 6e 42 97  42 6f 42 96  CsC.CrC.BnB.BoB.       307.1.32       
                         42 73 42 97  40 70 40 94  40 70 40 96  40 73 40 98  BsB.@p@.@p@.@s@.       307.1.48       
                         40 71 40 96  40 6f 40 94  40 72 40                  @q@.@o@.@r@            307.1.64       
  26.3     78976  ISOC   0c 8d 94 02  27 c6 04 08  28 c6 39 03  f4 7f f4 80  ....'...(.9.....       308.1.0        
                         f4 80 f4 80  f4 80 f4 80  f4 80 f4 80  f4 80 f4 80  ................       308.1.16       
                         f4 80 f4 80  f4 80 f4 80  f4 80 f4 80  f4 80 f4 80  ................       308.1.32       
                         f4 80 f4 80  f4 80 f4 80  f4 80 f4 80  f4 80 f4 80  ................       308.1.48       
                         f4 80 f4 80  f4 80 f4 80  f4 80 f4                  ...........            308.1.64       
  26.3     77696  ISOC   0c 8d 94 02  27 c6 a3 39  35 c6 b9 03  52 9e 50 71  ....'..95...R.Pq       309.1.0        
                         4f 9f 4e 70  4d 9c 4e 72  4d 9e 4b 6f  4b 9c 4a 6c  O.NpM.NrM.KoK.Jl       309.1.16       
                         4a 98 49 6e  49 9c 49 72  49 9d 4a 70  4a 9a 48 70  J.InI.IrI.JpJ.Hp       309.1.32       
                         49 98 4b 6e  4c 9b 4b 72  48 9e 49 6d  49 9d 4a 71  I.KnL.KrH.ImI.Jq       309.1.48       
                         48 9a 47 71  48 9a 46 71  44 97 45                  H.GqH.FqD.E            309.1.64       
  26.3     74496  ISOC   0c 8c 8f 19  42 c6 bd 66  42 c6 39 04  65 83 12 77  ....B..fB.9.e..w       310.1.0        
                         16 7f 1d 7a  1d 81 1d 7d  1d 81 1e 7b  21 81 27 78  ...z........!.'x       310.1.16       
                         21 80 1f 7d  1e 80 1c 7d  1c 80 1c 7d  1c 81 1d 7d  !...............       310.1.32       
                         1e 80 21 7d  10 82 0c 7c  ef 81 be 82  00 7f 7e 64  ..!............d       310.1.48       
                         70 8d 6f 46  6e 93 6f 46  70 92 70                  p.oFn.oFp.p            310.1.64       
  26.3     79616  ISOC   0c 8c 8f 19  42 c6 5b 98  4f c6 b9 04  53 9e 51 72  ....B.[.O...S.Qr       311.1.0        
                         50 9f 4f 6d  4e 9c 4d 6f  4c 9c 4b 6e  4c 9a 4b 6e  P.OmN.MoL.KnL.Kn       311.1.16       
                         4b 9a 4a 71  4a 9a 4b 6f  4b 99 4a 6f  49 9a 49 75  K.JqJ.KoK.JoI.Iu       311.1.32       
                         49 9c 4a 76  4b 9e 4b 74  4a 9e 49 76  49 9e 4a 71  I.JvK.KtJ.IvI.Jq       311.1.48       
                         49 9c 48 6f  47 97 48 6f  48 97 48                  I.HoG.HoH.H            311.1.64       
  26.3     72576  ISOC   0c 8c 8f 19  42 c6 6d c7  5c c6 39 05  d4 81 c6 7c  ....B.m.\.9.....       312.1.0        
                         bc 7e a8 7a  83 7e 6e 79  78 81 76 7b  76 85 76 79  ...z..nyx.v.v.vy       312.1.16       
                         79 82 77 7c  78 86 78 7a  78 87 78 7c  78 87 7b 7c  y.w.x.xzx.x.x...       312.1.32       
                         7b 85 7c 79  7b 85 7f 78  81 86 7e 7c  80 87 81 7b  ...y...x........       312.1.48       
                         82 86 7f 7e  5d 81 86 7d  e4 7e fe                  ....]......            312.1.64       
  26.3     79616  ISOC   0c 8d 90 4b  5d c6 14 f7  69 c6 b9 05  51 9e 50 70  ...K]...i...Q.Pp       313.1.0        
                         4f a0 4d 70  4c a0 4c 6d  4c 9b 4b 70  4b 9b 4a 73  O.MpL.LmL.KpK.Js       313.1.16       
                         4b 9c 4d 73  4b 9d 4b 6f  4a 9a 4a 6e  4a 9a 4b 71  K.MsK.KoJ.JnJ.Kq       313.1.32       
                         4a 9a 4a 73  4b 9d 4a 6f  49 99 4a 6e  4b 9a 4b 70  J.JsK.JoI.JnK.Kp       313.1.48       
                         48 9b 49 72  4a 9a 48 73  48 99 48                  H.IrJ.HsH.H            313.1.64       
  26.3     72576  ISOC   0c 8d 90 4b  5d c6 70 26  77 c6 39 06  1f 7f 36 79  ...K].p&w.9...6y       314.1.0        
                         61 81 7f 7f  7e 82 7e 80  7a 85 7b 7b  7a 82 7c 78  a.......z...z..x       314.1.16       
                         7d 84 7c 76  7d 87 7f 7a  80 87 81 7e  82 84 83 7d  ...v...z........       314.1.32       
                         86 83 8a 73  95 7d b3 7e  a4 79 79 79  72 7c c5 7f  ...s.....yyyr...       314.1.48       
                         f6 7f f8 80  ea 7e c7 7c  95 7a 7f                  .........z.            314.1.64       
  26.3     79616  ISOC   0c 8c ca 62  78 c6 c9 55  84 c6 b9 06  52 9e 50 71  ...bx..U....R.Pq       315.1.0        
                         4e 9f 4c 72  4a 9c 4a 6f  4a 98 4a 70  4a 9b 4a 6f  N.LrJ.JoJ.JpJ.Jo       315.1.16       
                         4b 9c 4c 6c  4b 9c 4b 6e  4a 9a 4b 70  4b 9e 4a 73  K.LlK.KnJ.KpK.Js       315.1.32       
                         4b 9b 4b 70  4b 99 4b 6f  49 9a 48 71  48 99 47 6f  K.KpK.KoI.HqH.Go       315.1.48       
                         47 9c 49 74  49 9c 48 73  48 9a 49                  G.ItI.HsH.I            315.1.64       
  26.3     72576  ISOC   0c 8c ca 62  78 c6 2c 85  91 c6 39 07  76 83 72 7e  ...bx.,...9.v.r.       316.1.0        
                         65 85 4d 7d  33 84 26 7a  25 81 24 7e  26 81 28 7d  e.M.3.&z%.$.&.(.       316.1.16       
                         27 80 27 79  26 80 26 7d  25 81 25 7f  23 80 24 7f  '.'y&.&.%.%.#.$.       316.1.32       
                         24 81 23 7f  20 81 1d 7c  17 7f 13 7f  14 7f 16 7c  $.#. ...........       316.1.48       
                         18 7e 1e 7b  1e 7e 18 7c  15 80 19                  ...........            316.1.64       
  26.3     79616  ISOC   0c 8d 8c 94  93 c6 83 b4  9e c6 b9 07  50 9c 4f 6e  ............P.On       317.1.0        
                         4e 9d 4e 70  4d 9c 4c 6f  4c 9d 4c 6f  4b 9c 4b 73  N.NpM.LoL.LoK.Ks       317.1.16       
                         4b 9e 4b 6f  4c 9c 4c 70  4b 9e 4b 6f  4c 9c 4c 6c  K.KoL.LpK.KoL.Ll       317.1.32       
                         4a 97 4a 73  4a 97 4a 70  4b 98 4a 72  4a 9a 49 73  J.JsJ.JpK.JrJ.Is       317.1.48       
                         4a 9b 4b 74  4a 9a 48 71  49 99 4b                  J.KtJ.HqI.K            317.1.64       
  26.3     72398  ISOC   0c 8d 8c 94  93 c6 e3 e3  ab c6 39 00  76 84 74 79  ..........9.v.ty       318.1.0        
                         7c 83 7b 79  76 85 7b 7c  7e 81 81 81  83 81 72 7e  ...yv.........r.       318.1.16       
                         62 80 7f 7e  cd 7e ef 80  f4 80 ec 7f  d3 7c bd 7d  b...............       318.1.32       
                         81 6c 32 83  0f 7d 66 7e  96 73 46 7b  44 7e 3f 7b  .l2...f..sF.D.?.       318.1.48       
                         3a 7f 3c 7a  3b 7e 4e 81  65 7a 7e                  :.<z;.N.ez.            318.1.64       
  26.3     79794  ISOC   0c 8c dd ab  ae c6 f4 12  b9 c6 b9 00  a3 6c bb 88  .............l..       319.1.0        
                         7a 75 51 85  67 75 4c 8f  61 7c fb 80  f4 7d ee 7f  zuQ.guL.a.......       319.1.16       
                         ed 7d ec 80  e4 8e c7 74  b9 b9 b3 65  b6 a8 b6 79  .......t...e...y       319.1.32       
                         b0 79 aa 8b  af 6d be 8e  87 70 81 94  8c 69 84 99  .y...m...p...i..       319.1.48       
                         8a 7e d5 79  e8 90 e9 6c  eb 85 e7                  ...y...l...            319.1.64       
  26.3     72168  ISOC   0c 8c dd ab  ae c6 9e 42  c6 c6 39 01  91 7a a7 7f  .......B..9..z..       320.1.0        
                         c7 7e df 7f  f0 80 f0 7f  d8 80 b3 7c  94 79 4e 76  .............yNv       320.1.16       
                         1b 79 19 7a  0f 7e 0d 7d  48 7f 89 80  a0 81 a5 81  .y.z....H.......       320.1.32       
                         9c 7e 98 7c  9c 81 b0 7f  bf 80 3b 7c  04 7f 20 7d  ..........;... .       320.1.48       
                         22 81 21 7d  23 80 25 7b  2a 81 30                  ".!.#.%.*.0            320.1.64       
  26.3     79964  ISOC   0c 8d 2b c3  c9 c6 ab 71  d3 c6 b9 01  1b 81 1d 7a  ..+....q.......z       321.1.0        
                         1c 80 1a 7c  19 81 1a 7d  1a 81 1c 7d  20 82 1c 7f  ............ ...       321.1.16       
                         1c 81 1d 7d  1d 81 0c 7d  2a 80 8e 7f  05 80 ca 81  ........*.......       321.1.32       
                         ff 76 f4 80  f4 80 f4 80  f4 80 f4 80  f4 80 f4 80  .v..............       321.1.48       
                         f4 80 f4 80  f4 80 f4 80  f4 80 f4                  ...........            321.1.64       
  26.3     71998  ISOC   0c 8d 2b c3  c9 c6 59 a1  e0 c6 39 02  28 81 28 7e  ..+...Y...9.(.(.       322.1.0        
                         28 80 29 7e  28 80 27 7f  28 81 25 7f  23 81 24 7f  (.).(.'.(.%.#.$.       322.1.16       
                         26 80 29 7a  2a 7e 2b 7e  2b 80 2a 7f  29 82 29 7e  &.)z*.+.+.*.).).       322.1.32       
                         29 80 29 7a  29 81 2b 7b  2b 80 2a 7d  2a 7f 2b 7e  ).)z).+.+.*.*.+.       322.1.48       
                         2a 80 29 7f  27 82 2d 7b  5e 84 61                  *.).'.-.^.a            322.1.64       
  26.3     79942  ISOC   0c 8c d9 f4  e4 c6 62 d0  ed c6 b9 02  4c 6f 4c 9c  ......b.....LoL.       323.1.0        
                         4c 6f 4b 9c  4c 73 4b 9d  4b 72 4c 9e  4c 6f 4b 9c  LoK.LsK.KrL.LoK.       323.1.16       
                         4c 72 4c 9d  4c 72 4b 9d  4a 71 4a 9d  4a 71 4b 9d  LrL.LrK.JqJ.JqK.       323.1.32       
                         4a 6b 4b 9d  4b 6f 4b 9b  4b 6f 49 9c  48 6e 49 9a  JkK.KoK.KoI.HnI.       323.1.48       
                         4a 71 4b 9b  4b 6f 4c 9e  4b 6f 49                  JqK.KoL.KoI            323.1.64       
  26.3     72248  ISOC   0c 8c d9 f4  e4 c6 b9 ff  fa c6 39 03  cf 7c cc 83  ..........9.....       324.1.0        
                         c9 7c c8 81  c5 77 c0 82  b7 78 a8 7f  99 7a b6 82  .....w...x...z..       324.1.16       
                         e3 7e f5 7f  f4 7f f4 80  f4 80 f4 7f  ea 7f cb 89  ................       324.1.32       
                         c8 7d b8 89  c9 7d ff 7f  5f 7c 0b 7e  47 7f 39 7e  ........_...G.9.       324.1.48       
                         2f 82 28 7d  15 81 11 7e  10 7e 48                  /.(.......H            324.1.64       
  26.3     79716  ISOC   0c 8d d2 0c  00 c7 64 2f  08 c7 b9 03  5f 7e 60 7e  ......d/...._.`.       325.1.0        
                         66 7f 60 7f  5b 7e 5a 7e  50 80 4a 75  47 82 44 76  f.`.[.Z.P.JuG.Dv       325.1.16       
                         40 82 3e 75  37 82 34 77  31 87 2e 75  2b 8b 27 79  @.>u7.4w1..u+.'y       325.1.32       
                         26 8b 2e 78  27 8c 28 79  30 8c 31 76  31 8e 32 76  &..x'.(y0.1v1.2v       325.1.48       
                         38 91 38 73  3b 93 3a 73  3c 94 3d                  8.8s;.:s<.=            325.1.64       
  26.3     72476  ISOC   0c 8d d2 0c  00 c7 7e 5e  15 c7 39 04  76 7d 7c 81  .......^..9.v...       326.1.0        
                         82 7d 77 84  4c 7d 21 7d  14 7f 1c 7d  1d 80 1c 7e  ..w.L.!.........       326.1.16       
                         1c 7f 19 7c  14 7f 11 7d  33 7c 5e 82  72 7c 7b 84  ........3.^.r...       326.1.32       
                         7b 7a 76 84  74 7b 5e 7a  47 7e 3a 79  41 81 4a 7c  .zv.t.^zG.:yA.J.       326.1.48       
                         4c 84 4a 80  45 86 42 7a  40 83 38                  L.J.E.Bz@.8            326.1.64       
  26.3     79616  ISOC   0c 8c d6 3d  1b c7 1e 8e  22 c7 b9 04  52 7a 56 7a  ...=...."...RzVz       327.1.0        
                         48 7c 46 7a  54 7a 55 7c  4b 7e 3f 7d  4a 7c 54 80  H.FzTzU.K.?.J.T.       327.1.16       
                         52 7a 49 7a  49 7a 4f 7c  54 7b 54 7c  54 7c 55 7f  RzIzIzO.T.T.T.U.       327.1.32       
                         57 7d 56 82  56 7b 56 79  56 7b 55 7c  55 7c 56 7e  W.V.V.VyV.U.U.V.       327.1.48       
                         5c 7a 57 80  57 7a 57 7e  59 7a 5a                  \zW.WzW.YzZ            327.1.64       
  26.3     72576  ISOC   0c 8c d6 3d  1b c7 5e bd  2f c7 39 05  55 9e 52 6f  ...=..^./.9.U.Ro       328.1.0        
                         52 9e 51 6b  51 9b 50 6d  4e 9d 4f 70  4f 9c 4d 70  R.QkQ.PmN.OpO.Mp       328.1.16       
                         4c 9d 4d 72  4c 9b 4c 74  4b 9a 4a 70  49 98 49 6d  L.MrL.LtK.JpI.Im       328.1.32       
                         49 97 49 6e  4a 99 49 6a  48 97 48 70  48 97 44 6f  I.InJ.IjH.HpH.Do       328.1.48       
                         41 93 29 78  1d 82 1d 7d  1c 80 16                  A.)x.......            328.1.64       
  26.3     79616  ISOC   0c 8d de 54  36 c7 d6 ec  3c c7 b9 05  1e 82 15 7d  ...T6...<.......       329.1.0        
                         15 81 15 7e  14 81 15 7c  29 81 88 86  97 7e 8c 89  ........).......       329.1.16       
                         63 7c 34 82  39 7f 41 80  47 80 4c 80  50 7e 5f 7f  c.4.9.A.G.L.P._.       329.1.32       
                         72 7c 7b 7d  80 7b 88 83  91 7e 98 87  96 7d 9a 87  r...............       329.1.48       
                         a2 7c a2 84  a2 7c a2 83  9e 7c 9d                  ...........            329.1.64       
  26.3     72576  ISOC   0c 8d de 54  36 c7 32 1c  4a c7 39 06  51 9e 50 71  ...T6.2.J.9.Q.Pq       330.1.0        
                         4e 9e 4e 6d  4c 9e 4c 6f  4b 9c 4b 6c  49 9a 49 6f  N.NmL.LoK.KlI.Io       330.1.16       
                         49 98 46 6e  45 9a 44 6f  44 9a 44 70  44 9a 44 73  I.FnE.DoD.DpD.Ds       330.1.32       
                         44 9a 47 70  47 9c 45 72  44 9c 44 72  44 98 43 71  D.GpG.ErD.DrD.Cq       330.1.48       
                         43 97 41 72  37 92 26 7d  1e 82 1c                  C.Ar7.&....            330.1.64       
  26.3     79616  ISOC   0c 8c d3 86  51 c7 8f 4b  57 c7 b9 06  29 81 26 7e  ....Q..KW...).&.       331.1.0        
                         25 81 24 7e  25 85 2b 77  2f 92 32 75  35 97 35 79  %.$.%.+w/.2u5.5y       331.1.16       
                         35 96 33 77  2d 93 2b 76  2b 8f 2c 76  2e 92 2e 74  5.3w-.+v+.,v...t       331.1.32       
                         35 94 46 74  43 91 46 71  4a 92 49 74  44 91 41 75  5.FtC.FqJ.ItD.Au       331.1.48       
                         46 8d 57 7d  59 87 55 7a  56 85 57                  F.W.Y.UzV.W            331.1.64       
  26.3     72576  ISOC   0c 8c d3 86  51 c7 eb 7a  64 c7 39 07  55 a1 52 70  ....Q..zd.9.U.Rp       332.1.0        
                         51 a0 50 71  50 9f 4e 72  4b 9e 4a 73  49 9b 49 6d  Q.PqP.NrK.JsI.Im       332.1.16       
                         47 99 45 71  45 9e 45 72  45 9b 44 71  44 9d 44 6f  G.EqE.ErE.DqD.Do       332.1.32       
                         45 9d 44 71  44 9a 43 71  43 9b 43 73  43 99 44 72  E.DqD.CqC.CsC.Dr       332.1.48       
                         44 99 44 70  43 99 41 6d  3f 98 36                  D.DpC.Am?.6            332.1.64       
  26.3     79616  ISOC   0c 8d d9 9d  6c c7 48 aa  71 c7 b9 07  2c 80 2d 82  ....l.H.q...,.-.       333.1.0        
                         34 7e 37 84  41 7d 4d 81  4e 81 4e 79  4d 81 4d 7a  4.7.A.M.N.NyM.Mz       333.1.16       
                         4c 82 4c 79  4d 80 4d 7b  4e 81 4f 79  4f 83 4f 75  L.LyM.M.N.OyO.Ou       333.1.32       
                         4e 81 4f 78  50 82 51 7a  51 82 51 77  52 82 53 78  N.OxP.QzQ.QwR.Sx       333.1.48       
                         51 81 50 77  50 81 50 7a  50 81 4f                  Q.PwP.PzP.O            333.1.64       
  26.3     72324  ISOC   0c 8d d9 9d  6c c7 a2 d9  7e c7 39 00  52 9e 50 72  ....l.....9.R.Pr       334.1.0        
                         4f 9f 4f 6f  4d 9f 4d 6f  4c 9c 4c 6f  4a 9b 48 6f  O.OoM.MoL.LoJ.Ho       334.1.16       
                         46 9d 46 6f  45 9b 46 6f  48 97 49 72  48 9b 43 76  F.FoE.FoH.IrH.Cv       334.1.32       
                         45 9a 46 75  44 9a 45 70  44 9a 44 73  44 98 44 71  E.FuD.EpD.DsD.Dq       334.1.48       
                         44 99 44 71  43 9c 41 70  41 99 41                  D.DqC.ApA.A            334.1.64       
  26.3     79868  ISOC   0c 8c ce cf  87 c7 a9 08  8c c7 b9 00  f4 7f a3 7c  ................       335.1.0        
                         f3 7e a7 7a  43 82 75 63  d9 7e e3 7c  d8 7f bf 70  ...zC.uc.......p       335.1.16       
                         78 84 45 64  c2 7f ed 7a  cc 7e e8 75  82 81 6d 66  x.Ed...z...u..mf       335.1.32       
                         93 84 be 6a  80 81 b0 71  c7 7d f9 7f  f4 80 f4 80  ...j...q........       335.1.48       
                         f4 80 f4 80  f4 80 f4 80  f4 80 f4                  ...........            335.1.64       
  26.3     72098  ISOC   0c 8c ce cf  87 c7 59 38  99 c7 39 01  53 9e 52 72  ......Y8..9.S.Rr       336.1.0        
                         51 9e 4f 71  4d 9e 4d 71  4d 9f 4c 6d  4b 99 48 6d  Q.OqM.MqM.LmK.Hm       336.1.16       
                         46 9d 47 6e  47 9c 47 6e  46 9a 48 73  47 99 48 73  F.GnG.GnF.HsG.Hs       336.1.32       
                         46 9a 47 70  47 9c 46 72  46 9d 46 6f  46 9a 45 70  F.GpG.FrF.FoF.Ep       336.1.48       
                         45 99 45 75  45 9a 44 71  44 99 43                  E.EuE.DqD.C            336.1.64       
  26.3     79948  ISOC   0c 8d d7 e6  a2 c7 6f 67  a6 c7 b9 01  77 79 7b 85  ......og....wy..       337.1.0        
                         78 7a 79 84  7b 79 77 85  74 7b 73 86  75 7e 77 86  xzy..yw.t.s.u.w.       337.1.16       
                         74 7f 72 84  6e 7b 70 84  6e 7d 70 83  70 7d 6f 82  t.r.n.p.n.p.p.o.       337.1.32       
                         70 7b 6f 81  6e 7c 6e 83  80 80 4f 81  0a 79 1e 80  p.o.n.n...O..y..       337.1.48       
                         1d 7d 1d 81  1d 7d 1d 81  1d 7d 1c                  ...........            337.1.64       
  26.3     72082  ISOC   0c 8d d7 e6  a2 c7 e2 96  b3 c7 39 02  33 7c 37 83  ..........9.3.7.       338.1.0        
                         3a 7c 49 83  52 81 56 84  5e 80 63 7f  6f 80 76 7e  :.I.R.V.^.c.o.v.       338.1.16       
                         75 80 68 7d  63 80 5b 7f  50 82 4b 84  48 7f 41 86  u.h.c.[.P.K.H.A.       338.1.32       
                         38 7b 34 88  34 78 34 85  2d 79 29 82  2d 7a 30 80  8.4.4x4.-y).-z0.       338.1.48       
                         2c 78 29 81  28 7a 2a 82  2b 7d 29                  ,x).(z*.+.)            338.1.64       
  26.3     79874  ISOC   0c 8c cd 18  be c7 25 c6  c0 c7 b9 02  68 83 67 77  ......%.....h.gw       339.1.0        
                         68 82 68 7e  69 82 68 7c  68 84 68 7c  66 84 66 76  h.h.i.h.h.h.f.fv       339.1.16       
                         65 82 67 79  68 82 67 77  65 82 66 75  67 82 67 7a  e.gyh.gwe.fug.gz       339.1.32       
                         68 82 68 7c  68 81 69 77  69 80 69 7a  69 81 69 79  h.h.h.iwi.izi.iy       339.1.48       
                         69 80 68 7c  6a 83 6b 7b  6b 82 6c                  i.h.j.k.k.l            339.1.64       
  26.3     72318  ISOC   0c 8c cd 18  be c7 84 f5  cd c7 39 03  18 7d 18 81  ..........9.....       340.1.0        
                         18 7d 19 81  1a 7e 1b 81  1b 7d 1b 80  19 7d 19 81  ................       340.1.16       
                         18 7d 18 80  18 7e 18 80  18 7d 19 81  1a 7d 1a 81  ................       340.1.32       
                         1a 7f 1a 81  1b 7d 1b 81  1b 7f 1b 80  1a 7f 18 81  ................       340.1.48       
                         18 7f 18 80  19 7f 19 80  1a 7f 19                  ...........            340.1.64       
  26.3     79644  ISOC   0c 8d c9 2f  d9 c7 26 25  db c7 b9 03  6e 86 6e 79  .../..&%....n.ny       341.1.0        
                         6d 82 6b 78  6c 82 6b 79  6b 82 6b 7b  6c 84 6c 7d  m.kxl.kyk.k.l.l.       341.1.16       
                         6b 84 6b 7c  6b 83 6c 79  6b 83 6b 76  6b 82 6b 79  k.k.k.lyk.kvk.ky       341.1.32       
                         6b 82 6b 7a  6a 82 69 7d  63 83 63 7a  62 82 64 7a  k.kzj.i.c.czb.dz       341.1.48       
                         66 84 64 73  63 86 63 7e  65 85 67                  f.dsc.c.e.g            341.1.64       
  26.3     72548  ISOC   0c 8d c9 2f  d9 c7 3d 54  e8 c7 39 04  4b 9e 4a 71  .../..=T..9.K.Jq       342.1.0        
                         4b 9b 4b 73  4a 9c 49 74  48 9a 48 73  49 98 48 73  K.KsJ.ItH.HsI.Hs       342.1.16       
                         49 9c 49 74  49 9c 49 74  48 9c 47 71  48 9a 48 73  I.ItI.ItH.GqH.Hs       342.1.32       
                         47 98 45 74  44 98 45 6c  44 99 44 70  43 97 44 70  G.EtD.ElD.DpC.Dp       342.1.48       
                         44 99 44 73  43 98 43 73  43 98 43                  D.DsC.CsC.C            342.1.64       
  26.3     79616  ISOC   0c 8c cb 61  f4 c7 9a 81  f5 c7 b9 04  71 82 6b 7a  ...a........q.kz       343.1.0        
                         6f 7f 70 79  6f 81 70 79  6e 82 6c 79  6e 82 70 7d  o.pyo.pyn.lyn.p.       343.1.16       
                         70 81 6f 79  6e 85 6e 7b  6e 85 6f 7d  6f 81 6f 7a  p.oyn.n.n.o.o.oz       343.1.32       
                         6f 86 70 7d  6f 85 6f 7d  6f 83 70 7d  6f 85 70 7b  o.p.o.o.o.p.o.p.       343.1.48       
                         71 82 6f 7a  71 82 71 79  71 83 71                  q.ozq.qyq.q            343.1.64       
  26.3     77056  ISOC   0c 8c cb 61  f4 c7 3a b3  02 c8 39 05  54 9e 52 72  ...a..:...9.T.Rr       344.1.0        
                         52 9e 51 70  4f 9e 4d 70  4c 9b 4b 6f  4b 98 4a 71  R.QpO.MpL.KoK.Jq       344.1.16       
                         49 9b 49 6e  4a 9e 4b 70  4b 9a 4a 71  4a 97 4b 6f  I.InJ.KpK.JqJ.Ko       344.1.32       
                         4a 99 4a 73  49 9b 48 70  49 9b 49 71  48 99 48 6e  J.JsI.HpI.IqH.Hn       344.1.48       
                         48 9b 48 73  49 9b 47 70  47 9b 47                  H.HsI.GpG.G            344.1.64       
  26.3     75136  ISOC   0c 8d cf 78  0f c8 50 e0  0f c8 b9 05  77 79 7b 85  ...x..P.....wy..       345.1.0        
                         78 7a 79 84  7b 79 77 85  74 7b 73 86  75 7e 77 86  xzy..yw.t.s.u.w.       345.1.16       
                         74 7f 72 84  6e 7b 70 84  6e 7d 70 83  70 7d 6f 82  t.r.n.p.n.p.p.o.       345.1.32       
                         70 7b 6f 81  6e 7c 6e 83  80 80 4f 81  0a 79 1e 80  p.o.n.n...O..y..       345.1.48       
                         1d 7d 1d 81  1d 7d 1d 81  1d 7d 1c                  ...........            345.1.64       
  26.3     79616  ISOC   0c 8d cf 78  0f c8 f3 11  1d c8 39 06  53 9d 51 70  ...x......9.S.Qp       346.1.0        
                         50 9e 4e 6c  4c 9e 4c 6d  4c 9b 4b 71  4b 9a 4a 73  P.NlL.LmL.KqK.Js       346.1.16       
                         4a 9b 4a 71  4a 9a 4a 71  49 9a 49 70  4b 9b 4b 70  J.JqJ.JqI.IpK.Kp       346.1.32       
                         4a 9b 49 70  4a 9a 4a 6f  48 9b 47 73  48 99 49 72  J.IpJ.JoH.GsH.Ir       346.1.48       
                         49 9a 49 6d  47 9a 47 78  49 9c 49                  I.ImG.GxI.I            346.1.64       
  26.3     72576  ISOC   0c 8d cf 78  0f c8 1a 41  2a c8 b9 06  ea 7f d9 7b  ...x...A*.......       347.1.0        
                         c6 7e c0 7a  99 7e 79 79  6d 83 74 79  74 86 74 7a  ...z..yym.tyt.tz       347.1.16       
                         75 85 75 79  77 84 77 7a  78 84 78 78  78 83 78 7a  u.uyw.wzx.xxx.xz       347.1.32       
                         79 86 7a 7a  7b 88 7d 75  7d 81 80 76  7f 84 80 7b  y.zz...u...v....       347.1.48       
                         83 86 84 7f  78 83 61 7c  a8 7e f4                  ....x.a....            347.1.64       
  26.3     79616  ISOC   0c 8c c9 aa  2a c8 a9 70  37 c8 39 07  52 9d 50 6f  ....*..p7.9.R.Po       348.1.0        
                         4f 9b 4e 6c  4c 99 4c 6e  4c 9a 4b 70  4a 9a 49 6e  O.NlL.LnL.KpJ.In       348.1.16       
                         49 9a 4a 74  4b 9e 4a 75  4a 9d 4b 71  4b 9c 4b 72  I.JtK.JuJ.KqK.Kr       348.1.32       
                         4a 98 4a 70  4a 9a 4a 71  49 9c 49 75  49 9b 49 73  J.JpJ.JqI.IuI.Is       348.1.48       
                         4a 9b 4a 75  49 9c 49 73  49 98 48                  J.JuI.IsI.H            348.1.64       
  26.3     72576  ISOC   0c 8c c9 aa  2a c8 0b a0  44 c8 b9 07  70 85 81 7d  ....*...D...p...       349.1.0        
                         7d 82 78 7e  79 85 79 7a  79 85 7a 78  7a 84 7a 78  ..x.y.yzy.zxz.zx       349.1.16       
                         7b 84 7c 7a  7d 85 7e 7a  7f 83 7f 79  7f 84 81 7b  ...z...z...y....       349.1.32       
                         84 7e 83 7a  94 7f a5 7a  a3 7c 9a 7a  62 7d 85 7e  ...z...z...zb...       349.1.48       
                         dc 7e fc 80  f4 7f da 7e  bd 7c 92                  ...........            349.1.64       
  26.3     79616  ISOC   0c 8d 17 c2  45 c8 5e cf  51 c8 39 00  51 9e 4f 6f  ....E.^.Q.9.Q.Oo       350.1.0        
                         4d 9d 4d 6f  4c 9d 4b 70  4b 9c 4c 70  4b 9b 4b 6f  M.MoL.KpK.LpK.Ko       350.1.16       
                         4c 9a 4c 6f  4b 9b 4b 6d  4b 9a 4a 6f  4a 9c 4a 75  L.LoK.KmK.JoJ.Ju       350.1.32       
                         4b 9d 4c 73  4b 9b 4a 72  4a 9d 4a 70  4a 9c 4a 71  K.LsK.JrJ.JpJ.Jq       350.1.48       
                         4b 98 49 70  48 99 48 6f  49 98 48                  K.IpH.HoI.H            350.1.64       
  26.3     72576  ISOC   0c 8d 17 c2  45 c8 c5 fe  5e c8 b9 00  60 88 3d 7b  ....E...^...`.=.       351.1.0        
                         28 82 1d 7a  21 80 23 7f  25 7f 25 7d  25 81 25 7e  (..z!.#.%.%.%.%.       351.1.16       
                         24 81 24 7e  23 80 22 7f  23 80 22 7e  21 7f 1d 7c  $.$.#.".#.".!...       351.1.32       
                         18 80 18 7a  1b 7e 10 7e  18 7e 51 7a  88 7d 83 75  ...z......Qz...u       351.1.48       
                         21 75 1c 79  33 7a 38 7a  29 7c 24                  !u.y3z8z).$            351.1.64       
  26.3     79616  ISOC   0c 8c 68 d9  60 c8 1a 2e  6c c8 39 01  50 9d 4f 6f  ..h.`...l.9.P.Oo       352.1.0        
                         4d 9a 4c 72  4c 9d 4d 72  4d 9e 4c 75  4b 9e 4c 71  M.LrL.MrM.LuK.Lq       352.1.16       
                         4b 9b 4c 70  4c 9c 4a 73  49 9c 4c 71  4c 9e 4c 71  K.LpL.JsI.LqL.Lq       352.1.32       
                         4b 9b 4a 73  4a 9b 49 73  49 97 4a 6e  4b 9a 4b 71  K.JsJ.IsI.JnK.Kq       352.1.48       
                         4a 9b 4a 6f  49 98 4a 70  49 97 4a                  J.JoI.JpI.J            352.1.64       
  26.3     72350  ISOC   0c 8c 68 d9  60 c8 7c 5d  79 c8 b9 01  77 85 77 7b  ..h.`..]y...w.w.       353.1.0        
                         77 86 76 79  78 85 77 7b  77 83 78 7a  78 84 7a 7a  w.vyx.w.w.xzx.zz       353.1.16       
                         6d 83 5a 7c  8a 7f c2 80  ee 80 f7 7f  ed 7f ce 7e  m.Z.............       353.1.32       
                         94 7c 87 84  b9 7d ff 71  7b 7c 31 78  7f 80 8c 80  .......q..1x....       353.1.48       
                         77 80 70 80  72 7e 6e 81  61 7c 49                  w.p.r.n.a.I            353.1.64       
  26.3     79842  ISOC   0c 8d 16 0b  7c c8 80 8c  86 c8 39 02  9c 6f 9c 8e  ..........9..o..       354.1.0        
                         a1 73 a2 8a  97 7b 8d 86  81 7d 7f 88  82 75 83 8e  .s...........u..       354.1.16       
                         7f 6d 79 8f  74 6c 70 93  6b 70 68 96  5b 75 35 8a  .my.tlp.kph.[u5.       354.1.32       
                         be 71 ed 85  e6 77 ea 82  eb 7d ec 7f  ed 7e fe 7f  .q...w..........       354.1.48       
                         c3 7c 31 84  74 6f 46 98  4f 7c f8                  ..1.toF.O..            354.1.64       
  26.3     72122  ISOC   0c 8d 16 0b  7c c8 34 bc  93 c8 b9 02  8d 7f 8e 7c  ......4.........       355.1.0        
                         9e 7e b5 7f  d2 7f e9 81  f1 7f e7 7f  c4 7e a3 79  ...............y       355.1.16       
                         70 76 3d 7c  5d 7b 9b 81  aa 7d a3 82  9d 7f a0 7f  pv=.]...........       355.1.32       
                         9e 80 a0 7e  ae 81 d2 83  5a 81 00 7b  1e 7f 26 7c  ........Z.....&.       355.1.48       
                         27 7f 27 7f  28 81 2d 7e  35 82 40                  '.'.(.-.5.@            355.1.64       
  26.3     79956  ISOC   0c 8c 4e 23  97 c8 42 eb  a0 c8 39 03  41 73 41 97  ..N#..B...9.AsA.       356.1.0        
                         41 6f 41 99  3f 72 3f 99  3e 6f 3e 98  3e 6e 3e 96  AoA.?r?.>o>.>n>.       356.1.16       
                         3c 71 3b 93  3c 6e 3b 95  3a 71 3a 93  32 78 1d 87  <q;.<n;.:q:.2x..       356.1.32       
                         1c 7e 1a 80  1a 7d 19 81  19 7e 1a 80  1b 7c 1c 80  ................       356.1.48       
                         1a 7d 19 81  19 7e 1a 81  1c 7d 1e                  ...........            356.1.64       
  26.3     72050  ISOC   0c 8c 4e 23  97 c8 d4 1a  ae c8 b9 03  24 7f 28 80  ..N#........$.(.       357.1.0        
                         29 80 2b 80  31 81 33 80  36 7e 3a 81  3c 7e 3e 80  ).+.1.3.6.:.<.>.       357.1.16       
                         3d 7d 15 80  44 58 c8 86  9a 74 02 82  24 79 2a 7f  =...DX...t..$y*.       357.1.32       
                         2c 79 2f 80  31 7f 31 80  32 7d 31 80  2e 7f 2b 7f  ,y/.1.1.2.1...+.       357.1.48       
                         29 7f 27 80  25 7f 24 81  25 7e 24                  ).'.%.$.%.$            357.1.64       
  26.3     79900  ISOC   0c 8d 11 54  b2 c8 fa 49  bb c8 39 04  4f 9c 4d 6c  ...T...I..9.O.Ml       358.1.0        
                         4b 9b 4b 6f  4b 98 4a 6e  4b 98 4b 70  4b 9c 4c 70  K.KoK.JnK.KpK.Lp       358.1.16       
                         4c 9e 4c 72  4b 9d 4a 72  4a 9c 49 6d  49 9c 49 6d  L.LrK.JrJ.ImI.Im       358.1.32       
                         4a 9b 4a 6f  49 99 49 6d  4a 99 49 73  4a 9d 4a 73  J.JoI.ImJ.IsJ.Js       358.1.48       
                         4a 9b 4a 6d  4a 9b 4a 70  4b 9b 4a                  J.JmJ.JpK.J            358.1.64       
  26.3     72292  ISOC   0c 8d 11 54  b2 c8 58 79  c8 c8 b9 04  44 7d 44 80  ...T..Xy....D.D.       359.1.0        
                         43 7c 41 7e  40 7d 3f 7f  3f 7d 3e 7e  3f 7f 40 80  C.A.@.?.?.>.?.@.       359.1.16       
                         42 7d 4b 7f  50 7a 52 7e  54 7a 5a 7e  5d 7c 4e 7c  B.K.PzR.TzZ.].N.       359.1.32       
                         2a 7c 3b 7c  ef 7c e1 85  c7 7c c8 83  c7 7b c6 82  *.;.............       359.1.48       
                         bc 78 aa 80  9c 7a b6 80  e0 7e f3                  .x...z.....            359.1.64       
  26.3     79670  ISOC   0c 8c 16 6b  cd c8 f8 a8  d5 c8 39 05  2b 87 2f 78  ...k......9.+./x       360.1.0        
                         2c 88 29 75  2d 8a 30 79  2d 8a 28 75  2c 8d 31 73  ,.)u-.0y-.(u,.1s       360.1.16       
                         30 8f 30 76  3d 90 3c 78  3c 95 3e 75  3d 94 3e 71  0.0v=.<x<.>u=.>q       360.1.32       
                         3c 95 3d 6d  3e 95 3f 71  40 97 40 70  40 96 40 70  <.=m>.?q@.@p@.@p       360.1.48       
                         41 96 41 73  41 9c 42 70  43 96 43                  A.AsA.BpC.C            360.1.64       
  26.3     72522  ISOC   0c 8c 16 6b  cd c8 10 d8  e2 c8 b9 05  07 7c 1d 80  ...k............       361.1.0        
                         1d 7d 03 80  4e 7e 89 80  7e 7c 7a 7e  7b 7d 7b 7c  ....N.....z.....       361.1.16       
                         7c 7e 7b 7a  7a 82 79 7d  7a 81 79 7c  78 82 78 7c  ...zz.y.z.y.x.x.       361.1.32       
                         78 7f 77 7c  78 7f 77 7d  7c 82 84 7d  7b 82 3f 7c  x.w.x.w.......?.       361.1.48       
                         1c 7b 13 7f  1c 7e 1f 80  1e 7e 1a                  ...........            361.1.64       
  26.3     79616  ISOC   0c 8d 0f 9d  e8 c8 b5 07  f0 c8 39 06  4d 7c 53 7a  ..........9.M.Sz       362.1.0        
                         53 7f 53 7c  55 7f 54 7f  55 7c 55 7b  56 79 56 7b  S.S.U.T.U.U.VyV.       362.1.16       
                         56 7b 56 7b  57 7b 57 79  58 78 57 7f  57 7b 58 7e  V.V.W.WyXxW.W.X.       362.1.32       
                         59 7d 59 7f  58 7a 57 81  58 7b 57 7e  58 7a 58 7b  Y.Y.XzW.X.W.XzX.       362.1.48       
                         59 7a 57 7b  56 7c 56 78  57 7b 57                  YzW.V.VxW.W            362.1.64       
  26.3     72576  ISOC   0c 8d 0f 9d  e8 c8 15 37  fd c8 b9 06  56 99 53 70  .......7....V.Sp       363.1.0        
                         53 9b 52 6d  52 9d 52 71  51 9e 50 70  4f 9e 4e 73  S.RmR.RqQ.PpO.Ns       363.1.16       
                         4e 9c 4d 72  4c 9a 4b 71  4a 9c 4b 6f  49 9a 49 70  N.MrL.KqJ.KoI.Ip       363.1.32       
                         49 97 4a 71  4a 98 4a 73  48 99 48 74  49 99 48 78  I.JqJ.JsH.HtI.Hx       363.1.48       
                         4b 92 20 79  1d 82 1d 7d  1d 80 21                  K. y......!            363.1.64       
  26.3     79616  ISOC   0c 8c 14 b4  03 c9 6e 66  0a c9 39 07  4d 80 4c 7d  ......nf..9.M.L.       364.1.0        
                         54 7e 60 83  6d 7c 77 82  7c 7d 81 81  7a 7d 87 82  T.`.m.w.....z...       364.1.16       
                         8d 7c 96 84  94 7b 92 83  8f 7a 90 82  91 7c 8b 81  .........z......       364.1.32       
                         87 7d 85 83  88 7b 86 81  82 7c 80 7c  81 7a 7e 7e  .............z..       364.1.48       
                         77 7b 70 7e  6d 7c 6c 7a  6b 7b 66                  w.p.m.lzk.f            364.1.64       
  26.3     72576  ISOC   0c 8c 14 b4  03 c9 cd 95  17 c9 b9 07  50 9e 4f 6e  ............P.On       365.1.0        
                         4e 9e 4f 6e  4d 9d 4c 71  4c 9d 4b 6f  4a 9b 49 6d  N.OnM.LqL.KoJ.Im       365.1.16       
                         44 9a 45 6e  46 9c 45 6e  45 9c 45 72  45 9c 44 6e  D.EnF.EnE.ErE.Dn       365.1.32       
                         44 98 45 6c  45 97 44 6f  47 9a 46 71  45 9d 43 73  D.ElE.DoG.FqE.Cs       365.1.48       
                         43 9a 41 70  32 8f 22 79  1d 81 1c                  C.Ap2."y...            365.1.64       
  26.3     79616  ISOC   0c 8d 09 e6  1e c9 25 c5  24 c9 39 00  2a 7f 25 7f  ......%.$.9.*.%.       366.1.0        
                         22 81 22 7e  25 87 2a 77  2e 8f 34 77  34 95 31 79  ".".%.*w..4w4.1y       366.1.16       
                         2f 95 2b 78  25 8c 26 7c  26 8c 29 7a  2a 8e 2c 77  /.+x%.&.&.)z*.,w       366.1.32       
                         31 95 31 75  36 94 47 75  4a 9c 47 74  40 99 3d 72  1.1u6.GuJ.Gt@.=r       366.1.48       
                         35 95 3f 75  52 91 58 7e  57 83 56                  5.?uR.X.W.V            366.1.64       
  26.3     72528  ISOC   0c 8d 09 e6  1e c9 81 f4  31 c9 b9 00  54 9e 52 76  ........1...T.Rv       367.1.0        
                         51 9e 50 70  4e 9c 4c 70  4a 9a 4a 70  48 99 49 6a  Q.PpN.LpJ.JpH.Ij       367.1.16       
                         48 9b 48 72  48 98 46 70  44 99 43 6e  44 9c 44 6f  H.HrH.FpD.CnD.Do       367.1.32       
                         44 99 43 70  43 99 44 6f  44 99 43 71  43 9b 43 73  D.CpC.DoD.CqC.Cs       367.1.48       
                         44 97 44 73  43 99 42 70  3b 95 28                  D.DsC.Bp;.(            367.1.64       
  26.3     79664  ISOC   0c 8c 13 fd  39 c9 da 23  3f c9 39 01  f2 7d f2 7f  ....9..#?.9.....       368.1.0        
                         f2 7d f2 7f  f2 7d f2 7f  f2 7d f2 7f  f2 7d f1 7f  ................       368.1.16       
                         f1 7c f1 7f  f1 7a f1 7f  f2 79 f1 7f  f1 78 f1 80  .....z...y...x..       368.1.32       
                         f0 79 f0 80  f0 78 f0 81  f0 77 f0 82  2c 7e 2d 85  .y...x...w..,.-.       368.1.48       
                         32 7f 36 86  36 7e 47 81  4d 80 4d                  2.6.6.G.M.M            368.1.64       
  26.3     72278  ISOC   0c 8c 13 fd  39 c9 3b 53  4c c9 b9 01  54 9b 52 71  ....9.;SL...T.Rq       369.1.0        
                         51 9e 50 70  4f a0 4f 6d  4f 9c 4d 6d  4a 9c 49 73  Q.PpO.OmO.MmJ.Is       369.1.16       
                         48 9c 49 74  49 9d 46 73  45 9c 46 71  46 9a 44 72  H.ItI.FsE.FqF.Dr       369.1.32       
                         44 9b 44 71  44 98 44 6f  44 9a 44 72  44 9a 44 71  D.DqD.DoD.DrD.Dq       369.1.48       
                         43 99 43 6e  43 98 42 71  41 96 41                  C.CnC.BqA.A            369.1.64       
  26.3     79914  ISOC   0c 8d 06 2f  55 c9 44 82  59 c9 39 02  8c 6f ef 80  .../U.D.Y.9..o..       370.1.0        
                         eb 7f e2 80  99 73 50 80  4e 6c ad 83  d0 7b b2 7f  .....sP.Nl......       370.1.16       
                         ed 73 6d 80  68 62 6b 88  d4 73 ac 7e  e7 78 b8 81  .sm.hbk..s...x..       370.1.32       
                         5f 5d 8c 8a  8c 52 56 8a  ac 72 f5 7e  8a 74 d2 7e  _]...RV..r...t..       370.1.48       
                         80 71 79 84  6f 5a ab 7f  b7 73 c6                  .qy.oZ...s.            370.1.64       
  26.3     72050  ISOC   0c 8d 06 2f  55 c9 f2 b1  66 c9 b9 02  54 9e 51 72  .../U...f...T.Qr       371.1.0        
                         4e 9e 4d 6f  4d 9c 4c 6f  4b 9b 4b 6d  4b 99 4a 6f  N.MoM.LoK.KmK.Jo       371.1.16       
                         48 9a 48 73  47 9b 47 75  48 9b 48 72  48 99 47 72  H.HsG.GuH.HrH.Gr       371.1.32       
                         45 9b 45 70  44 98 45 6e  44 97 45 70  44 9a 44 72  E.EpD.EnD.EpD.Dr       371.1.48       
                         44 9a 43 71  43 97 43 73  41 95 43                  D.CqC.CsA.C            371.1.64       
  26.3     79942  ISOC   0c 8c 0d 46  70 c9 05 e1  73 c9 39 03  61 7f 6b 80  ...Fp...s.9.a.k.       372.1.0        
                         74 80 75 7e  73 7e 74 82  75 7f 76 83  76 7e 76 82  t.u.s.t.u.v.v.v.       372.1.16       
                         76 7d 73 84  75 7b 76 81  76 7a 76 81  72 7b 71 81  v.s.u.v.vzv.r.q.       372.1.32       
                         75 7e 72 81  76 7c 73 82  6f 7d 73 84  72 7c 75 86  u.r.v.s.o.s.r.u.       372.1.48       
                         77 7e 75 84  75 7f 77 85  77 7d 77                  w.u.u.w.w.w            372.1.64       
  26.3     72136  ISOC   0c 8c 0d 46  70 c9 5b 10  81 c9 b9 03  39 82 47 7d  ...Fp.[.....9.G.       373.1.0        
                         4f 81 53 7e  60 80 65 80  68 80 6e 81  69 7f 62 80  O.S.`.e.h.n.i.b.       373.1.16       
                         59 82 53 80  4e 83 46 7f  39 81 38 7c  32 86 34 78  Y.S.N.F.9.8.2.4x       373.1.32       
                         39 89 3d 7c  45 85 52 81  5a 81 64 89  68 80 6e 7f  9.=.E.R.Z.d.h.n.       373.1.48       
                         70 7e 6c 80  66 80 60 7f  5b 83 58                  p.l.f.`.[.X            373.1.64       
  26.3     79830  ISOC   0c 8d 04 78  8b c9 dd 3f  8e c9 39 04  6a 83 69 7c  ...x...?..9.j.i.       374.1.0        
                         6a 85 6b 7b  6c 82 6c 7b  6c 85 6b 7d  6b 84 6a 7b  j.k.l.l.l.k.k.j.       374.1.16       
                         6a 82 69 79  68 83 68 79  68 83 68 76  68 80 68 79  j.iyh.hyh.hvh.hy       374.1.32       
                         67 81 67 76  68 81 69 7b  6a 84 69 7c  69 81 69 7a  g.gvh.i.j.i.i.iz       374.1.48       
                         68 81 6a 79  6a 82 6b 7b  6b 82 6b                  h.jyj.k.k.k            374.1.64       
  26.3     72362  ISOC   0c 8d 04 78  8b c9 1f 6f  9b c9 b9 04  2b 7a 31 8a  ...x...o....+z1.       375.1.0        
                         32 76 34 90  35 73 34 92  32 75 37 8d  17 7e 1a 81  2v4.5s4.2u7.....       375.1.16       
                         18 7e 18 80  18 7d 18 81  18 7d 18 81  18 7f 18 80  ................       375.1.32       
                         19 7e 19 81  1a 7f 19 81  18 7f 18 80  18 7d 18 81  ................       375.1.48       
                         1a 7d 1b 80  1b 7e 1a 81  19 7f 18                  ...........            375.1.64       
  26.3     79616  ISOC   0c 8c 00 8f  a6 c9 bc 9e  a8 c9 39 05  6e 82 6e 79  ..........9.n.ny       376.1.0        
                         6e 82 6b 7c  6b 82 6b 7b  6b 81 6d 7a  6b 83 6b 7c  n.k.k.k.k.mzk.k.       376.1.16       
                         6a 82 6b 7a  6b 82 6a 7b  6a 84 6b 7a  6b 81 6a 7b  j.kzk.j.j.kzk.j.       376.1.32       
                         69 83 69 7a  6a 82 69 79  68 81 63 80  6a 84 6a 7e  i.izj.iyh.c.j.j.       376.1.48       
                         69 83 68 7b  69 82 69 7a  6a 82 69                  i.h.i.izj.i            376.1.64       
  26.3     72576  ISOC   0c 8c 00 8f  a6 c9 d0 cd  b5 c9 b9 05  53 9e 52 70  ............S.Rp       377.1.0        
                         50 9d 4f 6d  4f 9d 4e 6e  4e 9d 4c 6e  4b 9b 4a 70  P.OmO.NnN.LnK.Jp       377.1.16       
                         4a 9d 4a 70  49 9f 48 6e  48 9a 4a 6d  4a 9a 49 6f  J.JpI.HnH.JmJ.Io       377.1.32       
                         4a 99 49 73  48 9e 49 77  49 9d 48 73  47 99 46 72  J.IsH.IwI.HsG.Fr       377.1.48       
                         45 99 46 70  47 9b 47 70  47 9d 48                  E.FpG.GpG.H            377.1.64       
  26.3     79616  ISOC   0c 8d 05 c1  c1 c9 2f fb  c2 c9 39 06  6f 85 6f 7e  ....../...9.o.o.       378.1.0        
                         6e 82 6e 7c  6f 82 6f 79  6e 84 6c 7a  6c 82 6c 7c  n.n.o.oyn.lzl.l.       378.1.16       
                         6c 82 6c 7c  6d 82 6f 79  6f 81 6f 7a  6e 82 6c 78  l.l.m.oyo.ozn.lx       378.1.32       
                         6c 81 6e 79  6f 81 6f 7b  6f 81 6e 7b  6f 81 6f 7a  l.nyo.o.o.n.o.oz       378.1.48       
                         70 82 70 7b  70 82 70 7c  70 83 70                  p.p.p.p.p.p            378.1.64       
  26.3     76416  ISOC   0c 8d 05 c1  c1 c9 d4 2c  d0 c9 b9 06  53 9e 51 70  .......,....S.Qp       379.1.0        
                         50 9e 4f 70  4d 9e 4c 6e  4b 9c 4b 70  4b 9b 4a 6f  P.OpM.LnK.KpK.Jo       379.1.16       
                         4a 99 4a 73  49 9d 48 70  4a 9d 4a 71  4b 9b 4b 73  J.JsI.HpJ.JqK.Ks       379.1.32       
                         4b 9c 49 76  49 9e 49 70  49 9d 4a 6f  49 99 48 71  K.IvI.IpI.JoI.Hq       379.1.48       
                         47 9c 46 6f  47 99 46 70  45 99 46                  G.FoG.FpE.F            379.1.64       
  26.3     75776  ISOC   0c 8c 1b d8  dc c9 ea 59  dd c9 39 07  61 7f 6b 80  .......Y..9.a.k.       380.1.0        
                         74 80 75 7e  73 7e 74 82  75 7f 76 83  76 7e 76 82  t.u.s.t.u.v.v.v.       380.1.16       
                         76 7d 73 84  75 7b 76 81  76 7a 76 81  72 7b 71 81  v.s.u.v.vzv.r.q.       380.1.32       
                         75 7e 72 81  76 7c 73 82  6f 7d 73 84  72 7c 75 86  u.r.v.s.o.s.r.u.       380.1.48       
                         77 7e 75 84  75 7f 77 85  77 7d 77                  w.u.u.w.w.w            380.1.64       
  26.3     79616  ISOC   0c 8c 1b d8  dc c9 85 8b  ea c9 b9 07  53 9e 51 77  ............S.Qw       381.1.0        
                         50 9e 4e 74  4c 9e 4c 74  4c 9b 4b 71  49 98 48 73  P.NtL.LtL.KqI.Hs       381.1.16       
                         4a 99 4a 74  4a 9a 4a 70  4a 98 4a 71  4a 9b 4a 73  J.JtJ.JpJ.JqJ.Js       381.1.32       
                         4a 9e 49 74  4b 9c 4a 72  4a 9d 49 6f  47 9d 47 74  J.ItK.JrJ.IoG.Gt       381.1.48       
                         47 9b 48 73  48 9a 48 75  48 9b 49                  G.HsH.HuH.I            381.1.64       
  26.3     72576  ISOC   0c 8c 1b d8  dc c9 de ba  f7 c9 39 00  e7 80 e5 7f  ..........9.....       382.1.0        
                         cf 80 bb 7a  a0 81 7d 78  6b 83 6f 7b  71 86 72 78  ...z...xk.o.q.rx       382.1.16       
                         75 82 75 79  75 83 76 77  75 82 76 7b  78 85 78 7a  u.uyu.vwu.v.x.xz       382.1.32       
                         79 86 7a 7b  7b 87 7b 7c  7e 86 7e 79  7f 83 7f 78  y.z........y...x       382.1.48       
                         80 85 81 7d  80 83 64 7b  6e 7f d0                  ......d.n..            382.1.64       
  26.3     79616  ISOC   0c 8d 05 0a  f8 c9 41 ea  04 ca b9 00  51 9d 51 6c  ......A.....Q.Ql       383.1.0        
                         50 9c 4f 6f  4f 9e 4e 72  4c 9d 49 75  49 9d 49 70  P.OoO.NrL.IuI.Ip       383.1.16       
                         49 97 49 70  49 99 4a 6f  4b 9c 4b 6b  4b 9b 49 73  I.IpI.JoK.KkK.Is       383.1.32       
                         4a 9b 4b 6f  4b 9b 4a 6f  49 98 49 73  48 9b 48 72  J.KoK.JoI.IsH.Hr       383.1.48       
                         49 9c 49 6d  49 9e 49 71  49 99 49                  I.ImI.IqI.I            383.1.64       
  26.3     72576  ISOC   0c 8d 05 0a  f8 c9 a4 19  12 ca 39 01  6f 84 76 7a  ..........9.o.vz       384.1.0        
                         78 81 79 79  78 85 79 7a  79 85 7a 77  7b 86 7b 77  x.yyx.yzy.zw...w       384.1.16       
                         7b 85 7b 78  7b 84 7c 78  7b 85 7f 7a  7e 81 7e 79  ...x...x...z...y       384.1.32       
                         81 81 86 78  8d 81 a3 7b  9d 7d 93 7c  87 7d 57 7c  ...x..........W.       384.1.48       
                         a2 7e f0 80  fa 7f f1 7e  d4 7e a2                  ...........            384.1.64       
  26.3     79616  ISOC   0c 8c 54 21  13 ca f4 48  1f ca b9 01  52 9e 50 70  ..T!...H....R.Pp       385.1.0        
                         4e 9d 4d 73  4c 9b 4c 70  4c 9a 4b 6a  4b 99 4b 6e  N.MsL.LpL.KjK.Kn       385.1.16       
                         4b 99 4b 6e  4b 9b 4b 71  4b 9a 49 70  49 9a 4a 70  K.KnK.KqK.IpI.Jp       385.1.32       
                         4a 99 49 72  48 98 48 71  49 99 49 6c  49 97 48 71  J.IrH.HqI.IlI.Hq       385.1.48       
                         48 9b 4a 75  49 9c 48 73  48 99 49                  H.JuI.HsH.I            385.1.64       
  26.3     72554  ISOC   0c 8c 54 21  13 ca 5c 78  2c ca 39 02  19 80 1b 7c  ..T!..\x,.9.....       386.1.0        
                         22 80 26 7f  24 81 24 7e  24 81 23 7d  23 81 23 7f  ".&.$.$.$.#.#.#.       386.1.16       
                         21 7f 1f 7d  1f 7f 1a 7b  1a 81 1c 79  20 7d 23 77  !..........y .#w       386.1.32       
                         34 7d 47 7a  45 79 62 78  bc 78 f8 7f  e7 7e b5 80  4.GzEybx.x......       386.1.48       
                         72 73 2f 7a  69 77 8b 86  83 7a b4                  rs/ziw...z.            386.1.64       
  26.3     79638  ISOC   0c 8d a3 38  2e ca b0 a7  39 ca b9 02  e9 7f fb 7a  ...8....9......z       387.1.0        
                         cf 81 1b 80  6c 6c 70 92  70 70 6e 91  69 77 8b 82  ....llp.ppn.iw..       387.1.16       
                         a2 9b 51 9e  4f 72 4e 9c  4d 73 4d 9e  4c 73 4b 9e  ..Q.OrN.MsM.LsK.       387.1.32       
                         4a 70 4a 9c  49 71 4a 9b  4b 6e 4b 9a  4a 72 4a 9d  JpJ.IqJ.KnK.JrJ.       387.1.48       
                         4a 6f 4a 9d  4a 72 4a 9c  4a 6e 48                  JoJ.JrJ.JnH            387.1.64       
  26.3     72302  ISOC   0c 8d a3 38  2e ca 11 d7  46 ca 39 03  77 87 76 7c  ...8....F.9.w.v.       388.1.0        
                         75 86 75 7e  75 85 75 7b  75 85 76 79  76 82 78 7b  u.u.u.u.u.vyv.x.       388.1.16       
                         78 81 70 7c  67 80 86 80  c3 7e ed 81  f2 80 eb 81  x.p.g...........       388.1.32       
                         ee 7f f0 7d  f3 7e 60 7d  04 7d 58 7b  77 84 64 7c  ......`...X.w.d.       388.1.48       
                         44 81 45 78  38 82 2a 78  2d 7e 18                  D.Ex8.*x-..            388.1.64       
  26.3     79890  ISOC   0c 8c 4c 6a  49 ca 10 06  54 ca b9 03  a0 7e 97 80  ..LjI...T.......       389.1.0        
                         8e 7e 8c 81  8d 7d 93 81  a3 7b a9 82  a7 7e a4 81  ................       389.1.16       
                         a3 7c 9d 88  9c 73 a8 8a  a8 75 a5 89  a2 75 9d 8d  .....s...u...u..       389.1.32       
                         98 77 8d 8f  8a 71 81 90  7b 6c 7b 93  73 6b 70 96  .w...q...l..skp.       389.1.48       
                         69 74 47 88  7b 81 bc 7d  b7 8d 66                  itG.......f            389.1.64       
  26.3     72076  ISOC   0c 8c 4c 6a  49 ca cb 35  61 ca 39 04  d3 80 b8 7f  ..LjI..5a.9.....       390.1.0        
                         9b 7d 9f 80  8a 78 b6 81  de 7d ef 80  ec 7f d7 7e  .....x..........       390.1.16       
                         c0 7d bf 7d  b5 7e a3 7b  99 7f 9d 7b  a1 80 a1 80  ................       390.1.32       
                         a4 82 b3 80  cf 82 5e 7e  00 7f 1d 7a  26 81 27 7c  ......^....z&.'.       390.1.48       
                         28 81 29 7d  2e 81 32 7b  37 84 3f                  (.)...2.7.?            390.1.64       
  26.3     79946  ISOC   0c 8d d3 82  64 ca da 64  6e ca b9 04  43 9d 43 75  ....d..dn...C.Cu       391.1.0        
                         42 99 43 74  43 98 44 74  44 9c 44 73  43 9a 44 72  B.CtC.DtD.DsC.Dr       391.1.16       
                         44 9b 43 74  43 9b 42 73  41 98 42 70  42 97 42 6e  D.CtC.BsA.BpB.Bn       391.1.32       
                         41 96 40 70  41 95 41 6f  41 96 40 6f  40 95 40 73  A.@pA.AoA.@o@.@s       391.1.48       
                         3f 97 3f 74  3f 98 3e 74  3d 96 3d                  ?.?t?.>t=.=            391.1.64       
  26.3     72106  ISOC   0c 8d d3 82  64 ca 41 94  7b ca 39 05  34 86 2f 81  ....d.A...9.4./.       392.1.0        
                         32 83 34 82  37 7f 37 80  36 80 33 7f  2f 80 2d 81  2.4.7.7.6.3./.-.       392.1.16       
                         2d 7f 2d 81  2d 7f 2d 80  2f 7f 35 7f  39 80 38 7f  -.-.-.-./.5.9.8.       392.1.32       
                         37 80 37 80  34 7f 2f 80  2e 7f 2e 81  2c 80 28 80  7.7.4./.....,.(.       392.1.48       
                         25 7f 24 81  23 80 24 81  24 80 23                  %.$.#.$.$.#            392.1.64       
  26.3     79854  ISOC   0c 8c 4b b3  7f ca 99 c3  88 ca b9 05  4d 9d 4c 6f  ..K.........M.Lo       393.1.0        
                         4b 9a 4b 72  4c 9d 4d 73  4d 9b 4c 6e  4a 98 4a 71  K.KrL.MsM.LnJ.Jq       393.1.16       
                         4b 9e 4b 70  4b 9d 4a 71  4a 9b 4b 70  4a 9b 49 74  K.KpK.JqJ.KpJ.It       393.1.32       
                         48 9b 47 72  49 9c 49 74  4a 9e 4a 72  4b a0 49 75  H.GrI.ItJ.JrK.Iu       393.1.48       
                         4a 9d 4b 6f  4a 9a 4a 6f  49 9a 4a                  J.KoJ.JoI.J            393.1.64       
  26.3     72338  ISOC   0c 8c 4b b3  7f ca f5 f2  95 ca 39 06  53 7e 50 7c  ..K.......9.S.P.       394.1.0        
                         50 7f 4f 7b  4e 7c 4c 79  4c 7c 4c 79  4c 7f 4b 7c  P.O.N.LyL.LyL.K.       394.1.16       
                         4b 81 4b 7c  4a 80 42 7d  4c 7e 71 7e  5e 7d 4d 7d  K.K.J.B.L.q.^.M.       394.1.32       
                         48 7e 45 7f  46 81 45 7c  44 7f 43 7d  42 7d 40 7d  H.E.F.E.D.C.B.@.       394.1.48       
                         40 7f 40 7d  3f 7e 3e 7c  3e 7e 3e                  @.@.?.>.>.>            394.1.64       
  26.3     79624  ISOC   0c 8d 4f ca  9a ca 8c 22  a3 ca b9 06  40 92 3f 73  ..O...."....@.?s       395.1.0        
                         3e 96 3e 72  3e 94 3f 73  3e 95 3f 70  40 93 41 72  >.>r>.?s>.?p@.Ar       395.1.16       
                         41 97 42 71  44 96 41 72  41 98 40 6d  42 97 43 71  A.BqD.ArA.@mB.Cq       395.1.32       
                         44 99 44 73  45 96 43 71  44 99 47 73  45 9c 44 71  D.DsE.CqD.GsE.Dq       395.1.48       
                         45 9a 45 74  46 98 46 71  47 99 48                  E.EtF.FqG.H            395.1.64       
  26.3     72568  ISOC   0c 8d 4f ca  9a ca a9 51  b0 ca 39 07  a0 81 9b 7e  ..O....Q..9.....       396.1.0        
                         9c 81 9b 7f  97 7f 94 81  92 7f 90 80  8f 7e 8c 7f  ................       396.1.16       
                         8b 7d 8a 7f  8a 7e 89 7f  86 7e 83 7d  81 7d 80 7f  ................       396.1.32       
                         7e 7e 7d 80  86 7e 7a 7d  20 7d 14 7d  1d 80 1e 7e  ......z. .......       396.1.48       
                         0d 80 39 7a  63 7d 79 7e  7c 7d 7b                  ..9zc.y....            396.1.64       
  26.3     79616  ISOC   0c 8c 48 fc  b5 ca 4c 81  bd ca b9 07  5b 7b 58 7c  ..H...L.....[.X.       397.1.0        
                         59 79 57 7d  56 7c 56 81  57 79 57 7e  58 78 58 7b  YyW.V.V.WyW.XxX.       397.1.16       
                         59 7b 59 7c  5a 7b 59 80  57 7f 58 7f  58 7b 56 7f  Y.Y.Z.Y.W.X.X.V.       397.1.32       
                         57 79 59 7c  58 7a 59 7e  58 7d 59 7f  58 78 58 7f  WyY.XzY.X.Y.XxX.       397.1.48       
                         59 78 5a 7e  59 7a 58 7d  58 7a 5a                  YxZ.YzX.XzZ            397.1.64       
  26.3     72576  ISOC   0c 8c 48 fc  b5 ca ac b0  ca ca 39 00  57 9e 55 72  ..H.......9.W.Ur       398.1.0        
                         53 9e 53 6e  53 9c 52 6e  52 9c 51 70  50 9a 4e 6d  S.SnS.RnR.QpP.Nm       398.1.16       
                         4d 99 4c 6b  4c 97 4b 6f  4a 9a 4a 73  4a 97 49 70  M.LkL.KoJ.JsJ.Ip       398.1.32       
                         49 97 4a 71  49 97 49 74  46 97 48 72  47 97 43 77  I.JqI.ItF.HrG.Cw       398.1.48       
                         3c 90 25 7c  1b 80 1d 7e  1e 81 1c                  <.%........            398.1.64       
  26.3     79616  ISOC   0c 8d 4b 13  d1 ca 01 e0  d7 ca b9 00  87 7d 89 81  ..K.............       399.1.0        
                         87 7c 86 7f  88 7d 80 7e  7e 7d 79 80  78 7d 75 7e  ..........y.x.u.       399.1.16       
                         75 7d 76 7c  72 7c 70 7c  70 7e 6a 7a  6c 7b 6b 7d  u.v.r.p.p.jzl.k.       399.1.32       
                         6c 7a 69 81  67 7b 63 7c  5b 79 59 7b  5b 7a 57 7c  lzi.g.c.[yY.[zW.       399.1.48       
                         5c 79 58 7b  5e 79 61 80  60 78 5a                  \yX.^ya.`xZ            399.1.64       
  26.3     72576  ISOC   0c 8d 4b 13  d1 ca 62 0f  e5 ca 39 01  52 9e 51 74  ..K...b...9.R.Qt       400.1.0        
                         50 9e 4d 6d  4d 9d 4c 6e  4d 9e 4c 6f  4b 9d 4b 6f  P.MmM.LnM.LoK.Ko       400.1.16       
                         47 9b 47 71  46 9a 45 73  44 9a 45 6c  44 9a 44 6f  G.GqF.EsD.ElD.Do       400.1.32       
                         44 9a 45 70  47 9d 46 73  44 99 44 70  44 98 44 6f  D.EpG.FsD.DpD.Do       400.1.48       
                         42 97 45 72  2d 8d 1e 7d  1c 80 1c                  B.Er-......            400.1.64       
  26.3     79616  ISOC   0c 8c 41 45  ec ca bd 3e  f2 ca b9 01  41 82 2a 7b  ..AE...>....A.*.       401.1.0        
                         1e 81 21 7e  25 85 29 7a  2d 8f 31 75  31 95 30 76  ..!.%.)z-.1u1.0v       401.1.16       
                         2b 93 28 7a  23 8a 23 7b  25 8a 2d 77  31 92 30 75  +.(z#.#.%.-w1.0u       401.1.32       
                         34 95 38 76  49 99 53 79  4f 95 45 74  3d 99 3b 74  4.8vI.SyO.Et=.;t       401.1.48       
                         3b 9a 38 72  42 98 5f 7a  5a 88 5b                  ;.8rB._zZ.[            401.1.64       
  26.3     72480  ISOC   0c 8c 41 45  ec ca 19 6e  ff ca 39 02  53 9e 51 71  ..AE...n..9.S.Qq       402.1.0        
                         50 9e 4e 6f  4c 9d 4c 6e  4c 9b 4c 6f  4a 9d 48 6e  P.NoL.LnL.LoJ.Hn       402.1.16       
                         46 9c 45 6a  45 98 45 6e  43 9a 43 71  43 9c 44 70  F.EjE.EnC.CqC.Dp       402.1.32       
                         44 99 44 72  44 99 44 71  44 9c 44 71  44 9a 43 71  D.DrD.DqD.DqD.Cq       402.1.48       
                         43 97 42 73  42 96 3f 6f  38 90 21                  C.BsB.?o8.!            402.1.64       
  26.3     79712  ISOC   0c 8d 48 5c  07 cb 67 9d  0c cb b9 02  f4 80 f4 80  ..H\..g.........       403.1.0        
                         f4 80 f4 80  f4 80 f4 80  f4 80 f4 80  f4 80 f4 80  ................       403.1.16       
                         f4 80 f4 80  f4 80 f4 80  f2 7f f1 80  f1 7e f1 7f  ................       403.1.32       
                         f1 7f f1 80  f1 7f f1 80  f1 7e f1 7f  f2 7d f2 7f  ................       403.1.48       
                         f2 7d f2 7f  f2 7d f2 7f  f1 7c f1                  ...........            403.1.64       
  26.3     72234  ISOC   0c 8d 48 5c  07 cb cf cc  19 cb 39 03  54 9e 53 71  ..H\......9.T.Sq       404.1.0        
                         51 9e 50 72  50 9f 50 72  4e 9e 4d 71  4a 9c 49 70  Q.PrP.PrN.MqJ.Ip       404.1.16       
                         47 99 47 73  46 9a 45 75  46 98 46 73  45 97 44 73  G.GsF.EuF.FsE.Ds       404.1.32       
                         44 99 44 75  44 9e 44 72  44 9d 44 71  43 9b 43 6d  D.DuD.DrD.DqC.Cm       404.1.48       
                         43 9a 42 71  41 98 42 76  42 9b 42                  C.BqA.BvB.B            404.1.64       
  26.3     79958  ISOC   0c 8c 3e 8e  22 cb e0 fb  26 cb b9 03  79 49 7a 93  ..>."...&...yIz.       405.1.0        
                         7a 49 79 93  79 46 7b 92  7c 4b 7c 92  7d 4e 7b 94  zIy.yF...K...N..       405.1.16       
                         7c 4a 7b 94  7c 47 7e 91  7b 56 50 8b  b0 67 b7 82  .J...G...VP..g..       405.1.32       
                         80 72 dd 82  70 57 77 8a  56 6b bf 80  d0 7e f7 7e  .r..pWw.Vk......       405.1.48       
                         dd 71 54 83  5b 61 9b 87  a3 73 9b                  .qT.[a...s.            405.1.64       
  26.3     72004  ISOC   0c 8c 3e 8e  22 cb 86 2b  34 cb 39 04  52 9e 4f 70  ..>."..+4.9.R.Op       406.1.0        
                         4d 9e 4d 6e  4c 9e 4c 6e  4c 9b 4b 70  49 99 48 73  M.MnL.LnL.KpI.Hs       406.1.16       
                         47 9c 46 72  45 9b 46 6f  47 9c 47 75  45 9a 45 6e  G.FrE.FoG.GuE.En       406.1.32       
                         44 99 44 6d  46 99 47 70  48 97 47 77  45 96 43 72  D.DmF.GpH.GwE.Cr       406.1.48       
                         44 98 44 6e  43 99 43 73  42 98 41                  D.DnC.CsB.A            406.1.64       
  26.3     79940  ISOC   0c 8d 3e a5  3d cb 9b 5a  41 cb b9 04  63 87 64 7d  ..>.=..ZA...c.d.       407.1.0        
                         65 82 63 75  61 83 57 76  47 82 43 71  47 80 4a 79  e.cua.WvG.CqG.Jy       407.1.16       
                         4a 83 47 79  4b 80 4a 75  49 80 4e 75  50 83 4e 7a  J.GyK.JuI.NuP.Nz       407.1.32       
                         4e 83 4c 7a  3b 81 35 7a  40 84 43 78  3b 83 42 7d  N.Lz;.5z@.Cx;.B.       407.1.48       
                         6d 83 6c 7d  70 82 72 79  71 82 72                  m.l.p.ryq.r            407.1.64       
  26.3     72184  ISOC   0c 8d 3e a5  3d cb e9 89  4e cb 39 05  6b 7d 6f 82  ..>.=...N.9.k.o.       408.1.0        
                         72 7e 67 7f  5f 80 56 7f  4a 83 44 80  39 83 31 7d  r.g._.V.J.D.9.1.       408.1.16       
                         27 85 21 79  25 85 2c 7c  33 81 3d 81  48 81 51 81  '.!y%.,.3.=.H.Q.       408.1.32       
                         5b 7f 63 87  70 7d 70 82  70 7f 63 81  59 83 4b 7f  [.c.p.p.p.c.Y.K.       408.1.48       
                         48 84 44 7f  38 83 31 7c  2d 87 33                  H.D.8.1.-.3            408.1.64       
  26.3     79782  ISOC   0c 8c 3c d7  58 cb 9a b9  5b cb b9 05  6d 84 6c 7b  ..<.X...[...m.l.       409.1.0        
                         6e 86 6f 7c  6f 83 70 79  70 82 6e 78  6c 82 6a 7b  n.o.o.pyp.nxl.j.       409.1.16       
                         69 81 69 7a  69 82 68 7a  69 82 68 7c  68 81 69 7c  i.izi.hzi.h.h.i.       409.1.32       
                         69 81 69 7d  68 81 68 78  68 82 68 7c  68 82 69 7a  i.i.h.hxh.h.h.iz       409.1.48       
                         69 81 69 79  69 81 6a 7c  6a 84 6a                  i.iyi.j.j.j            409.1.64       
  26.3     72410  ISOC   0c 8c 3c d7  58 cb b6 e8  68 cb 39 06  1c 7e 19 80  ..<.X...h.9.....       410.1.0        
                         19 7f 17 81  18 7d 18 80  18 7e 18 81  1c 7f 1b 81  ................       410.1.16       
                         1b 7e 19 80  1a 7e 1a 80  1b 7e 1b 80  1a 7c 19 80  ................       410.1.32       
                         18 7c 19 80  19 7e 1a 81  1b 7f 1b 81  1b 7e 1c 80  ................       410.1.48       
                         26 7c 2c 85  34 77 32 8d  32 75 2d                  &.,.4w2.2u-            410.1.64       
  26.3     79616  ISOC   0c 8d 3d ee  73 cb 54 18  76 cb b9 06  6b 81 6b 7c  ..=.s.T.v...k.k.       411.1.0        
                         6b 84 6b 7a  6b 82 6b 7a  6b 82 6a 7c  6a 82 69 79  k.kzk.kzk.j.j.iy       411.1.16       
                         6a 82 6a 7b  6a 84 69 75  68 84 68 76  69 82 67 76  j.j.j.iuh.hvi.gv       411.1.32       
                         67 82 68 79  69 82 69 7a  69 84 69 78  68 83 69 7a  g.hyi.izi.ixh.iz       411.1.48       
                         6a 81 69 7a  69 82 6a 7a  6a 83 6a                  j.izi.jzj.j            411.1.64       
  26.3     72576  ISOC   0c 8d 3d ee  73 cb 6c 47  83 cb 39 07  53 9e 52 71  ..=.s.lG..9.S.Rq       412.1.0        
                         50 9e 4f 6e  4e 9e 4d 6e  4d 9e 4c 71  4c 9e 4c 70  P.OnN.MnM.LqL.Lp       412.1.16       
                         4b 9d 49 71  49 9d 49 72  49 9e 49 73  49 9e 4a 76  K.IqI.IrI.IsI.Jv       412.1.32       
                         49 9e 48 74  48 9a 49 71  4a 97 4a 72  47 99 47 6f  I.HtH.IqJ.JrG.Go       412.1.48       
                         47 9d 47 70  47 9c 45 6f  45 98 47                  G.GpG.EoE.G            412.1.64       
  26.3     79616  ISOC   0c 8c 3e 20  8f cb 0f 77  90 cb b9 07  6e 82 6e 7b  ..> ...w....n.n.       413.1.0        
                         6e 82 6e 7a  6f 81 6f 7a  6e 80 6d 7a  6d 7f 6d 79  n.nzo.ozn.mzm.my       413.1.16       
                         6c 81 6b 78  6c 81 6c 7a  6c 82 6c 7a  6e 81 6c 79  l.kxl.lzl.lzn.ly       413.1.32       
                         6b 82 6b 7c  6c 82 6d 79  6d 82 6e 7e  6f 82 6f 7e  k.k.l.mym.n.o.o.       413.1.48       
                         6f 82 6e 7b  6f 83 70 7c  70 82 70                  o.n.o.p.p.p            413.1.64       
  26.3     75776  ISOC   0c 8c 3e 20  8f cb 67 a6  9d cb 39 00  54 9e 51 6e  ..> ..g...9.T.Qn       414.1.0        
                         51 9e 50 73  50 9e 4e 72  4c 9b 4b 71  4a 9c 4a 72  Q.PsP.NrL.KqJ.Jr       414.1.16       
                         4a 9d 4b 70  4a 9a 49 6f  49 97 49 6f  4a 98 4a 71  J.KpJ.IoI.IoJ.Jq       414.1.32       
                         49 98 49 6f  49 96 49 6d  49 95 48 70  48 97 48 6d  I.IoI.ImI.HpH.Hm       414.1.48       
                         47 98 47 6f  45 9a 46 70  47 97 48                  G.GoE.FpG.H            414.1.64       
  26.3     76416  ISOC   0c 8d 73 37  aa cb 7e d3  aa cb b9 00  63 87 64 7d  ..s7........c.d.       415.1.0        
                         65 82 63 75  61 83 57 76  47 82 43 71  47 80 4a 79  e.cua.WvG.CqG.Jy       415.1.16       
                         4a 83 47 79  4b 80 4a 75  49 80 4e 75  50 83 4e 7a  J.GyK.JuI.NuP.Nz       415.1.32       
                         4e 83 4c 7a  3b 81 35 7a  40 84 43 78  3b 83 42 7d  N.Lz;.5z@.Cx;.B.       415.1.48       
                         6d 83 6c 7d  70 82 72 79  71 82 72                  m.l.p.ryq.r            415.1.64       
  26.3     79616  ISOC   0c 8d 73 37  aa cb 1d 05  b8 cb 39 01  53 9a 51 6b  ..s7......9.S.Qk       416.1.0        
                         50 9c 50 70  4e 9d 4d 70  4b 9c 4b 6d  4a 98 4a 6f  P.PpN.MpK.KmJ.Jo       416.1.16       
                         4a 9a 49 72  49 9a 4a 6f  49 9b 49 6b  4a 9e 4b 6f  J.IrI.JoI.IkJ.Ko       416.1.32       
                         49 9a 4a 70  4a 9a 48 6f  48 99 48 73  49 9c 49 75  I.JpJ.HoH.HsI.Iu       416.1.48       
                         49 9c 49 71  48 97 47 72  48 99 48                  I.IqH.GrH.H            416.1.64       
  26.3     72576  ISOC   0c 8d 73 37  aa cb 7d 34  c5 cb b9 01  d3 7f db 7f  ..s7...4........       417.1.0        
                         ce 80 9c 7b  66 87 46 72  5b 87 69 7b  6e 85 6d 7e  ....f.Fr[.i.n.m.       417.1.16       
                         70 83 74 7a  71 84 72 7b  73 83 74 7a  77 83 78 78  p.tzq.r.s.tzw.xx       417.1.32       
                         78 84 79 7e  7a 87 7a 7a  7c 87 7c 79  7c 87 7e 7b  x.y.z.zz...y....       417.1.48       
                         7f 86 7f 7d  80 83 79 78  5e 7f a0                  ......yx^..            417.1.64       
  26.3     79616  ISOC   0c 8c 38 69  c5 cb d5 63  d2 cb 39 02  53 9e 50 6f  ..8i...c..9.S.Po       418.1.0        
                         4e 9e 50 70  4e 9e 4c 70  4d 9d 4c 70  4b 9a 4a 70  N.PpN.LpM.LpK.Jp       418.1.16       
                         4b 99 4b 71  4b 9d 4a 75  4a 9e 4a 6f  4a 9a 4b 70  K.KqK.JuJ.JoJ.Kp       418.1.32       
                         4a 98 49 71  48 99 49 6f  48 98 49 73  4a 9c 4a 71  J.IqH.IoH.IsJ.Jq       418.1.48       
                         49 97 49 73  48 97 48 6e  48 98 4a                  I.IsH.HnH.J            418.1.64       
  26.3     72576  ISOC   0c 8c 38 69  c5 cb 39 93  df cb b9 02  93 7d 7c 78  ..8i..9........x       419.1.0        
                         73 81 76 7b  77 83 78 7c  79 87 7a 7b  7b 86 7b 78  s.v.w.x.y.z....x       419.1.16       
                         7b 86 7c 7a  7b 84 7c 79  7c 82 7b 79  7b 83 78 79  ...z...y...y..xy       419.1.32       
                         77 82 83 73  87 80 92 7a  96 7d 90 7e  8c 7f 6a 7a  w..s...z......jz       419.1.48       
                         64 7f c4 80  f8 7f f8 80  e8 7e cb                  d..........            419.1.64       
  26.3     79616  ISOC   0c 8d 87 80  e0 cb 89 c2  ec cb 39 03  51 9c 50 70  ..........9.Q.Pp       420.1.0        
                         4e 9d 4d 73  4b 9d 4a 6f  49 9a 49 70  49 9b 49 71  N.MsK.JoI.IpI.Iq       420.1.16       
                         4a 9b 4a 72  4b 9d 4b 6f  4a 9d 49 71  4a 9c 4b 71  J.JrK.KoJ.IqJ.Kq       420.1.32       
                         4a 9b 4a 6f  4a 9b 4a 70  49 97 49 74  48 9a 48 70  J.JoJ.JpI.ItH.Hp       420.1.48       
                         48 9b 49 6e  49 9e 49 6e  48 9b 45                  H.InI.InH.E            420.1.64       
  26.3     72508  ISOC   0c 8d 87 80  e0 cb ee f1  f9 cb b9 03  23 81 23 7e  ............#.#.       421.1.0        
                         23 81 24 7f  23 81 22 7e  23 7f 23 7e  1f 7f 19 7b  #.$.#.".#.#.....       421.1.16       
                         16 7f 1a 7c  2c 7f 40 7c  49 7f 51 7a  5c 7c 69 7e  ....,.@.I.Qz\.i.       421.1.32       
                         7b 7b 86 81  73 7a 78 7d  ce 7c f8 80  f9 7e e0 7c  ....szx.........       421.1.48       
                         a9 78 62 7b  2c 76 45 7b  56 74 6e                  .xb.,vE.Vtn            421.1.64       
  26.3     79684  ISOC   0c 8c da 97  fb cb 47 21  07 cc 39 04  78 97 74 6d  ......G!..9.x.tm       422.1.0        
                         7f 8f a8 7a  b5 80 95 79  7d 81 69 6e  5a 87 6a 6d  ...z...y..inZ.jm       422.1.16       
                         75 85 56 69  68 8f 69 6c  68 92 68 70  6a 93 67 72  u.Vih.ilh.hpj.gr       422.1.32       
                         88 85 91 7c  87 78 6e 76  98 78 b1 79  b0 7d 6e 74  .....xnv.x.y..nt       422.1.48       
                         58 7f 6f 71  71 8f 6f 70  6f 92 6e                  X.oqq.opo.n            422.1.64       
  26.3     72258  ISOC   0c 8c da 97  fb cb a7 50  14 cc b9 04  74 82 73 7b  .......P....t.s.       423.1.0        
                         73 83 74 7c  75 83 75 7f  75 84 75 79  75 81 76 79  s.t.u.u.u.uyu.vy       423.1.16       
                         7d 82 86 7d  7e 80 62 7e  6a 7d b8 83  f2 7d f3 7d  ......b.j.......       423.1.32       
                         c1 7d 6f 7c  2e 80 0d 7f  1e 80 1d 7a  19 82 20 78  ..o........z.. x       423.1.48       
                         25 81 26 7c  27 81 2a 7c  2f 7f 1c                  %.&.'.*./..            423.1.64       
  26.3     79934  ISOC   0c 8d 83 c9  16 cc af 7f  21 cc 39 05  e6 7f e4 7f  ........!.9.....       424.1.0        
                         e2 7f df 80  d7 7f cb 80  c2 7e ba 80  b3 7e aa 80  ................       424.1.16       
                         a0 7d 99 80  91 7d 8b 80  89 7d 94 82  91 7a 9f 80  .............z..       424.1.32       
                         a7 80 a8 7f  a6 7e a3 82  9b 75 9d 8e  a3 6f a3 8b  .........u...o..       424.1.48       
                         a4 74 a2 8b  99 77 92 93  8d 70 89                  .t...w...p.            424.1.64       
  26.3     72030  ISOC   0c 8d 83 c9  16 cc 63 af  2e cc b9 05  d0 80 d2 81  ......c.........       425.1.0        
                         bc 7e 4f 80  16 7c 65 82  a7 7e cf 81  ea 7f f0 7f  ..O...e.........       425.1.16       
                         e7 7f d8 7f  cb 7b b5 7b  a6 7e a0 7b  a1 81 a6 7b  ................       425.1.32       
                         b3 81 cf 83  66 81 00 7d  1e 80 2a 7a  29 81 29 7a  ....f.....*z).)z       425.1.48       
                         2b 81 2c 7b  2f 82 32 7b  35 81 3b                  +.,./.2.5.;            425.1.64       
  26.3     79942  ISOC   0c 8c b0 e0  31 cc 71 de  3b cc 39 06  45 6d 45 99  ....1.q.;.9.EmE.       426.1.0        
                         47 72 47 97  47 72 46 99  46 76 48 9d  48 74 46 98  GrG.GrF.FvH.HtF.       426.1.16       
                         44 70 45 98  44 73 44 9b  44 70 44 98  44 70 44 98  DpE.DsD.DpD.DpD.       426.1.32       
                         45 6f 46 97  47 77 46 9a  44 76 43 9a  43 72 43 97  EoF.GwF.DvC.CrC.       426.1.48       
                         43 74 43 9b  44 71 44 98  45 71 44                  CtC.DqD.EqD            426.1.64       
  26.3     72156  ISOC   0c 8c b0 e0  31 cc cd 0d  49 cc b9 06  36 7c 48 7f  ....1...I...6.H.       427.1.0        
                         38 7b 1c 80  4b 7c 30 7c  a7 7a ff 87  e4 7a 1c 7f  8...K.0..z...z..       427.1.16       
                         39 7a 66 82  2b 79 12 7f  1d 7e 1d 7e  1d 7f 1d 7f  9zf.+y..........       427.1.32       
                         1e 7e 21 7e  20 7e 27 7e  2d 7f 2f 7e  30 81 30 7f  ..!. .'.-./.0.0.       427.1.48       
                         2f 81 2d 7c  30 80 32 80  35 81 33                  /.-.0.2.5.3            427.1.64       
  26.3     79808  ISOC   0c 8d 84 12  4d cc 59 3d  56 cc 39 07  4d 9a 4c 71  ....M.Y=V.9.M.Lq       428.1.0        
                         4b 9c 4b 74  4b 9d 4b 73  4b 9a 4b 6e  4b 9a 4a 6e  K.KtK.KsK.KnK.Jn       428.1.16       
                         4b 98 4b 70  4a 9c 49 72  49 9d 4a 70  4b 9b 4b 71  K.KpJ.IrI.JpK.Kq       428.1.32       
                         4b 9b 4b 6f  4b 9c 4a 71  4a 9c 4c 74  4b 9c 4a 70  K.KoK.JqJ.LtK.Jp       428.1.48       
                         4a 9a 49 71  49 9e 49 6f  4a 98 4a                  J.IqI.IoJ.J            428.1.64       
  26.3     72384  ISOC   0c 8d 84 12  4d cc 8a 6c  63 cc b9 07  71 7f 6e 81  ....M..lc...q.n.       429.1.0        
                         6a 7d 67 7f  65 7a 64 7e  62 7c 60 82  63 7d 64 83  j.g.ezd.b.`.c.d.       429.1.16       
                         63 7c 60 7f  61 7d 60 84  5f 7e 5b 80  58 7c 55 7f  c.`.a.`._.[.X.U.       429.1.32       
                         56 7a 55 80  54 7b 53 82  51 7d 50 7e  50 7c 4f 80  VzU.T.S.Q.P.P.O.       429.1.48       
                         4f 7b 4d 80  4d 7c 4d 81  4c 7d 4c                  O.M.M.M.L.L            429.1.64       
  26.3     79616  ISOC   0c 8c 87 29  68 cc 24 9c  70 cc 39 00  45 94 42 73  ...)h.$.p.9.E.Bs       430.1.0        
                         43 96 44 79  44 9a 45 72  43 99 46 71  46 94 48 71  C.DyD.ErC.FqF.Hq       430.1.16       
                         45 94 45 6f  46 95 48 72  48 99 49 71  48 98 49 70  E.EoF.HrH.IqH.Ip       430.1.32       
                         48 98 47 6e  46 98 45 6e  47 99 49 73  49 9d 48 6f  H.GnF.EnG.IsI.Ho       430.1.48       
                         47 9a 47 73  49 98 4a 73  49 97 47                  G.GsI.JsI.G            430.1.64       
  26.3     72576  ISOC   0c 8c 87 29  68 cc 3f cb  7d cc b9 00  99 7f 9a 80  ...)h.?.........       431.1.0        
                         98 81 97 7e  97 7f 97 7b  95 7d 92 7c  8f 7e 90 7c  ................       431.1.16       
                         8e 7d 8d 7f  8d 7d 8b 7e  89 7f 89 7e  88 81 87 7f  ................       431.1.32       
                         85 7e 83 7e  80 7e 7c 7b  7d 7e 90 84  73 7f 22 7c  ............s.".       431.1.48       
                         14 7d 1b 7c  1d 80 1d 7c  12 7f 3e                  ..........>            431.1.64       
  26.3     79616  ISOC   0c 8d 7e 5b  83 cc e1 fa  8a cc 39 01  5b 7d 59 78  ...[......9.[.Yx       432.1.0        
                         5a 7c 5a 78  58 7a 59 7f  5a 79 5a 7e  5b 7c 59 7b  Z.ZxXzY.ZyZ.[.Y.       432.1.16       
                         57 7c 57 7b  58 79 59 79  57 7c 57 7f  58 7c 57 7d  W.W.XyYyW.W.X.W.       432.1.32       
                         59 7d 59 7e  57 7d 58 7d  58 79 58 79  59 78 58 7c  Y.Y.W.X.XyXyYxX.       432.1.48       
                         58 7c 58 7d  59 7b 5a 7f  5a 78 5a                  X.X.Y.Z.ZxZ            432.1.64       
  26.3     72576  ISOC   0c 8d 7e 5b  83 cc 40 2a  98 cc b9 01  58 9d 56 77  ...[..@*....X.Vw       433.1.0        
                         56 9d 55 72  54 9e 53 72  52 9e 51 72  51 9d 4f 6c  V.UrT.SrR.QrQ.Ol       433.1.16       
                         4d 9c 4c 74  4a 9d 49 75  48 98 49 76  46 99 3e 72  M.LtJ.IuH.IvF.>r       433.1.32       
                         3b 95 3d 72  40 95 3b 74  39 93 36 6f  3f 90 4e 74  ;.=r@.;t9.6o?.Nt       433.1.48       
                         3d 8a 19 7c  1e 80 1d 7e  1a 80 25                  =.........%            433.1.64       
  26.3     79616  ISOC   0c 8c 87 72  9e cc 97 59  a5 cc 39 02  6f 7e 71 7f  ...r...Y..9.o.q.       434.1.0        
                         6f 7c 6b 7e  66 7c 65 7f  69 7b 64 7d  61 7a 5d 78  o.k.f.e.i.d.az]x       434.1.16       
                         5f 7a 60 7b  60 78 5a 7a  57 77 5c 7e  63 7d 5b 7c  _z`.`xZzWw\.c.[.       434.1.32       
                         5a 7d 5a 7e  5b 79 58 80  5e 78 5e 81  5f 78 5e 7e  Z.Z.[yX.^x^._x^.       434.1.48       
                         5f 7a 60 7e  60 79 61 81  60 7c 5c                  _z`.`ya.`.\            434.1.64       
  26.3     72576  ISOC   0c 8c 87 72  9e cc f9 88  b2 cc b9 02  52 9f 50 71  ...r........R.Pq       435.1.0        
                         4f 9e 4e 6f  4e 9c 4e 6d  4c 9a 4c 6d  4b 9a 4a 6e  O.NoN.NmL.LmK.Jn       435.1.16       
                         49 9b 48 6f  46 9c 46 6d  46 9a 45 6e  45 9a 45 71  I.HoF.FmF.EnE.Eq       435.1.32       
                         44 9a 44 70  45 9b 45 6b  44 98 44 72  44 99 43 75  D.DpE.EkD.DrD.Cu       435.1.48       
                         42 96 43 75  25 8a 1e 7d  1c 80 1c                  B.Cu%......            435.1.64       
  26.3     79616  ISOC   0c 8d 7b a4  b9 cc 52 b8  bf cc 39 03  43 85 3c 77  ......R...9.C.<w       436.1.0        
                         1c 80 21 7c  25 88 2a 7a  2d 91 2e 75  2d 92 2d 76  ..!.%.*z-..u-.-v       436.1.16       
                         2a 8f 25 7a  28 8c 2b 77  40 8f 5a 79  46 8f 35 74  *.%z(.+w@.ZyF.5t       436.1.32       
                         31 93 2b 75  25 8f 28 78  2c 8c 36 78  39 8c 33 78  1.+u%.(x,.6x9.3x       436.1.48       
                         31 8f 31 77  2a 8f 48 7b  5f 8b 5c                  1.1w*.H._.\            436.1.64       
  26.3     72422  ISOC   0c 8d 7b a4  b9 cc ae e7  cc cc b9 03  53 9f 52 70  ............S.Rp       437.1.0        
                         50 9f 4d 70  4c 9e 4c 71  4a 9e 49 72  48 9d 48 72  P.MpL.LqJ.IrH.Hr       437.1.16       
                         46 9c 44 70  44 9a 44 70  44 9a 44 6d  44 9b 44 71  F.DpD.DpD.DmD.Dq       437.1.32       
                         45 9c 46 75  45 99 44 72  43 9a 43 73  44 9b 43 74  E.FuE.DrC.CsD.Ct       437.1.48       
                         43 99 43 6c  41 97 3d 72  2b 8e 22                  C.ClA.=r+."            437.1.64       
  26.3     79770  ISOC   0c 8c 83 bb  d4 cc d2 16  da cc 39 04  f4 7f f3 7f  ..........9.....       438.1.0        
                         ed 80 ec 7c  ed 7f eb 7d  eb 81 f3 7b  f4 7f f4 80  ................       438.1.16       
                         f4 80 f4 80  f4 80 f4 80  f4 80 f4 80  f4 80 f4 80  ................       438.1.32       
                         f4 80 f4 80  f4 80 f4 80  f4 80 f4 80  f4 80 f4 80  ................       438.1.48       
                         f4 80 f4 80  f4 80 f4 80  f4 80 f4                  ...........            438.1.64       
  26.3     72188  ISOC   0c 8c 83 bb  d4 cc 65 46  e7 cc b9 04  54 9e 52 70  ......eF....T.Rp       439.1.0        
                         51 9e 50 74  50 9f 4e 6e  4b 9a 4a 6e  48 9e 49 72  Q.PtP.NnK.JnH.Ir       439.1.16       
                         48 9b 46 71  45 9b 45 71  45 9d 44 70  44 9a 44 72  H.FqE.EqE.DpD.Dr       439.1.32       
                         44 9b 44 71  45 9c 44 70  44 9a 44 6d  44 98 44 70  D.DqE.DpD.DmD.Dp       439.1.48       
                         43 97 43 70  42 9a 41 72  41 98 42                  C.CpB.ArA.B            439.1.64       
  26.3     79960  ISOC   0c 8d 7a ed  ef cc 7b 75  f4 cc 39 05  15 83 ef 80  ..z....u..9.....       440.1.0        
                         a5 7e 03 77  83 83 6a 51  74 92 73 48  73 94 75 46  ...w..jQt.sHs.uF       440.1.16       
                         75 95 79 45  75 91 74 45  75 92 74 47  74 92 75 47  u.yEu.tEu.tGt.uG       440.1.32       
                         76 94 76 46  76 93 77 45  77 91 7a 4b  7a 90 79 4a  v.vFv.wEw.zKz.yJ       440.1.48       
                         79 92 7b 4a  7f 92 7f 50  7e 92 7c                  y..J...P...            440.1.64       
  26.3     72002  ISOC   0c 8d 7a ed  ef cc 1d a5  01 cd b9 05  18 81 18 7f  ..z.............       441.1.0        
                         19 80 19 7f  19 80 1b 7f  1d 7e 21 7e  25 7e 27 7e  ..........!.%.'.       441.1.16       
                         29 80 2c 7a  43 80 55 7a  4e 81 4a 7c  43 80 36 7d  ).,zC.UzN.J.C.6.       441.1.32       
                         2b 82 21 7f  1f 80 1e 7f  52 9e 50 6f  4f a0 4e 70  +.!.....R.PoO.Np       441.1.48       
                         4e 9e 4e 72  4c 9f 4c 72  4b 9d 48                  N.NrL.LrK.H            441.1.64       
  26.3     79938  ISOC   0c 8c 6f 04  0b cd 30 d4  0e cd 39 06  a9 6a 37 7e  ..o...0...9..j7.       442.1.0        
                         3e 7b 60 83  5f 79 5e 82  5b 7a 5b 85  5c 79 5d 83  >.`._y^.[z[.\y].       442.1.16       
                         5d 7d 5d 87  5c 78 5d 87  5c 77 5b 85  5c 7d 5d 86  ].].\x].\w[.\.].       442.1.32       
                         5c 7b 5d 83  5d 7a 5e 87  5e 78 5d 84  5c 78 5f 85  \.].]z^.^x].\x_.       442.1.48       
                         5e 7c 4f 84  4b 7c 4d 80  48 7a 3f                  ^.O.K.M.Hz?            442.1.64       
  26.3     72232  ISOC   0c 8c 6f 04  0b cd 7e 03  1c cd b9 06  4a 81 43 7e  ..o.........J.C.       443.1.0        
                         3d 82 35 7f  2c 82 23 7b  1c 83 1e 7d  2a 82 38 7c  =.5.,.#.....*.8.       443.1.16       
                         46 7f 4d 7f  55 81 5e 84  61 7f 6c 82  69 7f 61 80  F.M.U.^.a.l.i.a.       443.1.32       
                         5f 81 51 80  46 81 40 7d  34 82 30 7f  25 84 20 7a  _.Q.F.@.4.0.%. z       443.1.48       
                         20 83 2a 7c  31 82 42 7e  4c 7f 57                   .*.1.B.L.W            443.1.64       
  26.3     79736  ISOC   0c 8d 75 36  26 cd 32 33  29 cd 39 07  6e 82 6d 7c  ..u6&.23).9.n.m.       444.1.0        
                         6e 82 6f 7a  71 83 72 7a  72 82 71 7a  6d 82 6c 7c  n.ozq.rzr.qzm.l.       444.1.16       
                         6a 83 69 7a  68 82 67 7c  66 82 66 7a  67 82 67 7a  j.izh.g.f.fzg.gz       444.1.32       
                         67 82 66 73  66 81 65 74  66 82 67 7a  69 82 69 7a  g.fsf.etf.gzi.iz       444.1.48       
                         68 82 68 7b  69 84 69 7d  69 84 6a                  h.h.i.i.i.j            444.1.64       
  26.3     72456  ISOC   0c 8d 75 36  26 cd 48 62  36 cd b9 07  25 88 20 7c  ..u6&.Hb6...%. .       445.1.0        
                         1b 81 1e 7f  1d 7f 1c 7d  1c 7f 1c 7d  1c 80 1c 7d  ................       445.1.16       
                         1c 80 1c 7d  19 7f 1c 7f  1a 80 18 7e  17 80 14 7e  ................       445.1.32       
                         14 80 14 7e  18 80 1d 7c  1e 83 1f 7c  1f 82 20 7c  .............. .       445.1.48       
                         21 84 21 7e  23 84 28 7a  27 84 21                  !.!.#.(z'.!            445.1.64       
  26.3     79616  ISOC   0c 8c 7a 4d  41 cd e9 91  43 cd 39 00  6b 82 6a 7c  ..zMA...C.9.k.j.       446.1.0        
                         6a 82 6a 79  6a 82 6a 7d  69 82 69 79  69 84 69 7c  j.jyj.j.i.iyi.i.       446.1.16       
                         6a 85 69 7a  68 82 67 7a  68 82 69 7a  69 82 67 76  j.izh.gzh.izi.gv       446.1.32       
                         67 82 68 78  68 82 69 7d  69 81 68 79  68 82 68 7a  g.hxh.i.i.hyh.hz       446.1.48       
                         69 81 67 72  67 82 69 7a  6b 82 6b                  i.grg.izk.k            446.1.64       
  26.3     72576  ISOC   0c 8c 7a 4d  41 cd 19 c1  50 cd b9 00  54 9e 52 71  ..zMA...P...T.Rq       447.1.0        
                         52 9e 51 73  50 9b 4d 70  4b 9c 4b 71  4b 9b 4a 72  R.QsP.MpK.KqK.Jr       447.1.16       
                         49 9d 49 70  4a 9c 4a 71  4a 9b 4a 71  49 9b 48 72  I.IpJ.JqJ.JqI.Hr       447.1.32       
                         48 99 47 70  49 9c 49 6f  48 9d 47 70  47 98 48 73  H.GpI.IoH.GpG.Hs       447.1.48       
                         47 9b 45 72  45 9a 46 74  46 97 45                  G.ErE.FtF.E            447.1.64       
  26.3     79616  ISOC   0c 8d 73 7f  5c cd a3 f0  5d cd 39 01  70 81 6f 7f  ..s.\...].9.p.o.       448.1.0        
                         6e 81 6e 7e  6c 82 6c 7a  6d 85 6e 7c  6e 83 6e 7a  n.n.l.lzm.n.n.nz       448.1.16       
                         6d 82 6d 7a  6d 82 6d 78  6d 81 6d 7a  6d 81 6c 79  m.mzm.mxm.mzm.ly       448.1.32       
                         6d 82 6e 7d  6c 82 6d 7d  6d 82 6e 7d  6f 82 6d 7a  m.n.l.m.m.n.o.mz       448.1.48       
                         6b 81 6e 79  6c 80 6b 7a  6d 80 6f                  k.nyl.kzm.o            448.1.64       
  26.3     75136  ISOC   0c 8d 73 7f  5c cd 04 20  6b cd b9 01  53 9e 52 72  ..s.\.. k...S.Rr       449.1.0        
                         51 9e 4f 6f  4f 9d 4d 6e  4d 9b 4c 73  4b 9e 4b 71  Q.OoO.MnM.LsK.Kq       449.1.16       
                         4a 9a 4a 6f  4a 9a 4a 72  49 99 49 6f  49 98 48 6f  J.JoJ.JrI.IoI.Ho       449.1.32       
                         48 99 48 70  4a 99 4a 74  4a 9c 49 74  48 9a 48 73  H.HpJ.JtJ.ItH.Hs       449.1.48       
                         48 9b 49 6e  49 98 48 72  47 99 46                  H.InI.HrG.F            449.1.64       
  26.3     77056  ISOC   0c 8c bf 96  77 cd 14 4d  78 cd 39 02  a9 6a 37 7e  ....w..Mx.9..j7.       450.1.0        
                         3e 7b 60 83  5f 79 5e 82  5b 7a 5b 85  5c 79 5d 83  >.`._y^.[z[.\y].       450.1.16       
                         5d 7d 5d 87  5c 78 5d 87  5c 77 5b 85  5c 7d 5d 86  ].].\x].\w[.\.].       450.1.32       
                         5c 7b 5d 83  5d 7a 5e 87  5e 78 5d 84  5c 78 5f 85  \.].]z^.^x].\x_.       450.1.48       
                         5e 7c 4f 84  4b 7c 4d 80  48 7a 3f                  ^.O.K.M.Hz?            450.1.64       
  26.3     79616  ISOC   0c 8c bf 96  77 cd b5 7e  85 cd b9 02  52 9f 50 6f  ....w.......R.Po       451.1.0        
                         50 9d 50 6e  4e 9d 4d 71  4c 9d 4b 70  49 99 48 6e  P.PnN.MqL.KpI.Hn       451.1.16       
                         49 97 48 6f  4a 97 4a 6f  49 97 48 70  49 97 49 71  I.HoJ.JoI.HpI.Iq       451.1.32       
                         4a 9b 4a 77  49 9d 4a 74  49 98 49 70  49 98 49 6f  J.JwI.JtI.IpI.Io       451.1.48       
                         49 97 49 6f  49 96 48 73  48 96 48                  I.IoI.HsH.H            451.1.64       
  26.3     72576  ISOC   0c 8d 14 ae  92 cd 31 ae  92 cd 39 03  6e 82 6d 7c  ......1...9.n.m.       452.1.0        
                         6e 82 6f 7a  71 83 72 7a  72 82 71 7a  6d 82 6c 7c  n.ozq.rzr.qzm.l.       452.1.16       
                         6a 83 69 7a  68 82 67 7c  66 82 66 7a  67 82 67 7a  j.izh.g.f.fzg.gz       452.1.32       
                         67 82 66 73  66 81 65 74  66 82 67 7a  69 82 69 7a  g.fsf.etf.gzi.iz       452.1.48       
                         68 82 68 7b  69 84 69 7d  69 84 6a                  h.h.i.i.i.j            452.1.64       
  26.3     79616  ISOC   0c 8d 14 ae  92 cd 6c dd  9f cd b9 03  52 9d 51 72  ......l.....R.Qr       453.1.0        
                         4f 9e 4e 6f  4d 9e 4c 70  4c 9e 4c 70  4c 9c 4b 70  O.NoM.LpL.LpL.Kp       453.1.16       
                         4b 9a 4b 6f  4b 9b 4a 6e  49 9a 4a 74  4a 9d 49 71  K.KoK.JnI.JtJ.Iq       453.1.32       
                         49 97 48 72  48 9a 47 6e  49 9b 4a 6f  49 98 49 70  I.HrH.GnI.JoI.Ip       453.1.48       
                         49 97 47 70  47 9a 49 71  49 9a 48                  I.GpG.IqI.H            453.1.64       
  26.3     72576  ISOC   0c 8d 14 ae  92 cd ce 0c  ad cd 39 04  a4 7f 92 77  ..........9....w       454.1.0        
                         72 7e 70 77  79 83 78 78  79 85 7b 79  7b 87 7b 7e  r.pwy.xxy..y....       454.1.16       
                         7a 87 7b 7c  7c 85 7b 7b  7b 86 7c 7c  7c 85 7d 7a  z..............z       454.1.32       
                         7e 83 81 78  85 84 8c 7a  8b 80 8e 7c  87 80 83 79  ...x...z.......y       454.1.48       
                         60 80 88 7d  da 7e fb 80  f5 7f dc                  `..........            454.1.64       
  26.3     79616  ISOC   0c 8c c1 df  ad cd 27 3c  ba cd b9 04  50 9e 4e 70  ......'<....P.Np       455.1.0        
                         4d 9e 4c 72  4c 9e 4d 73  4c 9d 4b 74  49 9d 49 70  M.LrL.MsL.KtI.Ip       455.1.16       
                         49 97 49 6f  49 98 4a 70  4b 9a 49 73  48 9c 48 72  I.IoI.JpK.IsH.Hr       455.1.32       
                         4a 99 49 6f  49 98 49 70  49 9b 4a 71  49 9d 49 76  J.IoI.IpI.JqI.Iv       455.1.48       
                         49 9c 49 75  48 9a 48 76  49 98 49                  I.IuH.HvI.I            455.1.64       
  26.3     72452  ISOC   0c 8c c1 df  ad cd 83 6b  c7 cd 39 05  25 81 24 7e  .......k..9.%.$.       456.1.0        
                         24 82 23 7d  22 80 1d 7e  18 7f 16 7c  21 7f 38 78  $.#.".......!.8x       456.1.16       
                         4f 7d 67 7b  78 7f 80 7f  7f 82 81 7e  7b 7e 77 7c  O.g.x.........w.       456.1.32       
                         7a 7f 82 7e  7a 7f 53 7c  89 7d d6 80  fc 7f f5 7f  z...z.S.........       456.1.48       
                         d1 7d a5 7d  55 78 40 79  72 76 8b                  ....Ux@yrv.            456.1.64       
  26.3     79740  ISOC   0c 8d d3 f8  c8 cd bd 9a  d4 cd b9 05  52 90 9e 83  ............R...       457.1.0        
                         fe 77 fb 8e  c9 67 90 bb  82 6d 84 73  80 98 7f 6a  .w...g...m.s...j       457.1.16       
                         7e 9a 7c 6d  7a 9b 7d 6c  7d 96 65 6b  5b 8a cd 6f  ...mz..l..ek[..o       457.1.32       
                         f3 80 e7 73  e2 81 e8 74  ee 7f 45 78  6b 89 7a 6f  ...s...t..Exk.zo       457.1.48       
                         77 97 76 6e  74 96 77 69  6f 91 69                  w.vnt.wio.i            457.1.64       
  26.3     72212  ISOC   0c 8d d3 f8  c8 cd 41 ca  e1 cd 39 06  73 86 72 7b  ......A...9.s.r.       458.1.0        
                         72 83 73 7c  73 82 73 7c  76 80 76 7b  7a 81 7f 80  r.s.s.s.v.v.z...       458.1.16       
                         7e 7f 7b 7e  6c 81 50 7a  28 7f 3a 78  3d 7d 2d 7f  ....l.Pz(.:x=.-.       458.1.32       
                         1e 7e 18 7e  1d 7e 21 7c  24 80 28 7f  27 80 27 7c  ......!.$.(.'.'.       458.1.48       
                         27 80 27 7d  27 80 28 7d  2a 7f 29                  '.'.'.(.*.)            458.1.64       
  26.3     79964  ISOC   0c 8c bf 28  e4 cd 4a f9  ee cd b9 06  f4 80 f4 80  ...(..J.........       459.1.0        
                         f4 80 f4 80  f4 80 f4 80  f4 80 f4 80  f4 80 f0 7f  ................       459.1.16       
                         e8 7f e2 7f  e0 7f df 7f  dd 80 d7 7f  ca 7f c2 7f  ................       459.1.32       
                         ba 81 b0 80  aa 80 a4 7e  9d 80 97 7e  91 81 8c 7e  ................       459.1.48       
                         8b 81 8e 7e  97 80 9b 82  9d 7f a7                  ...........            459.1.64       
  26.3     71998  ISOC   0c 8c bf 28  e4 cd fb 28  fc cd 39 07  c5 70 bc 8e  ...(...(..9..p..       460.1.0        
                         b2 6d ae 8c  a4 6d a0 8d  9f 69 9c 8e  d4 80 bf 7c  .m...m...i......       460.1.16       
                         44 7e 13 7c  51 7f 8c 7f  7a 7d 92 7d  c2 7d e2 80  D...Q...z.......       460.1.32       
                         ef 7f ed 7f  e1 7e d0 7e  c2 7c ab 79  a4 7f ac 7e  ...........y....       460.1.48       
                         dc 81 7b 80  00 7f 1e 7d  29 80 29                  ........).)            460.1.64       
  26.3     79942  ISOC   0c 8d 33 40  ff cd 05 58  09 ce b9 07  4a 70 4a 9c  ..3@...X....JpJ.       461.1.0        
                         4a 70 49 9d  48 74 48 9c  49 6f 4a 9a  49 6e 48 9c  JpI.HtH.IoJ.InH.       461.1.16       
                         48 72 48 99  48 73 47 98  47 71 45 9b  46 70 47 9b  HrH.HsG.GqE.FpG.       461.1.32       
                         46 71 47 9a  46 74 45 99  45 6f 45 9a  47 73 46 9d  FqG.FtE.EoE.GsF.       461.1.48       
                         47 70 47 9b  47 70 47 99  46 73 46                  GpG.GpG.FsF            461.1.64       
  26.3     72204  ISOC   0c 8d 33 40  ff cd 57 87  16 ce 39 00  a8 79 c0 85  ..3@..W...9..y..       462.1.0        
                         aa 83 5e 82  2f 7e 00 7b  91 7d ff 85  b9 78 ae 80  ..^./........x..       462.1.16       
                         ae 78 91 7f  00 7b 1f 7d  f8 7e c5 7f  6d 79 87 83  .x..........my..       462.1.32       
                         5d 77 65 81  01 76 d5 86  9f 7b 00 7d  37 7a 48 82  ]we..v......7zH.       462.1.48       
                         2e 79 1c 7f  38 7a 59 7a  53 7a ef                  .y..8zYzSz.            462.1.64       
  26.3     79762  ISOC   0c 8c b9 71  1a ce 06 b7  23 ce b9 00  4e 9e 4c 70  ...q....#...N.Lp       463.1.0        
                         4c 9e 4b 70  4b 9d 4b 70  4b 9b 4b 6c  4b 99 4c 6e  L.KpK.KpK.KlK.Ln       463.1.16       
                         4b 9d 4b 6f  4b 9a 4a 6f  4b 9b 4c 70  4c 9b 4b 6f  K.KoK.JoK.LpL.Ko       463.1.32       
                         4a 9b 4a 6d  49 9a 49 6b  49 99 4a 6f  4a 9c 4a 71  J.JmI.IkI.JoJ.Jq       463.1.48       
                         4a 9d 4a 74  49 99 4a 71  4a 99 49                  J.JtI.JqJ.I            463.1.64       
  26.3     72430  ISOC   0c 8c b9 71  1a ce 22 e6  30 ce 39 01  8e 7d 8d 7f  ...q..".0.9.....       464.1.0        
                         8d 80 8e 7f  8e 80 8e 7f  8d 7d 8c 80  8a 7d 89 80  ................       464.1.16       
                         89 81 8a 7d  89 7f 89 7c  86 7f 83 7e  80 7f 7e 7f  ................       464.1.32       
                         7a 80 79 7d  75 7f 73 7b  6f 7e 6d 7a  6a 80 68 7b  z.y.u.s.o.mzj.h.       464.1.48       
                         62 83 65 7b  64 7d 62 7b  60 80 60                  b.e.d.b.`.`            464.1.64       
  26.3     79616  ISOC   0c 8d bd 88  35 ce be 15  3e ce b9 01  4a 9f 48 75  ....5...>...J.Hu       465.1.0        
                         48 9d 48 71  47 99 48 6f  49 98 49 70  48 98 4a 72  H.HqG.HoI.IpH.Jr       465.1.16       
                         4a 9c 4b 72  4a 9c 49 6e  48 9c 48 71  48 9c 48 6f  J.KrJ.InH.HqH.Ho       465.1.32       
                         4a 98 4b 71  49 9b 47 73  48 98 49 72  4a 9a 4a 73  J.KqI.GsH.IrJ.Js       465.1.48       
                         4a 9c 4b 71  4b 9c 4a 70  49 98 49                  J.KqK.JpI.I            465.1.64       
  26.3            RESET                                                                             466.1.0        
  26.0            CTL    01 0b 00 00  01 00 00 00                            SET INTERFACE          467.1.0        
