Bus Hound 6.01 capture on Windows Vista Service Pack 1 (x86). Complements of www.perisoft.net

abc

  Device - Device ID (followed by the endpoint for USB devices)
            (17) USB  ‰»Î…Ë±∏
            (18) HID-compliant device
            (31) HID-compliant device
            (34) USB Mass Storage Device
            (35) USB Disk    Flash [ROM=1.00]
  Phase  - Phase Type
            CTL   USB control transfer       
            IN    Data in transfer           
            OUT   Data out transfer          
            USTS  USB status                 
  Data   - Hex dump of the data transferred
  Descr  - Description of the phase
  Delta  - Elapsed time from the previous phase to the current phase
  Cmd... - Position in the captured data
  Driver - Driver that submitted the command
            ntkrnlpa     : NT Kernel & System 6.1.7601.23807 (win7sp1_ldr.170512-0600)
            hidclass     : Hid Class Library 6.1.7601.18199 (win7sp1_gdr.130702-1534)


Device  Phase  Data                                                Description       Delta  Cmd.Phase.Ofs(rep)  Driver      
------  -----  --------------------------------------------------  ----------------  -----  ------------------  ------------
  17.0  CTL    80 06 01 03  09 04 02 01                            GET DESCRIPTOR    3.4sc         1.1.0        ntkrnlpa      
  17.0  IN     26 03 53 00  54 00 4d 00  69 00 63 00  72 00 6f 00  &.S.T.M.i.c.r.o.  172us         1.2.0                      
               65 00 6c 00  65 00 63 00  74 00 72 00  6f 00 6e 00  e.l.e.c.t.r.o.n.                1.2.16                     
               69 00 63 00  73 00                                  i.c.s.                          1.2.32                     
  17.0  CTL    80 06 02 03  09 04 02 01                            GET DESCRIPTOR     91us         2.1.0        ntkrnlpa      
  17.0  IN     32 03 50 00  4c 00 43 00  20 00 55 00  53 00 42 00  2.P.L.C. .U.S.B.  149us         2.2.0                      
               20 00 48 00  49 00 44 00  20 00 56 00  45 00 52 00   .H.I.D. .V.E.R.                2.2.16                     
               31 00 00 00  00 00 00 00  00 00 00 00  00 00 00 00  1...............                2.2.32                     
               00 00                                               ..                              2.2.48                     
  17.0  CTL    80 06 79 03  09 04 82 00                            GET DESCRIPTOR    126us         3.1.0        ntkrnlpa      
  17.0  USTS   c0000004                                            stall pid         146us         3.2.0                      
  17.3  OUT    05 ff 55 53  42 45 41 00  00 00 00 00  00 00 00 00  ..USBEA.........   27ms         4.1.0        unknown       
               00 00 00 00  00 00 00 00  00 00 00 00  00 00 00 00  ................                4.1.16                     
               00 00 00 00  00 00 00 00  00 00 00 00  00 00 00 00  ................                4.1.32                     
               00 00 00 00  00 00 00 00  00 00 00 00  00 00 00 00  ................                4.1.48                     
  18    OUT    00 05 ff 55  53 42 45 41  00 00 00 00  00 00 00 00  ...USBEA........    5us         5.1.0        unknown       
               00 00 00 00  00 00 00 00  00 00 00 00  00 00 00 00  ................                5.1.16                     
               00 00 00 00  00 00 00 00  00 00 00 00  00 00 00 00  ................                5.1.32                     
               00 00 00 00  00 00 00 00  00 00 00 00  00 00 00 00  ................                5.1.48                     
               00                                                  .                               5.1.64                     
  17.2  IN     04 ff 02 02  30 34 45 03  45 34 32 34  30 30 30 30  ....04E.E4240000  1.0ms         6.1.0        hidclass      
               30 30 30 30  30 30 30 31  46 30 30 31  38 30 30 30  00000001F0018000                6.1.16                     
               30 30 30 30  41 30 30 30  30 30 30 32  38 30 30 30  0000A00000028000                6.1.32                     
               31 30 30 33  31 30 30 30  39 30 30 33  30 30 30 30  1003100090030000                6.1.48                     
  18    IN     00 04 ff 02  02 30 34 45  03 45 34 32  34 30 30 30  .....04E.E424000    6us         7.1.0        unknown       
               30 30 30 30  30 30 30 30  31 46 30 30  31 38 30 30  000000001F001800                7.1.16                     
               30 30 30 30  30 41 30 30  30 30 30 30  32 38 30 30  00000A0000002800                7.1.32                     
               30 31 30 30  33 31 30 30  30 39 30 30  33 30 30 30  0100310009003000                7.1.48                     
               30                                                  0                               7.1.64                     
  17.3  OUT    01 00 05 00  00 00 00 00  00 00 00 00  00 00 00 00  ................   43ms         8.1.0        unknown       
               00 00 00 00  00 00 00 00  00 00 00 00  00 00 00 00  ................                8.1.16                     
               00 00 00 00  00 00 00 00  00 00 00 00  00 00 00 00  ................                8.1.32                     
               00 00 00 00  00 00 00 00  00 00 00 00  00 00 00 00  ................                8.1.48                     
  18    OUT    00 01 00 05  00 00 00 00  00 00 00 00  00 00 00 00  ................    6us         9.1.0        unknown       
               00 00 00 00  00 00 00 00  00 00 00 00  00 00 00 00  ................                9.1.16                     
               00 00 00 00  00 00 00 00  00 00 00 00  00 00 00 00  ................                9.1.32                     
               00 00 00 00  00 00 00 00  00 00 00 00  00 00 00 00  ................                9.1.48                     
               00                                                  .                               9.1.64                     
  17.2  IN     01 02 06 ff  30 34 45 03  45 34 32 34  30 30 30 30  ....04E.E4240000  986us        10.1.0        hidclass      
               30 30 30 30  30 30 30 31  46 30 30 31  38 30 30 30  00000001F0018000               10.1.16                     
               30 30 30 30  41 30 30 30  30 30 30 32  38 30 30 30  0000A00000028000               10.1.32                     
               31 30 30 33  31 30 30 30  39 30 30 33  30 30 30 30  1003100090030000               10.1.48                     
  18    IN     00 01 02 06  ff 30 34 45  03 45 34 32  34 30 30 30  .....04E.E424000    7us        11.1.0        unknown       
               30 30 30 30  30 30 30 30  31 46 30 30  31 38 30 30  000000001F001800               11.1.16                     
               30 30 30 30  30 41 30 30  30 30 30 30  32 38 30 30  00000A0000002800               11.1.32                     
               30 31 30 30  33 31 30 30  30 39 30 30  33 30 30 30  0100310009003000               11.1.48                     
               30                                                  0                              11.1.64                     
  17.3  OUT    0d 00 02 45  30 30 30 45  30 32 30 32  03 45 31 00  ...E000E0202.E1.   24ms        12.1.0        unknown       
               00 00 00 00  00 00 00 00  00 00 00 00  00 00 00 00  ................               12.1.16                     
               00 00 00 00  00 00 00 00  00 00 00 00  00 00 00 00  ................               12.1.32                     
               00 00 00 00  00 00 00 00  00 00 00 00  00 00 00 00  ................               12.1.48                     
  18    OUT    00 0d 00 02  45 30 30 30  45 30 32 30  32 03 45 31  ....E000E0202.E1    7us        13.1.0        unknown       
               00 00 00 00  00 00 00 00  00 00 00 00  00 00 00 00  ................               13.1.16                     
               00 00 00 00  00 00 00 00  00 00 00 00  00 00 00 00  ................               13.1.32                     
               00 00 00 00  00 00 00 00  00 00 00 00  00 00 00 00  ................               13.1.48                     
               00                                                  .                              13.1.64                     
  17.2  IN     08 02 02 30  46 36 32 03  45 31 32 34  30 30 30 30  ...0F62.E1240000  4.0ms        14.1.0        hidclass      
               30 30 30 30  30 30 30 31  46 30 30 31  38 30 30 30  00000001F0018000               14.1.16                     
               30 30 30 30  41 30 30 30  30 30 30 32  38 30 30 30  0000A00000028000               14.1.32                     
               31 30 30 33  31 30 30 30  39 30 30 33  30 30 30 30  1003100090030000               14.1.48                     
  18    IN     00 08 02 02  30 46 36 32  03 45 31 32  34 30 30 30  ....0F62.E124000    7us        15.1.0        unknown       
               30 30 30 30  30 30 30 30  31 46 30 30  31 38 30 30  000000001F001800               15.1.16                     
               30 30 30 30  30 41 30 30  30 30 30 30  32 38 30 30  00000A0000002800               15.1.32                     
               30 31 30 30  33 31 30 30  30 39 30 30  33 30 30 30  0100310009003000               15.1.48                     
               30                                                  0                              15.1.64                     
  17.3  OUT    0d 00 02 45  30 30 30 45  43 41 30 32  03 30 33 00  ...E000ECA02.03.   35ms        16.1.0        unknown       
               00 00 00 00  00 00 00 00  00 00 00 00  00 00 00 00  ................               16.1.16                     
               00 00 00 00  00 00 00 00  00 00 00 00  00 00 00 00  ................               16.1.32                     
               00 00 00 00  00 00 00 00  00 00 00 00  00 00 00 00  ................               16.1.48                     
  18    OUT    00 0d 00 02  45 30 30 30  45 43 41 30  32 03 30 33  ....E000ECA02.03    5us        17.1.0        unknown       
               00 00 00 00  00 00 00 00  00 00 00 00  00 00 00 00  ................               17.1.16                     
               00 00 00 00  00 00 00 00  00 00 00 00  00 00 00 00  ................               17.1.32                     
               00 00 00 00  00 00 00 00  00 00 00 00  00 00 00 00  ................               17.1.48                     
               00                                                  .                              17.1.64                     
  17.2  IN     08 02 02 38  31 33 45 03  45 34 32 34  30 30 30 30  ...813E.E4240000  3.9ms        18.1.0        hidclass      
               30 30 30 30  30 30 30 31  46 30 30 31  38 30 30 30  00000001F0018000               18.1.16                     
               30 30 30 30  41 30 30 30  30 30 30 32  38 30 30 30  0000A00000028000               18.1.32                     
               31 30 30 33  31 30 30 30  39 30 30 33  30 30 30 30  1003100090030000               18.1.48                     
  18    IN     00 08 02 02  38 31 33 45  03 45 34 32  34 30 30 30  ....813E.E424000    7us        19.1.0        unknown       
               30 30 30 30  30 30 30 30  31 46 30 30  31 38 30 30  000000001F001800               19.1.16                     
               30 30 30 30  30 41 30 30  30 30 30 30  32 38 30 30  00000A0000002800               19.1.32                     
               30 31 30 30  33 31 30 30  30 39 30 30  33 30 30 30  0100310009003000               19.1.48                     
               30                                                  0                              19.1.64                     

C:\Python\Python34\python.exe E:/MyWorkPlace/pythonwork/local_projects/pywinusb/plc_usb_hid/usbhid_write_send_report.py
2017-06-24 17:39:59,474 usbhid_write_send_report.py[line:111] INFO: the follow parameter packed:stx: [2]: function code: [69, 48, 48]; start address: [54, 69, 69, 48]; data lengh: [52, 48];write data: None; etx: [3]; check sum: [70, 67]
2017-06-24 17:39:59,474 usbhid_write_send_report.py[line:184] INFO: usb hid start at Sat Jun 24 17:39:59 2017
2017-06-24 17:39:59,482 usbhid_write_send_report.py[line:27] INFO: hid device opened:DIGITAL MODULE VER1
2017-06-24 17:39:59,483 usbhid_write_send_report.py[line:195] INFO: send list: lenth=65,data=[0, 13, 0, 2, 69, 48, 48, 54, 69, 69, 48, 52, 48, 3, 70, 67, 0, 0, 0, 0, 0, 0, 0, 0, 0, 0, 0, 0, 0, 0, 0, 0, 0, 0, 0, 0, 0, 0, 0, 0, 0, 0, 0, 0, 0, 0, 0, 0, 0, 0, 0, 0, 0, 0, 0, 0, 0, 0, 0, 0, 0, 0, 0, 0, 0]
2017-06-24 17:39:59,518 usbhid_write_send_report.py[line:198] INFO: send result=True
2017-06-24 17:39:59,518 usbhid_write_send_report.py[line:47] INFO: received:lengh=1, data=[[0, 62, 2, 2, 50, 55, 48, 70, 51, 51, 48, 70, 54, 55, 48, 67, 54, 70, 48, 67, 69, 55, 48, 48, 69, 49, 48, 48, 53, 56, 48, 65, 52, 68, 48, 65, 65, 69, 48, 55, 65, 67, 48, 54, 54, 67, 48, 55, 65, 57, 48, 54, 68, 55, 48, 54, 65, 56, 48, 54, 49, 57, 48, 55, 49]]
2017-06-24 17:39:59,533 usbhid_write_send_report.py[line:47] INFO: received:lengh=2, data=[[0, 62, 2, 2, 50, 55, 48, 70, 51, 51, 48, 70, 54, 55, 48, 67, 54, 70, 48, 67, 69, 55, 48, 48, 69, 49, 48, 48, 53, 56, 48, 65, 52, 68, 48, 65, 65, 69, 48, 55, 65, 67, 48, 54, 54, 67, 48, 55, 65, 57, 48, 54, 68, 55, 48, 54, 65, 56, 48, 54, 49, 57, 48, 55, 49], [0, 62, 2, 55, 48, 55, 68, 66, 53, 68, 54, 54, 70, 70, 49, 56, 51, 67, 65, 67, 70, 70, 67, 65, 67, 51, 51, 67, 48, 48, 53, 67, 49, 51, 50, 65, 48, 48, 48, 48, 48, 48, 48, 48, 48, 48, 48, 48, 48, 48, 48, 48, 48, 48, 51, 54, 48, 48, 48, 48, 48, 48, 48, 49, 48]]
2017-06-24 17:39:59,533 usbhid_write_send_report.py[line:47] INFO: received:lengh=3, data=[[0, 62, 2, 2, 50, 55, 48, 70, 51, 51, 48, 70, 54, 55, 48, 67, 54, 70, 48, 67, 69, 55, 48, 48, 69, 49, 48, 48, 53, 56, 48, 65, 52, 68, 48, 65, 65, 69, 48, 55, 65, 67, 48, 54, 54, 67, 48, 55, 65, 57, 48, 54, 68, 55, 48, 54, 65, 56, 48, 54, 49, 57, 48, 55, 49], [0, 62, 2, 55, 48, 55, 68, 66, 53, 68, 54, 54, 70, 70, 49, 56, 51, 67, 65, 67, 70, 70, 67, 65, 67, 51, 51, 67, 48, 48, 53, 67, 49, 51, 50, 65, 48, 48, 48, 48, 48, 48, 48, 48, 48, 48, 48, 48, 48, 48, 48, 48, 48, 48, 51, 54, 48, 48, 48, 48, 48, 48, 48, 49, 48], [0, 8, 2, 48, 48, 49, 48, 48, 3, 54, 68, 54, 70, 70, 49, 56, 51, 67, 65, 67, 70, 70, 67, 65, 67, 51, 51, 67, 48, 48, 53, 67, 49, 51, 50, 65, 48, 48, 48, 48, 48, 48, 48, 48, 48, 48, 48, 48, 48, 48, 48, 48, 48, 48, 51, 54, 48, 48, 48, 48, 48, 48, 48, 49, 48]]
2017-06-24 17:39:59,583 usbhid_write_send_report.py[line:138] INFO: new hid data: lengh=132, data=[0, 132, 2, 2, 50, 55, 48, 70, 51, 51, 48, 70, 54, 55, 48, 67, 54, 70, 48, 67, 69, 55, 48, 48, 69, 49, 48, 48, 53, 56, 48, 65, 52, 68, 48, 65, 65, 69, 48, 55, 65, 67, 48, 54, 54, 67, 48, 55, 65, 57, 48, 54, 68, 55, 48, 54, 65, 56, 48, 54, 49, 57, 48, 55, 49, 55, 48, 55, 68, 66, 53, 68, 54, 54, 70, 70, 49, 56, 51, 67, 65, 67, 70, 70, 67, 65, 67, 51, 51, 67, 48, 48, 53, 67, 49, 51, 50, 65, 48, 48, 48, 48, 48, 48, 48, 48, 48, 48, 48, 48, 48, 48, 48, 48, 48, 48, 51, 54, 48, 48, 48, 48, 48, 48, 48, 49, 48, 48, 48, 49, 48, 48, 3, 54, 68]
[3879, 3891, 3175, 3183, 231, 225, 2648, 2637, 1966, 1708, 1900, 1705, 1751, 1704, 1817, 1815, 24027, 65382, 15384, 65452, 50122, 60, 4956, 42, 0, 0, 0, 0, 54, 0, 1, 1]
2017-06-24 17:39:59,588 usbhid_write_send_report.py[line:201] INFO: received new hid data=[3879, 3891, 3175, 3183, 231, 225, 2648, 2637, 1966, 1708, 1900, 1705, 1751, 1704, 1817, 1815, 24027, 65382, 15384, 65452, 50122, 60, 4956, 42, 0, 0, 0, 0, 54, 0, 1, 1]
2017-06-24 17:40:01,493 usbhid_write_send_report.py[line:35] INFO: hid device closed:DIGITAL MODULE VER1
2017-06-24 17:40:01,493 usbhid_write_send_report.py[line:217] INFO: usb hid end at Sat Jun 24 17:40:01 2017